trisodium nitrilotriacetate,non OECD,https://ec.europa.eu/health/scientific_committees/consumer_safety/docs/sccs_o_046.pdf,in vivo,"in comparison to the control group, the two forms of nta resulted in comparable decreases in growth rate during the exposure phase of the study, these animals gained more weight during the recovery phase.",,,,,,,"both forms induced vacuolation and hyperplasia often composed of vacuolated cells in the epithelium of the proximal convoluted tubules. these effects were noted in all of the exposed animals although the extent of damage varied. tubular vacuolation was evident in each animal of the NTA groups, but was absent in the control groups and in the recovery groups indicating complete recovery. the total incidence of (simple) basophilic cell hyperplasia was greater in the nta groups than in control groups after treatment and recovery period. tubules that had a diameter more than twice of that of a normal proximal convoluted tubule were classified as tubular hyperplastic nodules of the vacuolated cell type. nodular basophilic cell hyperplasia was only seen in treated groups and was absent in the control and recovery groups. pelvic epithelial and subepithelial inflammation and fibrosis were observed in the groups given either form of nta for 49 days. mild to severe hyperplasia of the transitional epithelium (TE) in the renal pelvis occurred in 4/7 animals given diets containing NTA.H2O and moderate TE hyperplasia was observed in 1/8 rats given H3NTA in the diet. animals with TE hyperplasia also exhibited pelvic dilation and TE erosion, ulceration and haemorrhage. TE dysplasia, intracytoplasmic globules, and mitotic figures were also noted. tissues from recovery animals showed no abnormal cellular morphology in the pelvic urothelium in the presence of persisting hydronephrosis.",,92,"noael for non-cancer endpoints, mg/kg bw/d",,no,,"nta treatment was related to vacuolation, simple and nodular hyperplasia of the vacuolated cell type and the basophilic cell type in the proximal convoluted tubules, and transitional cell erosion, ulceration, hyperplasia and dysplasia associated with hydronephrosis in the renal pelvis. nodular hyperplasias and urothelium lesions were shown to be reversible within this model, whereas simple basophilic hyperplasia of tubules and pelvic hydronephosis persisted. vacuolation and basophilia of tubular cells with or without increased cell size is known to be a response to tubular injury. lesions observed at the pelvis area are also characteristic for degenerative and regenerative response of urothelial cells. the authors discussed the higher incidence of basophilic cell hyperplasia being nonspecific and related to spontaneous age-related nephrosis. they were considered to be exacerbated by the ingestion of high doses of nta. although no data were reported for the acclimatisation period, it is assumed that rats were about 8 ± 2 weeks at the start of the study. at the end of study, rats were about 15 ± 2 weeks old. therefore the role of spontaneous chronic progressive nephropathy of the old rat could not be clarified at this relatively young age and by the low number of animals (males only) examined. with respect to the renal damage, no noael was established  the loaels were 2% NTA.H2O (appr. 1309 mg/kg bw/d) and 1.5% H3NTA (appr. 1050 mg/kg bw/d).",,,,,2; 1.5,,,,,,test substance: NTA.H2O / H3NTA,rat/sprague-dawley,,8 ± 2 ,weeks,m,,,,6-->8,"0, 1309; 1050",mg/kg bw/day NTA.H2O 73 μmol/g; mg/kg bw/day H3NTA 79 μmol/g,,daily,yes,,,,,,,,,,,,,49; 49 + 35,,no,"effects on the urinary tract: the organ system that was mainly affected by repeated oral treatment with NTA is the urinary tract with lesions at several sites: in the kidneys, ureters and urinary bladder. histomorphologic kidney lesions were discovered at several segments: the cortex area, the renal papilla and the renal pelvis. the epithelium of the proximal convoluted tubules of the cortex region was found to be primarily affected. another target tissue was the transitional cell epithelium (urothelium) of the renal pelvis, the ureters and the urinary bladder. gross findings after repeated administration were red-brown discoloured urine, enlarged kidneys, increased kidney to body ratio, discoloured kidneys, rough surface of the kidneys, hydronephrosis (pelvic dilation) and dilated ureters. one of the predominant microscopic lesions induced by nta occurred primarily in the proximal tubules of the cortex region and was consistently reported as vacuolisation (of non-hyperplastic epithelial cells), degeneration of the tubular epithelium, and simple and nodular hyperplasia of the tubules. tubular hyperplasia was reported to be frequently associated with vacuolisation of tubular cells. There also were basophilic (regenerative) hyperplasias without cellular vacuolation. erosion/ulceration and hyperplasia of the transitional cell epithelium were observed in the renal pelvis. in studies with sequential sacrifices every fourth day, development of pelvic lesion started later and at a higher dose than tubular damage. after 7 weeks of nta treatment, transitional cells also appeared to be dysplastic, and showed intracytoplasmic globules, and mitotic figures. lesions at these two main loci may be associated to secondary responses as a sequelae to the epithelial cytotoxity. they consisted of inflammation (interstitial or subepithelial), haemorrhage, fibrosis, dilatation of tubules and collection ducts, and tubular mineralisation of these lesions. ultrastructurally, cellular lesions in the tubules were characterised as swelling, vacuolar degeneration of cytoplasmatic organels (endoplasmatic reticulum, mitochondria) and cell lysis(ref.1). the eu rar report on trisodium nitrilotriacetate (1) summarized the noaels and loaels from the oral repeated dose rat and mice studies. the estimated noaels varied from 10 mg/kg bw/day (10 week rat study) to 169 mg/kg bw/day (18 months + 3 months recovery mouse study). the estimated loaels varied from 97 mg/kg bw/day (2 year rat study) to 1400 (4 week rat study). it is proposed to use a noael of 92 mg/kg bw/day for non-cancer endpoint. this noael is derived from the 24 month cancer study (41). a nta concentration applied as 2.5% nta aqueous solution (2 ml, ≈ 50 mg/kg bw/d) was without irritation thus representing the noael for local effects on the rabbit  dermis. sccs concurs in a noael of 92 mg/kg bw/day for non-cancer endpoint after oral administration. ",11,,group of animals received control diet,2,invesigation of the reversibility of nta-associated nephrotoxicity. ,
trisodium nitrilotriacetate,non OECD,https://ec.europa.eu/health/scientific_committees/consumer_safety/docs/sccs_o_046.pdf,in vivo,no difference in total body weight or weight gain was observed in 0.01 and 0.1% levels of nta in the drinking water after ten weeks of treatment,, ,,"urine volume of any of the nta test groups did not differ from controls, but glycosuria was present in 5/7 of rats receiving 1% nta.", mean fasting blood glucose levels were elevated in all groups receiving NTA comparing to control values. the increased glucose levels at all doses were considered as treatment-related but not clearly adverse.,at 0.1% nta the relative kidney weight was elevated.,"histology of the organs examined did not differ from that of control animals. in contrast, kidneys from the 1% NTA group showed marked vacuolization of renal tubules. brain and pancreas of these animals were not examined microscopically, livers were normal. ",,92,"noael for non-cancer endpoints, mg/kg bw/d",,yes,"there was one early death in the mid dose group and a high mortality rate in the high dose group. six animals died within four weeks, and remaining animals appeared moribund and were killed. ",the noael limited to the parameters of this test was 0.01% (approx. 10 mg/kg bw/day).,,,,,"0.01, 0.1, 1",,,,,,,rat/sprague-dawley ,,,,m,,,,9,"0,10, 100, 1000 ",mg/kg bw/d,,daily ,yes,,,,,,,,,drinking water,,,,70,,no,"effects on the urinary tract: the organ system that was mainly affected by repeated oral treatment with NTA is the urinary tract with lesions at several sites: in the kidneys, ureters and urinary bladder. histomorphologic kidney lesions were discovered at several segments: the cortex area, the renal papilla and the renal pelvis. the epithelium of the proximal convoluted tubules of the cortex region was found to be primarily affected. another target tissue was the transitional cell epithelium (urothelium) of the renal pelvis, the ureters and the urinary bladder. gross findings after repeated administration were red-brown discoloured urine, enlarged kidneys, increased kidney to body ratio, discoloured kidneys, rough surface of the kidneys, hydronephrosis (pelvic dilation) and dilated ureters. one of the predominant microscopic lesions induced by nta occurred primarily in the proximal tubules of the cortex region and was consistently reported as vacuolisation (of non-hyperplastic epithelial cells), degeneration of the tubular epithelium, and simple and nodular hyperplasia of the tubules. tubular hyperplasia was reported to be frequently associated with vacuolisation of tubular cells. There also were basophilic (regenerative) hyperplasias without cellular vacuolation. erosion/ulceration and hyperplasia of the transitional cell epithelium were observed in the renal pelvis. in studies with sequential sacrifices every fourth day, development of pelvic lesion started later and at a higher dose than tubular damage. after 7 weeks of nta treatment, transitional cells also appeared to be dysplastic, and showed intracytoplasmic globules, and mitotic figures. lesions at these two main loci may be associated to secondary responses as a sequelae to the epithelial cytotoxity. they consisted of inflammation (interstitial or subepithelial), haemorrhage, fibrosis, dilatation of tubules and collection ducts, and tubular mineralisation of these lesions. ultrastructurally, cellular lesions in the tubules were characterised as swelling, vacuolar degeneration of cytoplasmatic organels (endoplasmatic reticulum, mitochondria) and cell lysis(ref.1). the eu rar report on trisodium nitrilotriacetate (1) summarized the noaels and loaels from the oral repeated dose rat and mice studies. the estimated noaels varied from 10 mg/kg bw/day (10 week rat study) to 169 mg/kg bw/day (18 months + 3 months recovery mouse study). the estimated loaels varied from 97 mg/kg bw/day (2 year rat study) to 1400 (4 week rat study). it is proposed to use a noael of 92 mg/kg bw/day for non-cancer endpoint. this noael is derived from the 24 month cancer study (41). a nta concentration applied as 2.5% nta aqueous solution (2 ml, ≈ 50 mg/kg bw/d) was without irritation thus representing the noael for local effects on the rabbit  dermis. sccs concurs in a noael of 92 mg/kg bw/day for non-cancer endpoint after oral administration. ",12,,,2,10 weeks,
trisodium nitrilotriacetate,non OECD,https://ec.europa.eu/health/scientific_committees/consumer_safety/docs/sccs_o_046.pdf,in vivo,weight gain did not differ among any of the groups.,,,,,at 0.05% and 0.1% levels of nta blood glucose levels are significantly elevated above control values. blood urea nitrogen did not differ among any of the groups.,"kidneys, ureters and urinary bladder",,,92,"noael for non-cancer endpoints, mg/kg bw/d",,yes,in the 0.1% nta group two rats died before the end of the ten-week period.,the noael for effects on blood level on glucose was 0.01% NTA (approx. 10 mg/kg bw/day).,,,,,"0, 0.01, 0.05, 0.1",,,,,,,rat/charles river cd sprague-dawley derived,,,,m,,,,25,"0, 10, 50, 100 ",mg/kg bw/d,,daily,yes,,,,,,,,,deionized drinking water,,,,70,,no,"effects on the urinary tract: the organ system that was mainly affected by repeated oral treatment with NTA is the urinary tract with lesions at several sites: in the kidneys, ureters and urinary bladder. histomorphologic kidney lesions were discovered at several segments: the cortex area, the renal papilla and the renal pelvis. the epithelium of the proximal convoluted tubules of the cortex region was found to be primarily affected. another target tissue was the transitional cell epithelium (urothelium) of the renal pelvis, the ureters and the urinary bladder. gross findings after repeated administration were red-brown discoloured urine, enlarged kidneys, increased kidney to body ratio, discoloured kidneys, rough surface of the kidneys, hydronephrosis (pelvic dilation) and dilated ureters. one of the predominant microscopic lesions induced by nta occurred primarily in the proximal tubules of the cortex region and was consistently reported as vacuolisation (of non-hyperplastic epithelial cells), degeneration of the tubular epithelium, and simple and nodular hyperplasia of the tubules. tubular hyperplasia was reported to be frequently associated with vacuolisation of tubular cells. There also were basophilic (regenerative) hyperplasias without cellular vacuolation. erosion/ulceration and hyperplasia of the transitional cell epithelium were observed in the renal pelvis. in studies with sequential sacrifices every fourth day, development of pelvic lesion started later and at a higher dose than tubular damage. after 7 weeks of nta treatment, transitional cells also appeared to be dysplastic, and showed intracytoplasmic globules, and mitotic figures. lesions at these two main loci may be associated to secondary responses as a sequelae to the epithelial cytotoxity. they consisted of inflammation (interstitial or subepithelial), haemorrhage, fibrosis, dilatation of tubules and collection ducts, and tubular mineralisation of these lesions. ultrastructurally, cellular lesions in the tubules were characterised as swelling, vacuolar degeneration of cytoplasmatic organels (endoplasmatic reticulum, mitochondria) and cell lysis(ref.1). the eu rar report on trisodium nitrilotriacetate (1) summarized the noaels and loaels from the oral repeated dose rat and mice studies. the estimated noaels varied from 10 mg/kg bw/day (10 week rat study) to 169 mg/kg bw/day (18 months + 3 months recovery mouse study). the estimated loaels varied from 97 mg/kg bw/day (2 year rat study) to 1400 (4 week rat study). it is proposed to use a noael of 92 mg/kg bw/day for non-cancer endpoint. this noael is derived from the 24 month cancer study (41). a nta concentration applied as 2.5% nta aqueous solution (2 ml, ≈ 50 mg/kg bw/d) was without irritation thus representing the noael for local effects on the rabbit  dermis. sccs concurs in a noael of 92 mg/kg bw/day for non-cancer endpoint after oral administration. ",12,,,2,10 weeks ,
trisodium nitrilotriacetate,non OECD,https://ec.europa.eu/health/scientific_committees/consumer_safety/docs/sccs_o_046.pdf,in vivo,"the feeding did not affect food consumption, feed efficiency, or growth of any test group during the first 8 weeks of the study (no further record thereafter). ",,,,a statistically significant increase in urinary zinc was intermittently noted in some rat groups receiving diets containing 0.15% and 0.5% nta.,,"liver body weight ratios were significantly higher than control values at 12 months for females receiving diets containing 0.5% nta.  in comparison to the control values, there was also a significant increase in the zinc level of bone in all test groups at nearly all check points during the experiment. the nta deposition in the bone increased related to the dose, remaining constant during treatment and without any difference between sexes. the breaking strength of the bones from treated rats was not significantly altered from that of the control animals.","additional tissues taken for histologic examination after 19 and 24 months were spleen, liver, lung, heart, stomach, esophagus, small intestine, adrenal, trachea, urinary bladder, gonads, thyroid and bone (however no data were reported on the absence of evidence of abnormalities in these organs). the femurs were analysed for Zn and nta content and other parameters (dry and ash weight, percent ash, fat phosphorus, copper, magnesium, calcium).  no differences were noted microscopically in bones from test and control animals. in mid and high dose animals, lesions started at 6 months in 1 or 2 animals/group consisting of hydropic degeneration of the tubule and minor tubule dilatation. at 12 months they were still considered to be mild, although they were more pronounced and were apparently test related since 4/10 animals were affected by the 0.5% nta and 1/10 by the 0.15% nta dietary level. in addition to early changes tubular dilatation with low basophilic epithelium, hemosiderin in the tubular epithelium and proteinaceous casts in the collecting tubules were also apparent. the rats fed 0.03% nta did not exhibit these lesions and showed no differences from the control animals. at 24 months, moderate to severe chronic interstitial nephritis and nephrosis were observed with dose-related increase of incidence and severity in the mid and high dose groups of nta fed males and females (total incidence 42% and 55%). chronic renal lesions observed in 32% of the 0.03% nta groups did not show significant differences from that of control animals (28%). tumors of various types were reported to be similar for all groups and were considered not to be related to the treatment groups (details of incidences absent except for mammary gland tumors).",,92,"noael for non-cancer endpoints, mg/kg bw/d",kidney & urinary tract ,yes,"there was a dose related trend in survival rates in dosed nta-males, the survival rate was significantly lower in the high dose group.",the noael for renal toxicity was 0.03% NTA in diet (19 mg/kg bw/day) in this 2-year study,,,,,"0, 0.03, 0.15, 0.5,  0.5; 0.5",,92.2,,,,test substance:nta; calcium chelate of nta (CaNaNTA),rat/sprague-dawley,,,,f & m,,,,,"0, 19, 97, 322; 0.5",mg/kg bw/day; % of the calcium chelate of NTA,,daily,yes,,,,,,,,,,,,,730,,no,"effects on the urinary tract: the organ system that was mainly affected by repeated oral treatment with NTA is the urinary tract with lesions at several sites: in the kidneys, ureters and urinary bladder. histomorphologic kidney lesions were discovered at several segments: the cortex area, the renal papilla and the renal pelvis. the epithelium of the proximal convoluted tubules of the cortex region was found to be primarily affected. another target tissue was the transitional cell epithelium (urothelium) of the renal pelvis, the ureters and the urinary bladder. gross findings after repeated administration were red-brown discoloured urine, enlarged kidneys, increased kidney to body ratio, discoloured kidneys, rough surface of the kidneys, hydronephrosis (pelvic dilation) and dilated ureters. one of the predominant microscopic lesions induced by nta occurred primarily in the proximal tubules of the cortex region and was consistently reported as vacuolisation (of non-hyperplastic epithelial cells), degeneration of the tubular epithelium, and simple and nodular hyperplasia of the tubules. tubular hyperplasia was reported to be frequently associated with vacuolisation of tubular cells. There also were basophilic (regenerative) hyperplasias without cellular vacuolation. erosion/ulceration and hyperplasia of the transitional cell epithelium were observed in the renal pelvis. in studies with sequential sacrifices every fourth day, development of pelvic lesion started later and at a higher dose than tubular damage. after 7 weeks of nta treatment, transitional cells also appeared to be dysplastic, and showed intracytoplasmic globules, and mitotic figures. lesions at these two main loci may be associated to secondary responses as a sequelae to the epithelial cytotoxity. they consisted of inflammation (interstitial or subepithelial), haemorrhage, fibrosis, dilatation of tubules and collection ducts, and tubular mineralisation of these lesions. ultrastructurally, cellular lesions in the tubules were characterised as swelling, vacuolar degeneration of cytoplasmatic organels (endoplasmatic reticulum, mitochondria) and cell lysis(ref.1). the eu rar report on trisodium nitrilotriacetate (1) summarized the noaels and loaels from the oral repeated dose rat and mice studies. the estimated noaels varied from 10 mg/kg bw/day (10 week rat study) to 169 mg/kg bw/day (18 months + 3 months recovery mouse study). the estimated loaels varied from 97 mg/kg bw/day (2 year rat study) to 1400 (4 week rat study). it is proposed to use a noael of 92 mg/kg bw/day for non-cancer endpoint. this noael is derived from the 24 month cancer study (41). a nta concentration applied as 2.5% nta aqueous solution (2 ml, ≈ 50 mg/kg bw/d) was without irritation thus representing the noael for local effects on the rabbit  dermis. sccs concurs in a noael of 92 mg/kg bw/day for non-cancer endpoint after oral administration. ",13,,,3,"2 years. two test substances. at 6, 12, 19 and 24 months, 5 animals of either sex were randomly selected for metabolic and histological studies of kidney lesions.",
"toluene-2,5-diamine and its sulfate",non OECD,https://ec.europa.eu/health/scientific_committees/consumer_safety/docs/sccs_o_052.pdf,in vivo,no treatment related clinical observations were recorded and body weight and food intake were not changed.,,,no haematological parameters were altered,,"several biochemistry parameters were influenced at and above 30 mg/kg bw/d (ast, cpk, ldh, alt (only at 60 mg/kg bw/d))",at necropsy no macroscopic abnormalities were noted. the mean absolute and relative (to body weight) liver weights of both sexes at 60 and males only at 30 mg/kg bw/d were increased.,"myocyte degeneration was noted in the heart, skeletal muscle, tongue and diaphragm in both sexes in all dose groups",muscle degeneration,15,noael mg/kg bw/day,"heart, skeletal muscle, tongue and diaphragm",yes,one animal died after blood withdrawal which was not associated with the test substance.,"treatment-related myofiber necrosis, degeneration, and/or inflammatory change were present in skeletal muscle, tongue, and diaphragm of both males and females given 30 or 60 mg/kg bw/d in this study and that the noael for muscle degenerative change in this study was 15 mg/kg bw/d.",,,,,,,99.7,,,ch 1143,"test substance: toluene-2,5-diamine sulfate",rat/sprague-dawley crl:cd(sd)br,,,,f & m,,,,20,"0, 7.5, 15, 30, 60",mg/kg bw/d,,once daily ,yes,,,,,,,,,deionised water,,,,14,,yes ,,32,,,2,"peer review of two external experts: the histological slides from relevant tissues (diaphragm, skeletal muscle, tongue and heart) from this study were reviewed by two independent pathologists. both pathologists agreed that treatment-related myofiber necrosis, degeneration, and/or inflammatory change were present in skeletal muscle, tongue, and diaphragm of both males and females given 30 or 60 mg/kg bw/d in this study and that the noael for muscle degenerative change in this study was 15 mg/kg bw/d. ref.: 4, 5 (subm 3) ",
sodium perborate (tetrahydrate),non OECD,https://ec.europa.eu/health/scientific_committees/consumer_safety/docs/sccs_o_031.pdf,in vivo,,,,"after application of 1000 mg/kg bw/d at the end of the study red blood cell count, haemoglobin, haematocrit and number of lymphocytes was statistically significantly decreased, the number of platelets was statistically significantly increased.",,,the spleen size was reduced.,acanthosis and hyperkeratosis in the forestomach and hyperplasia of the fundic mucosa were observed after application of 1000 mg/kg bw/d via gavage. the spleenic parenchyma was reduced.,,1000,loael mg sodium perborate tetrahydrate/kg bw/d (70 mg boron/kg bw/d),"stomach, haematological system and possibly the testes",no,,in conclusion the noel for these endpoints is below the dose of 1000 mg/kg bw/d tested. ,,,,,21.5,,,,,,"test substance: sodium perborate tetrahydrate, 215 mg/ml",rats,,,,,,,,,1000,mg/kg bw/d,,,yes,,,,,,,,,,,,,28,1989,no,,degussa,,,3,"conclusion by ecb (2007): effects after oral application of sodium perborate can be attributed to the degradation products. from the 28-day study from degussa (1989) a noael cannot be derived, because the only dose investigated was 1000 mg/kg bw/d which showed effects on the stomach, spleen and the haematopoietic system. no effects were recorded in the study of dufour (1971). this study was only for 6 days with 8 days of recovery and only a limited number of parameters have been investigated. therefore also from this study a noael cannot be derived. systemic effects, which have to be considered, are the effects on the haematopoietic system. thus the loael is 1000 mg sodium perborate tetrahydrate/kg bw/d (70 mg boron/kg bw/d) and no NOAEL can be derived. ",
