hc yellow n° 4,non OECD,https://ec.europa.eu/health/scientific_committees/consumer_safety/docs/sccs_o_008.pdf,in vivo,"rats: all animals survived to the end of the studies. the final mean body weights of male that received doses of 10000 ppm and above and females that received doses of 20000 ppm or 40000 ppm were significantly lower than those of controls. feed consumption by males in all dose groups was generally higher than that of the controls throughout the study. feed consumption by females that received 40000 ppm was generally higher than that of the controls. feed consumption by females in other dose groups was lower than that of the controls. the values for feed consumption by rats receiving 40000 ppm were nearly twice that of other groups and are probably due to spillage of unpalatable diet. no clinical findings were attributed to HC Yellow n°4 administration. mice:  the final mean body weights and mean body weight changes of males and females that received doses of 10000 ppm were significantly lower than those of controls. high feed consumption by dosed mice was observed, particularly by those received the three highest dose levels, maybe due to spillage of unpalatable feed and therefore might not reflect the actual amount of feed consumed. no biologically significant clinical findings were observed that were related to HC Yellow n° 4 administration. ",,,,,,rat: significant changes in absolute and relative organ weights were observed but were considered to be secondary to decreases in body weights. Mouse: statistically significant changes in absolute and relative organ weights were considered to reflect decreases in body weight. ,"rat: lesions related to chemical administration were seen in the thyroid gland of males and females, the kidney in males and the uterus in females. a mineralization of the renal papilla occurred in all male rats in the 40000 ppm dose. thyroid pigmentation occurred in male and female rats receiving 40000 ppm. uterine atrophy occurred in female rats in the 20000 and 40000 ppm groups. the severity of all lesions ranges from minimal to mild except for uterine atrophy in the 40000 ppm female group which ranged from mild to moderate. mouse: thyroid pigmentation occurred in mice at all dose levels. minimal to mild uterine atrophy occurred in female mice in the 40000 and 80000 ppm groups. lymphoid depletion and subsequent atrophy of the spleen and thymus occurred in male and female mice that received 80000 ppm. these findings were considered to be secondary to the decreased body weights in these groups. ",rat: decreased body weight in males and uterine atrophy in females/ mouse: death and decreased body weight,"5000, 10000; 5000","NOAEL ppm, rats in male equivalent to 250 mg/kg/d bw, in female rats equivalent to 500 mg/kg/d bw; NOAEL ppm in male and female mice equivalent to 750 mg/kg/d bw",,yes,"mice: 8 males and 7 females in the 80000 ppm dose groups died; 9 of these deaths occurred during week 1, 5 occurred during week 2 and 1 occurred during week 11. one male that received 40000 ppm died during week 7.","rats: the decreases in mean body weights of male rats in the 10000, 20000 and 40000 ppm dose groups were considered quite dramatic (8%, 19% and 29%) and suggested that for male rats, 10000 ppm may exceed an exposure compatible with long-term survival in the 2-year study, thus doses of 2500 and 5000 ppm were selected for the males in the 2 year study. in the females, the weight decreases were much less dramatic (20000 ppm 5%, 40000 ppm 11%) but all females receiving 20000 ppm or more had uterine atrophy. thus, doses of 5000 and 10000 ppm were selected for the female rats in the 2-year study. mice: a combination of deaths and decreased mean body weights relative to controls precluded the selection of doses above 10000 ppm. therefore, doses of 5000 and 10000 ppm were selected for mice in the 2-year studies.",,,,,,,> 93,,,0-218,test substance: HC Yellow n°4,rat/f344/n;  mice/b6c3f1,,,,f & m,feed consumption per cage was determined weekly.,,,20,"0, 2500, 5000, 10000, 20000, 40000; 0, 5000, 10000, 20000, 40000, 80000",ppm in rat; mouse,,,yes,,,,,,,,,,,,,91,1992,no,rats: a noael of 5000 ppm (equivalent to 250 mg/kg/d body weight) for male rats and of 10000 ppm (equivalent to 500 mg/kg/d body weight) for female may be derived from this study. mice: a noael of 5000 ppm (equivalent to 750 mg/kg/d body weight) for male and female mice may be derived from this study.,14,,,2,,
hc yellow n° 4,non OECD,https://ec.europa.eu/health/scientific_committees/consumer_safety/docs/sccs_o_008.pdf,in vivo,no evidence of compound-induced toxicity was seen. body weight gain of rabbits was at least equal to that of controls.  .,,,a statisically significant increase in white blood cells in males and in blood urea nitrogen in males and females was reported.,no dye discoloration of the urine was seen during the test. ,a statisically significant increase in blood urea nitrogen in males and females was reported.,,microscopic examinations of 25 tissues from each animal gave no indication of histomorphologic evidence of toxicity,,,,,,,there was no evidence of hc yellow n°4-induced systemic effects,,,,,0.4,HC Yellow n° 4 in hair dye formulation,,,,,test substance: HC Yellow n°4,rabbit/new zealand white ,,,,f & m,,,,6,0.4,%,1,"topical application, twice weekly",,yes,,,,thoracic-lumbar area,,,one hour after application test material was removed by shampooing and subsequent rinsing and drying. ,,,,,91,1976,no,the experiment did not conform to a guideline and was not performed according to glp. the study is reported only as an article in j. toxicol. env. health but not provided as a full report. the test concentration of hc yellow n° 4 was lower than the in use concentration in non-oxidative hair dye (1.5%).,21,,3 independent groups were treated without any dyes,2,,
hc yellow n° 4,non OECD,https://ec.europa.eu/health/scientific_committees/consumer_safety/docs/sccs_o_008.pdf,in vivo,"after 13 weeks, 10 rats per sex per group were killed, blood samples were taken for clinical chemistry and haematology studies and liver, kidneys, gonads, thyroids, brain, pituitary, adrenals, and heart were weighed and microscopically examined. following the 13 weeks, 25 of the remaining females in each group were mated to untreated males in a teratology study. they were killed on day 20 of gestation for foetal examination. 10 of the remaining females in each group were maintained on their respective diets for a total of 26 weeks. the 10 remaining females in groups c and d were kept on their respective diets for a total of 21 weeks and were then placed on the control diet for 5 weeks. 20 of the males per group remaining after the 13 week necropsy were kept on their respective diets for an additional 7 weeks at which time the test diet were replaced by the control diet and the males were mated to 2 virgin untreated females each week for 2 weeks. these females were then evaluated for a dominant lethal mutagenicity effect due to treatment of the males with hc yellow n°4. the 10 remaining males per group were kept on their respective diets for a total of 26 weeks at which time they, along with all remaining animals, were killed and selected organs were weighed (including testis) and a complete set of tissues were taken for possible microscopic examination. during the first 13 weeks of the study, sporadic increases and decreases in weight gain and food consumption occurred in both the males and females. the high level males gained significantly less weight than the controls at the early onset of the study, with the low and mid level males sporadically gaining significantly more weight than the control during the remaining 13 weeks. the high level females gained significantly less weight than the controls during the entire study and the mid level females sporadically less. food consumption by male rats in the high, mid and low dose groups was significantly increased from the control at different time periods during the early weeks of the study. food consumption by females from the high and mid dose groups was sporadically increased or decreased from the control during the study. in the low dose group, female food consumption significantly decreased from the control. ","body weight gain depression, ",,only minor difference was seen in the haematology at 13 weeks ,,only minor differences was seen in the clinical chemistry values at 13 weeks ,no consistent dose related changes were seen in liver and kidney weights. testis weights were unaffected. ,no dose-related histomorphologic alterations were noted in any of the tissues examined.,,,,,yes,"during the first week of the study, one female from the 1% dose group was found dead and was therefore replaced. during the rest of the 13-week study, one female from the control group and one female from the 0.1% dose group died. these deaths were not considered related to the test material.",,,,,,"0, 0.1, 0.3, 1.0",,99.65,,,S022900186,test substance: HC Yellow n°4,rat/sprague-dawley (tac:n(sd)fbr),,,,f & m,,,,"95, 85","0, 0.1, 0.3, 1.0",%,,,yes,,,,,,,,,,,,,13W,1987,no,the experiment did not conform to a guideline and was not performed according to glp.,"17, submission 1",,,2,"number of animals per group: 40 males (all doses) and 45 (0, 0.1%) or 55 (0.3, 1.0%) females",
hc yellow n° 4,non OECD,https://ec.europa.eu/health/scientific_committees/consumer_safety/docs/sccs_o_008.pdf,in vivo,"during the 6 month phase of this study, a decrease in the weight of rats from the high dose group when compared to controls was observed. this decrease was only significant in females during week 25. the low and mid dose level females also weighed significantly less than the controls during week 25. a significant decrease in food consumption was observed in females from the 0.1% dose group. significant changes in food consumption were not observed in males. in the recovery groups, males from the 0.1% and 0.3% dose groups exhibited a significant increase in body weights during week 14-27 except week 23 where it was only significantly increased in the rats treated at the dose of 0.3%. no significant changes in body weight were observed in females.",,,,,,a significant increase in the relative weight of the liver was observed in rats from all treated groups. a significant decrease in the absolute and relative testes weight was observed in the high dose treated rats. ,,,,,,,,"hc yellow n°4 when fed to male and female rats at a dose level up to 1% in the diet is toxic, producing a significant decrease in body weights in the female rat and an increase in relative liver weight at all doses.",,,,,"0, 0.1, 0.3, 1.0",,≈98.9 ,,,22900186,test substance: HC Yellow n°4,rat/sprague-dawley (tac:n(sd)fbr),,,,f & m,,,,20,"0, 0.1, 0.3, 1.0",%,,,yes,,,,,,,,,,,,,6m,1987,no,the experiment did not conform to a guideline and was not performed according to GLP.,"17, submission 1",,,2,,
"o-phenylphenol, sodium o-phenylphenate and potassium o-phenylphenate",non OECD,https://ec.europa.eu/health/scientific_committees/consumer_safety/docs/sccs_o_177.pdf,in vivo,"body weights significantly lower in 2% males and 0.5, 2 and 4 % females (not in 1% females) during the whole treatment period and transiently in 1% males (up to week 3).  ",,,"there was a tendency towards anaemia in females at 0.5% and above,",urinary pH (at week 13) tended to be alkaline with increasing dietary concentration.,,liver: increases in liver weight; changes in liver enzymes. increase in kidney weights. ,"in the urinary bladder of males 1 papilloma was found at 1%, 4 papillomas plus 5 transitional cell carcinomas at 2% and 1 transitional cell carcinoma at 4%, as opposed to only 2 papillomas at 4% in females. no bladder calculi were observed. moderate pyelonephritis was recorded in 6/10 males and slight in 1/10 females at 4%. no tumours at sites other than the urinary system were found. kidneys: pyelonephritis in high dose males and females; ","in 4% males: pyelonephritis as predominating effect (60%; p≤0.01); in 2% males: neoplastic lesions in bladder as predominating effect (transitional cell papilloma, 44% (p≤0.05); transitional cell carcinoma 56% (p≤0.01). ",353,noael mg/kg bw/d,"kidney, liver, urinary bladder",yes,"Survival was 90 %, 90 %, 95%, 90 %, 90 %, 57 % and 70 % in rats fed 0, 62, 125, 250, 500, 1000 and 2000 mg/kg bw/d ",,,,,,"0, 0.125, 0.25, 0.5, 1.0, 2.0, 4.0",,>95,,,MM01044 ,"test substance: SOPP, Dowicide A",rat/f344,,,,f & m,,,,10,"0, 0.125, 0.25, 0.5, 1.0, 2.0, 4.0","%, corresponding to 0, 85, 177, 353, 706, 1384, and 2487 mg/kg bw/day for males and 0, 87, 177, 352, 694, 1338, and 2431 mg/kg bw/day for females",,,yes,,,,,,,,,,,,,91,,no,"subchronic (up to 90days) toxicity studies performed with OPP and SOPP demonstrate that OPP affects kidneys (both sexes) and urinary bladder (males only) of rats. kidney effects observed in males were increased organ weight, reduced renal function, induction of nephritis, papillary necrosis, pelvis and/or papilla hyperplasia, renal tubular proliferation and renal tubular dilatation. in females, kidney effects consisted of reduced urinary pH and nephritis. effects in the urinary bladder of male rats comprised increased organ weight, increased epithelial cell proliferation, and induction of simple hyperplasia, papillary or nodular (P/N) hyperplasia, and papilloma (but not carcinoma). SOPP also affected the kidneys and urinary bladder, as well as the liver, in rats. the liver effects of sopp included significantly decreased alanine aminotransferase (ALT) activity in the males and females. kidney effects induced by sopp in both sexes included increased organ weight and pyelonephritis. ingestion of SOPP (but not OPP) favoured the excretion of alkaline urine in both sexes of rats. subchronic oral toxicity data are also available for mice (SOPP) and dogs (OPP). except for body weight reduction, mice (both sexes) fed diets containing up to 40000 ppm sopp for 13 weeks showed no treatment-related pathology in the liver, kidney, and bladder. in both sexes of dogs, OPP induced a dose-dependent increase in emetic activity. in a 4-week dermal exposure study of OPP in mice (both sexes), the only effect reported was ulcerative skin lesions. no repeat dose studies were provided for POPP.","103, 113",,,3,,
"o-phenylphenol, sodium o-phenylphenate and potassium o-phenylphenate",non OECD,https://ec.europa.eu/health/scientific_committees/consumer_safety/docs/sccs_o_177.pdf,in vivo,body weight gain dose-dependently decreased at 1.25 and 2.5%.   ,,,red blood cell count and the amount of haemoglobin were decreased at 2.5%.,"the number of rats with acidic urinary pH values was increased at 1.25 and 2.5%, urinary protein levels were decreased at 2.5%.",no changes were noted in biochemical investigations of plasma samples.,the relative weight of the urinary bladder was dose-dependently increased (nearly by about 50% at the highest concentration).,,Decrease of urinary pH observed; acidification could be due to nephritis,,,,,,,,,,,"0, 0.625, 1.25, 2.5",,,,,,test substance: SOPP,rat/f344,,,,m,,,,20,"0, 0.625, 1.25, 2.5",%,,,yes,,,,,,,,,,,,,91,,no,"subchronic (up to 90days) toxicity studies performed with opp and sopp demonstrate that opp affects kidneys (both sexes) and urinary bladder (males only) of rats. kidney effects observed in males were increased organ weight, reduced renal function, induction of nephritis, papillary necrosis, pelvis and/or papilla hyperplasia, renal tubular proliferation and renal tubular dilatation. in females, kidney effects consisted of reduced urinary pH and nephritis. effects in the urinary bladder of male rats comprised increased organ weight, increased epithelial cell proliferation, and induction of simple hyperplasia, papillary or nodular (P/N) hyperplasia, and papilloma (but not carcinoma). sopp also affected the kidneys and urinary bladder, as well as the liver, in rats. the liver effects of sopp included significantly decreased alanine aminotransferase (alt) activity in the males and females. kidney effects induced by sopp in both sexes included increased organ weight and pyelonephritis. ingestion of sopp (but not opp) favoured the excretion of alkaline urine in both sexes of rats. subchronic oral toxicity data are also available for mice (sopp) and dogs (opp). except for body weight reduction, mice (both sexes) fed diets containing up to 40000 ppm sopp for 13 weeks showed no treatment-related pathology in the liver, kidney, and bladder. in both sexes of dogs, opp induced a dose-dependent increase in emetic activity. in a 4-week dermal exposure study of opp in mice (both sexes), the only effect reported was ulcerative skin lesions. no repeat dose studies were provided for popp.",190,,,3,"publication in japanese, only tables and numbers readable in english, purity of sopp unclear (due to japanese language).",
"o-phenylphenol, sodium o-phenylphenate and potassium o-phenylphenate",non OECD,https://ec.europa.eu/health/scientific_committees/consumer_safety/docs/sccs_o_177.pdf,in vivo,,,,,,,,"10 animals from each group killed in weeks 4, 8, 12, 24 and 36 and subjected to bladder histopathology and SEM; remaining rats kept until week 104 and subjected to histopathology. hyperplasia of bladder starting in 2% animals after 4 weeks, increasing severity until week 104; at 36 weeks hyperplasia also in other groups. for 2% animals: no development of papilloma until week 36; papilloma in 2 of 5 rats killed in week 104. no development of carcinoma until week 36; carcinoma in 2 of 5 rats killed in week 104. for 1% animals: no development of PN hyperplasia, papilloma or carcinoma until week 104; simple hyperplasia from week 36. no findings at lower doses.",,,,,,,,,,,,"0, 0.25, 0.5, 1.0, 2.0",,97,,,,test substance: SOPP,rat/f344,,,,m,,,,,"0, 0.25, 0.5, 1.0, 2.0",%,,,yes,,,,,,,,,,,,,104W,,no,"subchronic (up to 90days) toxicity studies performed with opp and sopp demonstrate that opp affects kidneys (both sexes) and urinary bladder (males only) of rats. kidney effects observed in males were increased organ weight, reduced renal function, induction of nephritis, papillary necrosis, pelvis and/or papilla hyperplasia, renal tubular proliferation and renal tubular dilatation. in females, kidney effects consisted of reduced urinary pH and nephritis. effects in the urinary bladder of male rats comprised increased organ weight, increased epithelial cell proliferation, and induction of simple hyperplasia, papillary or nodular (P/N) hyperplasia, and papilloma (but not carcinoma). sopp also affected the kidneys and urinary bladder, as well as the liver, in rats. the liver effects of sopp included significantly decreased alanine aminotransferase (alt) activity in the males and females. kidney effects induced by sopp in both sexes included increased organ weight and pyelonephritis. ingestion of sopp (but not opp) favoured the excretion of alkaline urine in both sexes of rats. subchronic oral toxicity data are also available for mice (sopp) and dogs (opp). except for body weight reduction, mice (both sexes) fed diets containing up to 40000 ppm sopp for 13 weeks showed no treatment-related pathology in the liver, kidney, and bladder. in both sexes of dogs, opp induced a dose-dependent increase in emetic activity. in a 4-week dermal exposure study of opp in mice (both sexes), the only effect reported was ulcerative skin lesions. no repeat dose studies were provided for popp.","64, 211",,,3,"abstract fukushima in japanese, supporting study; only bladder investigated. purity at least 97%, ",
"o-phenylphenol, sodium o-phenylphenate and potassium o-phenylphenate",non OECD,https://ec.europa.eu/health/scientific_committees/consumer_safety/docs/sccs_o_177.pdf,in vivo,36 treated and 11 control rats investigated. ,,,,,,,findings in urinary bladder: papillary/nodular hyperplasia in 86% treated rats vs 0% in controls (p≤0.01); papilloma in 54% treated rats vs 0% in controls (p≤0.01); carcinoma in 39% treated rats vs 0% in controls (p≤0.05).,,,,,,,,,,,,2,,,,,,test substance: SOPP,rat/f344,,,,m,,,,40,2,%,,,yes,,,,,,,,,,,,,50W,,no,"supportive, explorative  study; only results from bladder reported. no information on purity of sopp. subchronic (up to 90days) toxicity studies performed with opp and sopp demonstrate that opp affects kidneys (both sexes) and urinary bladder (males only) of rats. kidney effects observed in males were increased organ weight, reduced renal function, induction of nephritis, papillary necrosis, pelvis and/or papilla hyperplasia, renal tubular proliferation and renal tubular dilatation. in females, kidney effects consisted of reduced urinary pH and nephritis. effects in the urinary bladder of male rats comprised increased organ weight, increased epithelial cell proliferation, and induction of simple hyperplasia, papillary or nodular (P/N) hyperplasia, and papilloma (but not carcinoma). sopp also affected the kidneys and urinary bladder, as well as the liver, in rats. the liver effects of sopp included significantly decreased alanine aminotransferase (alt) activity in the males and females. kidney effects induced by sopp in both sexes included increased organ weight and pyelonephritis. ingestion of sopp (but not opp) favoured the excretion of alkaline urine in both sexes of rats. subchronic oral toxicity data are also available for mice (sopp) and dogs (opp). except for body weight reduction, mice (both sexes) fed diets containing up to 40000 ppm sopp for 13 weeks showed no treatment-related pathology in the liver, kidney, and bladder. in both sexes of dogs, opp induced a dose-dependent increase in emetic activity. in a 4-week dermal exposure study of opp in mice (both sexes), the only effect reported was ulcerative skin lesions. no repeat dose studies were provided for popp.",107,,"control group (basal diet, 20 animals) ",3,,
"o-phenylphenol, sodium o-phenylphenate and potassium o-phenylphenate",non OECD,https://ec.europa.eu/health/scientific_committees/consumer_safety/docs/sccs_o_177.pdf,in vivo,,,,,,,,only bladder examined (once per week by TTEM). after 4 weeks an increase in dark-stained cells and a few mitoses were observed. the authors suggest that these changes are the prodromal stage of the tumours induced by SOPP after longer treatment periods. ,,,,,,,,,,,,,,,,,,test substance: sopp,rat/f344,,,,m,,,,,"0, 2",%,,,yes,,,,,,,,,,,,,28d,,no,"publication in Japanese, abstract in english, supporting study. purity of sopp unclear (due to japanese language). subchronic (up to 90days) toxicity studies performed with opp and sopp demonstrate that opp affects kidneys (both sexes) and urinary bladder (males only) of rats. kidney effects observed in males were increased organ weight, reduced renal function, induction of nephritis, papillary necrosis, pelvis and/or papilla hyperplasia, renal tubular proliferation and renal tubular dilatation. in females, kidney effects consisted of reduced urinary pH and nephritis. effects in the urinary bladder of male rats comprised increased organ weight, increased epithelial cell proliferation, and induction of simple hyperplasia, papillary or nodular (P/N) hyperplasia, and papilloma (but not carcinoma). sopp also affected the kidneys and urinary bladder, as well as the liver, in rats. the liver effects of sopp included significantly decreased alanine aminotransferase (alt) activity in the males and females. kidney effects induced by sopp in both sexes included increased organ weight and pyelonephritis. ingestion of sopp (but not opp) favoured the excretion of alkaline urine in both sexes of rats. subchronic oral toxicity data are also available for mice (sopp) and dogs (opp). except for body weight reduction, mice (both sexes) fed diets containing up to 40000 ppm sopp for 13 weeks showed no treatment-related pathology in the liver, kidney, and bladder. in both sexes of dogs, opp induced a dose-dependent increase in emetic activity. in a 4-week dermal exposure study of opp in mice (both sexes), the only effect reported was ulcerative skin lesions. no repeat dose studies were provided for popp.",62,,,3,,
