zinc pyrithione,non OECD,https://ec.europa.eu/health/scientific_committees/consumer_safety/docs/sccs_o_133.pdf,in vivo,"decreased activity, decreased appetite, sporadic vomiting and diarrhea. these signs resolved during the recovery period. no abnormal clinical signs were observed in the lower dose groups. decreased body weights were noted in four males and two females of the highest dose. ",,,"in the haematologic examination, a decrease in erythrocyte count, haematocrit, haemoglobin concentration and mchc as well as an increase in mcv were observed in the highest dose group in week 4; the effects resolved during the recovery period. in the two highest dose groups, a decrease in lymphocytes and a decrease in stab. form neutrophilic leucocytes were observed.",urinalysis revealed an increase in ketone bodies in four males and four females of the highest dose group: pH was reduced in two males.,,on gross pathologic examination (apart from the female animal that died on day 10) no test-article related abnormalities were found. the relative organ weights of the adrenal glands and the liver of the high-dosed females were increased. 3 high dose males also had increased relative liver weights. no significant organ weight changes were observed at the lower doses. ,"on histopathologic examination, no abnormalities were observed in the surviving animals. ",decreased lymphocyte counts,5.5,noael mg/kg/d ,haematopoietic system,yes,one female at the highest dose group died on day 10,the noael calculated based on decreased lymphocyte counts in male animals observed at 11 mg/kg bw/d,stability statement: it was confirmed by the sponsor that the test article would be stable for 1 year at room temperature,,,solid,,,96.3,,,9204084481,test substance: zinc omadine ® powder,monkey/ cynomolgus,,,,f & m,,,,12,"0, 5.5, 11.0, 22.0",mg/kg/d,,once daily for 28 days,yes,,,,,,,,,,,,,28 + 14,1992,yes,,e10,dose levels were selected based on the results of a preliminary study.,"controls: 6 male, 6 female. 2 additional animals in the control and high dose group were used for a 2-week recovery period.",2,"summary taken from sccnfp/0671/03. guideline: miti guideline (japan), similar to ec b.7. 8 animals in two lower dose groups (5.5 and 11 mg/kg/d). test substace administrated in gelatine capsule",
zinc pyrithione,non OECD,https://ec.europa.eu/health/scientific_committees/consumer_safety/docs/sccs_o_133.pdf,in vivo,,,,,,,,,hind limb muscle atrophy (neurotoxic effect),0.5,noel mg/kg/d,,no,,,,,,,,,,,,,test substance: sodium pyrithione,rat/sprague-dawley,,,,,,,,,,,,,yes,,,,,,,,,,,,,90d,1988,no,"this study is not available for evaluation by the sccs. a read across from sodium pyrithione to zpt is considered appropriate based on the following reasoning: data on metabolism of zpt demonstrate that Zn is cleaved from the molecule after uptake and that ADME of the metal ion and the pyrithione moiety is different. studies performed in pigs using NaPT and zpt pointed to a common metabolic pathway (references b.68, b69, b.70). further, both Zn2+ and Na+ ions are not considered to be neurotoxic. thus, it can be assumed that neurotoxic effects observed after zpt exposure are due to the pyrithione moiety. it can thus be concluded that results from other pyrithione-liberating salts might support the findings obtained with zpt. ",hse 2003,,,3,summary taken from sccnfp/0671/03,
zinc pyrithione,non OECD,https://ec.europa.eu/health/scientific_committees/consumer_safety/docs/sccs_o_133.pdf,in vivo,,,,,,,,"four of twelve animals dosed at the lower levels survived, and those were necropsied at that time. focal necrosis of, either the brain or spinal cord in three of the four surviving animals. there were no histological changes in other organs.",,,,,yes,"none of the rabbits receiving 1000 or 2000 mg/kg survived the 90-day test period, the longest survival being 21 days + 8 of the lower dose groups","from the snyder et al (1965) study, one can conclude that a dose level of 10 mg/kg/day of zpt applied topically to rabbits is a no-effect level. interpretation of the rabbit studies by larson (1957) and nelson et al (1965) summarised here, is complicated by several factors. depending on what larson (1957) used to wash the animals, some material probably remained on the skin and was subsequently ingested. the nelson et al (1965) study, and the uncertainty regarding ingestion in these studies make any conclusions tentative, at best. that ingestion of zpt occurred in these studies can be supported by examining dose levels used in teratology studies conducted by nolen et al (1975, 1979). he reported that application of 25 to 100 mg/kg/day of zpt to the backs of rabbits produced no adverse effects when ingestion was meticulously prevented. therefore, 100 mg/kg/day instead of 10 mg/kg/day is a better estimate of a no-effect level for topical administration to rabbits. the no-effect level in mice for percutaneous toxicity is approximately 100 mg/kg/day, and the effect level (local irritation) is approximately 200 mg/kg/day. ",,,,solid,50,2 ml of water per gram of 50% wettable ZPT powder,,,,,,rabbit/albino,,,,,,,,"3, 4 ","125, 250, 500, 1000, 2000",mg/kg,,daily 5 days a week,,yes,,,,,,,"the animals were harnessed during application and remained so until the material dried, at which time the animals were washed.",water,,,,13 weeks,,no,"the fact that hindlimb weakness after dermal administration was not observed in some of the studies might be due to the dosing regimen and the vehicle used. in oral studies it could be demonstrated that in contrast to continuous administration, effects were less pronounced or not observable, when there were discontinuities in the dosing (e.g. 5 days per week). further, when using water or dmso as vehicle, toxic effects were more pronounced with dmso as vehicle. interpretation of the rabbit studies by larson (1957) and nelson et al (1965) summarised here, is complicated by several factors. depending on what larson (1957) used to wash the animals, some material probably remained on the skin and was subsequently ingested. that ingestion of zpt occurred in these studies can be supported by examining dose levels used in teratology studies conducted by nolen et al (1975, 1979). he reported that application of 25 to 100 mg/kg/day of zpt to the backs of rabbits produced no adverse effects when ingestion was meticulously prevented. therefore, 100 mg/kg/day instead of 10 mg/kg/day is a better estimate of a no-effect level for topical administration to rabbits. ",larson (1957) ,,,3,taken from sccnfp/0671/03,
zinc pyrithione,non OECD,https://ec.europa.eu/health/scientific_committees/consumer_safety/docs/sccs_o_133.pdf,in vivo,"after 7 to 15 daily treatments, the rabbits developed hind-limb weakness and diarrhoea. with continued treatment, weakness of both forelegs and death occurred. treatment was discontinued in three instances coinciding with the onset of severe quadraparesis in two animals and mild quadraparesis in the third rabbit. all three animals recovered. ",,,,,,,"histopathological observation after autopsy of severely paralysed rabbits revealed no significant structural alterations in the brains, spinal cords, peripheral nerves, muscles, and abdominal or thoracic viscera in 8 of 12 rabbits. in the other four rabbits  various alterations in cns tissue were seen that the author associated with a protozoan infection. ",,,,,no,,,,,,,,,,,,,,rabbit,,,,,,,,,50  --> 480 ,mg/kg,,daily,,yes,,,,,,,the material was left in contact with the skin during the periods between application and no effort was made to preclude ingestion of the zpt,,,,,,,no,"the nelson et al (1965) study, and the uncertainty regarding ingestion in these studies make any conclusions tentative, at best. that ingestion of zpt occurred in these studies can be supported by examining dose levels used in teratology studies conducted by nolen et al (1975, 1979). he reported that application of 25 to 100 mg/kg/day of zpt to the backs of rabbits produced no adverse effects when ingestion was meticulously prevented. therefore, 100 mg/kg/day instead of 10 mg/kg/day is a better estimate of a no-effect level for topical administration to rabbits. ",nelson et al (1965) ,,,3,taken from sccnfp/0671/03,
zinc pyrithione,non OECD,https://ec.europa.eu/health/scientific_committees/consumer_safety/docs/sccs_o_133.pdf,in vivo,no difference was noted in skin effects. no effects on the eye were seen in either group. ,,,,,,no difference was noted in gross or microscopic pathology between the test group and the control group treated with soap alone.,"histopathologic study of the brains of both groups revealed changes frequently seen in laboratory rabbits that are thought to be associated with the protozoan organism encephalitozoon cuniculi. this condition is spontaneous, is seen with great frequency, and is mild chronic in nature. there were no compound-related lesions",,,,,no,,,,,,,20,5 ml of a 20% aqueous paste of a commercial soap with or without 1 % zpt (on a soap basis),,,,,,rabbit,,,,,,,,6,10,mg/kg/day,,"5 days a week,",,yes,,,,,,,"the animals were kept in stocks for six hours after treatment, at which time the skin was washed and dried, and the animals were returned to their cages. ",,,,,13 weeks,,no,"from the snyder et al (1965) study, one can conclude that a dose level of 10 mg/kg/day of zpt applied topically to rabbits is a no-effect level. ",snyder et al. (1965),,control group treated with soap without zpt,3,"taken from sccnfp/0671/03. there was a total of 65 applications, equivalent to 50 mg/kg/week.",
zinc pyrithione,non OECD,https://ec.europa.eu/health/scientific_committees/consumer_safety/docs/sccs_o_133.pdf,in vivo,,,,,,,"four animals, two group housed and two single-housed, treated with the mixture containing 2% zpt were necropsied after six weeks of treatment, and no gross abnormalities were observed.",,,,,,no,,none of the treatments produced local or systemic effects after a total of 30 applications (six weeks). the study was terminated at this point. ,,,"test materials were zpt at 0.08, 0.4 and 2.0% in a 1 % surfactant (triethanolamine lauryl sulfate)/ 0.5% thickener (methocel) aqueous slurry, these levels correspond to 0.28, 1.4, and 7.0 mg/kg/day",,"0.08, 0.4, 2.0",,,,,,test substance: zpt,mouse,,,,f,,,,10,"0.28, 1.4, 7.0",mg/kg/day,0.1,5 days/week,,yes,,2*2 cm2,,interscapular,,,,surfactant / thickener ,1 / 0.5,,,6 weeks,,no,"the no-effect level in mice for percutaneous toxicity is approximately 100 mg/kg/day, and the effect level (local irritation) is approximately 200 mg/kg/day. ",dobbs and nixon (1973),,a vehicle control group was included,3,"the study was conducted to determine dose levels of zpt for an eighteen-month dermal carcinogenicity bioassay study that would not cause systemic toxicity from oral ingestion during grooming. ten female mice were used per test material and dose level; five were group-housed, and five were housed individually",
zinc pyrithione,non OECD,https://ec.europa.eu/health/scientific_committees/consumer_safety/docs/sccs_o_133.pdf,in vivo,after four weeks no skin irritations or other toxicity was observed for animals treated with 0.4 and 2.0% concentration of zpt. animals treated with 20% zpt showed thickening of the skin and erythema. no hind-limb paralysis as observed in rats or rabbits was seen in any of the groups.,,,,,,,,,,,,no,,,,,,,"0.4, 2.0, 10.0, 20.0",test substance in a 1% surfactant/0.5% thickener vehicle,,,,,test substance: zpt. ,mouse,,,,f & m,,,,30,"10, 50, 250, 500",mg/kg/application,0.1,three time weekly for four weeks,,yes,,,,,,,,surfactant (triethanolamine lauryl sulfate)/ thickener (methocel) aqueous slurry,1 / 0.5,,,28,,no,"the no-effect level in mice for percutaneous toxicity is approximately 100 mg/kg/day, and the effect level (local irritation) is approximately 200 mg/kg/day. ",gargus (1974),,,3,"the high dose group had the 10% concentration applied for one week, and since no toxicity was observed, a 20% concentration (500 mg/kg/application) was substituted for an additional three weeks.",
zinc pyrithione,non OECD,https://ec.europa.eu/health/scientific_committees/consumer_safety/docs/sccs_o_133.pdf,in vivo,"there were signs of irritation such as red foci and desquamation in one male and one female animal at the highest dose. mean body weights of the 1000 mg/kg males were lower compared to controls during the first four weeks of the study, thereafter they were higher than in controls. in females, mean body weights at 1000 mg/kg/d were lower (17.4% at study termination) than control with statistically significant difference from week 2; correspondingly, food consumption was lower in high dose females. no test-item related ophthalmoscopic abnormalities were observed.",,,"in animals receiving 1000 mg/kg/d, statistically significantly increased leucocyte counts were found in males, statistically significantly depressed erythrocyte counts and haematocrit levels were found in females.",,statistically significantly increased cholesterol levels were determind in high dose females. ,no toxicologically significant macroscopical findings was observed,no toxicologically significant histopathological findings was observed,"body weight depression, food consumption depression,haematological changes (increased leucocyte, decresed erythrocyte and haematocrit, increased cholesterol)",100,noael mg/kg bw/day,,no,,"noael calculated based on a decreased body weight in top dose females and on haematological changes the top dose, a noael of 100 mg/kg bw/d is derived from this study. ",,,,,,zinc 2-pyridinethiol-n-oxide (cas 13463-41-7; sodium naphthalenesulfonic acid (cas 9084-06-4-9) and water (cas 7732-18-5),52.2,,,33-22902781,test substance: zinc omadine ® fps ,rat/sprague-dawley,,,,f & m,,,,30,"0, 20, 100, 1000 ",mg/kg/d ,2,5days/week,,yes, ,3*5,intact,,,,test substance removed by washing after 6h exposure,deionized water ,,,,91,1992,yes,"an average of 91 % of the initial concentrations of the active ingredient was found after a 10 day storage at room temperature. some animals chewed or removed the tape. data was collected in order to explain probably occurring unexplained toxicity. oral exposure cannot fully be excluded from this study. the fact that hindlimb weakness after dermal administration was not observed in some of the studies might be due to the dosing regimen and the vehicle used. in oral studies it could be demonstrated that in contrast to continuous administration, effects were less pronounced or not observable, when there were discontinuities in the dosing (e.g. 5 days per week). further, when using water or dmso as vehicle, toxic effects were more pronounced with dmso as vehicle. ",e26,dose levels were selected based on results from a preliminary range-finding study.,a contrl group of 15 males and 15 females included,2,guideline: us epa 82-3 (similar to oecd tg 411). echa mentions a further dermal toxicity study performed in mice. this study is not available for evaluation. ,
zinc pyrithione,non OECD,https://ec.europa.eu/health/scientific_committees/consumer_safety/docs/sccs_o_133.pdf,in vivo,"all of 5 treated animals showed reduced amplitude of the evoked compound muscle action potential (cmap), 4 animals showed signs of a reduced muscle tone. ",,,,,,,,,,,,no,,,,,,,,,,,,,,rat/sprague-dawley,,,,,,,,5,100,mg,,daily,,yes,,,,,,,,,,,,10,,no,"apparently the same study was described shortly in an addendum to the proposal for annex 3 listing of zinc pyrithione provided by procter and gamble in january 2002. therein the following was stated: after 10 day repeated dermal administration of 100 mg/kg/d zpt to female rats (strain not given) the muscle evoked potential in the hindlimb (measured as m-wave amplitude) was significantly reduced when compared to untreated controls (22.95 ± 11.61 mv in treated animals versus 46.56 ± 5.95 mv in controls). the fact that hindlimb weakness after dermal administration was not observed in some of the studies might be due to the dosing regimen and the vehicle used. in oral studies it could be demonstrated that in contrast to continuous administration, effects were less pronounced or not observable, when there were discontinuities in the dosing (e.g. 5 days per week). further, when using water or dmso as vehicle, toxic effects were more pronounced with dmso as vehicle. ",mak (2012),,,3,two dermal repeat dose studies which address mechanistic aspects.,
zinc pyrithione,non OECD,https://ec.europa.eu/health/scientific_committees/consumer_safety/docs/sccs_o_133.pdf,in vivo,"low muscle tone was observed at 150 and 200 mg/kg/d in male animals beginning on day 8 and day 11 that continued throughout the study duration. in female animals low muscle tone was observed at 50, 75 and 100 mg/kg/d beginning on day 8 in the 100 mg/kg/d group, on day 15 in the 75 mg/kg/d group and on days 22-28 in the 50 mg/kg/d group. muscle tone and body weight were decreased in male animals of the two highest doses on days 14 and 28. hindlimb and forelimb grip strength were decreased in male animals of the two highest doses on days 14 and 28. decreases in the electrophysiological measurements measured as the maximum amplitude were observed in males at 150 mg/kg/d. in females on day 14 grip strength was reduced in the 75 and 100 mg/kg/d group and on day 28 grip strength was reduced in the three highest dose groups. again in females, decreases in the electrophysiological values measured as the maximum amplitude were observed in the 50 and 75 mg/kg/d group (electrophysiological measurements not taken at the 100 mg/kg/d dose level).",,,,,"no significant changes in plasma, rbc or brain cholinesterase was observed at any dose tested for any time point measured. ",,,effect on the hindlimb ,25; 50,noael mg/kg bw/day female; male,,no,,,,,,,,,,,,,,rat/sprague-dawley,,,,f  & m,,,,5,"0, 10, 25, 50, 75, 100; 0, 50, 150, 200","mg /kg/d, in males; in females",,daily ,,yes,occluded,,,,,,,triethanolamine-lauryl sulfate,0.1,,,28,,no,"this study demonstrated that hindlimb effects occur after short-term repeated dermal exposure of rats. noaels of 50 and 25 mg/kg bw/d were obtained for male and female animals, respectively. a further subchronic toxicity study is mentioned on echa's website (http://echa.europa.eu/). the study is not available for evaluation. a noael of 100 mg/kg/d was derived from that study. the fact that hindlimb weakness after dermal administration was not observed in some of the studies might be due to the dosing regimen and the vehicle used. in oral studies it could be demonstrated that in contrast to continuous administration, effects were less pronounced or not observable, when there were discontinuities in the dosing (e.g. 5 days per week). further, when using water or dmso as vehicle, toxic effects were more pronounced with dmso as vehicle. ",d1 arch chemicals 2003 (link given in mak (2012),,,2,,"the term ""occluded"" is not mentioned but it's explained that: the treatment site was protected by a fixed convex piece of plastic shielding."
zinc pyrithione,non OECD,https://ec.europa.eu/health/scientific_committees/consumer_safety/docs/sccs_o_133.pdf,in vivo,"animals were not acclimatized to test tubes prior to dosing. therefore some effects might be attributed to the stress produced in the animals. clinical signs observed were wet fur around the muzzle, gasping, respiratory gurgles, swelling around the eyes, hypothermia and intermittent tip-toe walking. ",there was no difference between treated and control animals in fob. grip strength was not affected by dosing., ,"concerning clinical chemistry data in  haematology data, there appeared to be no dose-related differences between groups.",,"concerning clinical chemistry data in plasma, there appeared to be no dose-related differences between groups.","except for lung, there were no differences in organ weights between control and treated animals. lung weights at the 5-day and 21-day sacrifice were increased for all exposure groups except for the 12.0 mg/m3  treated males at day 5 and the 2.0 mg/m3  treated males at day 21.","histopathological examination revealed the following compound-related effects: hyperplasia of alveolar marcrophages; inflammation of the nasal mucosa and interstitium around the bronchioles and vessels of the lungs; inflammation of the larynx which appeared ulcerative in a few animals; mucous cell hypertrophy of the nasal and bronchial mucosa; squamous metaplasia of the nasal mucosa, larynx and trachea; and smooth muscle hypertrophy of the alveolar ducts. the severity of these effects increased modestly with increasing dose and is consistent with irritation as a result of exposure to the dust of zpt, a known irritant to mucosal membranes. of non-respiratory tissues, effects in thymus and lymph nodes (lymphoid depletion and the lymph nodes and thymus in some animals) were observed. ",histopathological effect in tissues of the respiratory tract and non-respiratory tissues,2,loaec mg/m3,"lung, thymus, lymph nodes",yes,there was one death in the mid dose and 4 deaths in the high dose group.,the loaec was based on histopathological data in tissues of the respiratory tract and non-respiratory tissues,,,,aerosols generated from the fine white powder of the substance,,,98.3,,,zinc omadine ® master log # 74-01B10Cu zpt sample 0108244691,test substance: zinc omadine ® > 95% active ingredient,rat/sprague-dawley,,,,f  & m,,,,40,"2, 5, 12","target concentrations mg/m3, actual dose levels achieved: 2, 6, 13.5 mg/m3",,6hrs/day 5 days/week ,,,,,,,"yes, nose-only",,,,,,,21,2005,yes,,e4,the dose levels were based on a preliminary range-finding study. ,"controls: 20 males, 20 females exposed to air only ",1,guideline: oppts 870.3465. 6h exposure per day. 10 animals from each sex/dose were sacrificed on day 5 (interim sacrifice groups).,
