dossier,guideline,PDF link,type,clinical observations,functional observations,other,haematology,"urinalysis ""Urinalysis""[Mesh]",blood and serum biomarkers,gross pathology,histopathology,critical effect,point of departure (pod),description of pod ,target organ,moribund or dead animals prior to study termination,mortality rate,conclusion,homogeneity and stability ,treatment prior to application,pH and adjustment,"physical form (solid, liquid, aerosol, dust)",concentration (%),composition,purity (%),particle size and procedure,solubility in vehicle,chemical batch nr,additional info,species/strain,source,"age at start of experiment (days, weeks, months, years)","age  unit (day, week, month, year)","sex (female, male)",feed,weight,"weight unit (gram, kilogram)",n animals / group,dose levels,dose level unit (or extra info),dose volume ml/kg bw,administration scheme,"oral ( gavage, diet, water, intubation, other)",dermal,"patching technique (open, semi-occluded, occluded)",body surface (cm2 or %),skin condition,area of body,"inhalation ( nose head - only, whole body)",other,rinsing,vehicle name ,vehicle concentration %,sampling ,observation period day ,exposure period + recovery period days,year,GLP,SCCS comment to test,Ref. in dossier,preliminary test ,control group + satellite group,klimisch score,additional information,own comments
phenoxyethanol,non OECD,https://ec.europa.eu/health/scientific_committees/consumer_safety/docs/sccs_o_195.pdf,in vivo,"signs of toxicity were characterised by anorexia, lethargy and excretion of dark-red urine. on day 5, mean body weights of rabbits dosed with 100, 300, or 600 mg/kg bw/day had decreased approximately 8% from their pre-exposure weights and 10-14% from that of control animals. on day 10, rabbits in the 100 and 300 mg/kg/day dose groups continued to show similar decreases in body weight.",,,"in general, rabbits exposed to 2-phenoxyethanol had decreased rbc count, hgb concentration and pcv, with concurrent increases in nucleated and poly-chromatophilic red blood cells. many animals exhibiting severe depressions in rbc numbers also showed concurrent increases in mch, mchc, platelets and wbc. the values for mch and mchc were considered elevated due to free haemoglobin in plasma","urine samples collected from rabbits in the 1000, 600 and 300 mg/kg/day dose groups exhibited decreased pH in combination with elevated levels of protein, bilirubin, urobilirubin and haemoglobin. decreases in urinary pH and increases in urinary bilirubin and rbc were observed in at least one rabbit in the 100 mg/kg/day dose group.",,"most rabbits administered 1000 or 600 mg/kg bw/day exhibited gross pathological alterations consistent with haemolytic anaemia including enlarged and dark kidneys and spleen, dark urine in the urinary bladder, and dark urine staining the perineal region. conversely, rabbits gavaged with 100 or 300 mg/kg bw did not have treatment-related gross lesions. ",treatment-related microscopic changes were observed in rabbits from all dose levels. splenic microscopic changes included red pulp congestion and erythro-phagocytosis in most animals of both high dose groups. treatment-related microscopic changes also occurred in the kidneys and stomach of both high-dose groups. the spleen of one rabbit in the 300 mg/kg/day dose group had thrombi in venous sinuses resulting in generalised splenic necrosis. this animal also had thrombi within pulmonary blood vessels. two rabbits given 100 mg/kg/day had splenic extramedullary haematopoiesis. ,,100,loael  mg/kg bw/d ,,yes,"during the 10-day treatment period, deaths occurred in all dose groups above 100 mg/kg bw/day or animals were sacrificed moribund.",,,,,,,,,,,,test substance: 2-phenoxyethanol,rabbit/new zealand white ,,,,f,,3 -4.5,kg,3,"100,300,600,1000",mg/kg bw/day ,,repeated daily adminitsration for 10 consecutive days,"yes, gavage",,,,,,,,,,,,,,,no,"in conclusion, in this study with rabbits orally exposed by gavage for 10 days, the loael is 100 mg/kg bw day. for the understanding of this opinion, it is important to note that haematotoxicity in rabbits is caused by the parent compound when systemically available but not by the main metabolite 2-phenoxy acetic acid, which may be responsible for toxicity to the kidney",12,,control rabbits (6 females distilled water administered) exhibited a slight gain in mean body weight over the 10-day dosing period.,2,,
hydroxypropyl p-phenylenediamine and its dihydrochloride salt,non OECD,https://ec.europa.eu/health/sites/health/files/scientific_committees/consumer_safety/docs/sccs_o_230.pdf,in vivo,"rats in the mid dose group (300 mg/kg) showed significant reductions in body weight gain compared to controls, from day 4 onwards in males and from day 8 onwards in females. ",,,,"yellow to yellowish brown colored urine was also observed, confirming the systemic exposure to hydroxypropyl p-phenylenediamine HCl. ",an increase in the level of triglycerides was observed in female rats treated with the dose 100 mg/kg/day. ,an increase in relative weight of liver (relative to terminal body weight)  was observed in female rats treated with the dose 100 mg/kg/day. ,,"decrease in red blood cell count, hematocrit and prothrombin time, increase in platelet counts, increase of relative liver  and kindey weight",100,"noael, mg/kg/day","liver, haematopoietic system, kidney",yes,"mortality was observed in the high and mid dose groups (10/10 and 1/10, respectively)",the dose level of 300 mg/kg can be considered a maximum tolerated dose,,,,,,,98.6,,,r0025521b 004 p 001,test substance: hydroxypropyl p-phenylenediamine HCl,rat /wistar,,,,f & m,,,,10,"0, 100, 300, 1000 ",mg/kg ,10,,"yes, gavage",,,,,,,,,distilled water,,,,14,2012,yes,"statistically significant decreases in red blood cell count, hematocrit and prothrombin time were observed in females at 300 mg/kg bw/d. in both sexes, statistically significant increases in platelet counts were observed at the highest dose tested. in addition, a trend increase in absolute and relative liver and kidney organ weights was observed. these changes were significant at 300 mg/kg/day.","mehta, 2013",,,2,,
triclosan,non OECD,https://ec.europa.eu/health/ph_risk/committees/04_sccp/docs/sccp_o_166.pdf,in vivo,study showed no toxicity except for dermal irritation at the highest dose tested. upper respiratory disease during the study up to day 25. diarrhoea in all animals was not attributed to the test substance. dermal irritation (dermatitis) was observed at the high dose and was dose-dependent..,,,there was no treatment-related  haematological changes,,there was no treatment-related biochemical changes,,microscopic examination revealed no histomorphology changes in the skin. ,,,,,no,,test substance was reported to show “little toxic effect” aside from dermal irritation (pathology data not reported).,,,,,,12.5% triclosan added to 50% corn-starch vehicle,,,,,,dog/Beagle weanling,,,,,,,,,"0, 2, 20, 200",mg/kg bw/d,,,,yes,,,shaved neck ,,,,,corn starch,50,,,90,1973,no,,12,,,,dorner. conducted prior to oecd guidelines and missing a number of study parameters,
triclosan,non OECD,https://ec.europa.eu/health/ph_risk/committees/04_sccp/docs/sccp_o_166.pdf,in vivo,,,no treatment-related toxicities were observed. ,"mild anaemia, red blood cell and haemoglobin values showed variations between animals, but was not considered treatment-related. these changes were attributed to frequent sampling.",,"limited clinical chemistry parameters were evaluated due to limitations in blood sampling; however, of the parameters measured, no consistent changes were noted. ",termination examination showed no organ weight changes.,"histopathologic evaluation revealed similar findings of focal adrenal mineralisation, pulmonary infiltration, and low-grade pneumonia in both treated and control animals. hepatocellular vacuolar changes and hepatic extramedullary haematopoiesis were observed in both treatment and control animals. no histological changes were observed in skin sections taken for examination.",,,,,no,,"no differences were noted between animals sacrificed after 90 days of treatment and recovery animals.showed that repeated exposure to triclosan (0.1% in a soap solution, 5 min exposure) was well-tolerated.",,,,,0.1,soap,,,,,,monkey/rhesus,,,,,,,,,,,,"repeated daily, 5min exposure for 90d",,yes,,,,,,,after 5mins,,,,,90 + 30,1973,no,,13,,recovery group: 30 days without bathing. ,,"hazleton labs. conducted prior to oecd guidelines and not comparable to current oecd guidelines (e.g., exposure method). newborn monkeys.  ",
triclosan,non OECD,https://ec.europa.eu/health/ph_risk/committees/04_sccp/docs/sccp_o_166.pdf,in vivo,"following the first day, due to the occurrence of deaths, dyspnoea and general clinical signs indicative of poor health in the treated animals, the test concentrations were reduced to 0, 50, 115, or 301 mg/m3 for dosing on days 2-15, i.e., the remainder of the study.",,,"in the remaining animals, dose-related increases in leukocyte count",,"in the remaining animals, alterations in serum chemistry such as glutamic-pyruvic transaminase, alkaline phosphatase were observed. ",,slight focal inflammation of the mucous membranes was observed in high-dose animals at the end of the study,,50,noael mg/m3,,yes,"although there were 12 unscheduled deaths related to high-dose level exposure, 11 of the 12 rats died during day 1 as a result of the very high initial doses. necropsy revealed congestion, inflammatory changes in mucous membranes and nasal cavity.",the noael for inhaled triclosan was determined to be the lowest dose tested. ,,,,,,,,,,,test substance: triclosan ,rat,,,,f & m,,,,20,50 --> 1300,mg/m3,,,,,,,,,yes,,,,,,,14 days,,no,,32,,,,,the study is mentioned under 21 days repeated dose inhalation toxicity in the opinion but 14 days exposure is mentioned in the text
triclosan,non OECD,https://ec.europa.eu/health/ph_risk/committees/04_sccp/docs/sccp_o_166.pdf,in vivo,,,,,,"for triglycerides, the triclosan group differed from the placebo group (p<0.01) at 3 weeks, but not at 12 weeks.  there was no difference between treatment and control groups for any of the other liver function tests.",,,,,,,no,,,,,,,0.2,triclosan in toothpaste ,,,,,triclosan in toothpaste in 75 subjects;  ,human ,,,,,,,,75,,,,twice daily ,"yes, brushing ",,,,,,,,,,,,,12 weeks,1994,no,"the human safety studies reviewed showed no signs of overt toxicity in over 3,000 subjects that used triclosan-containing toothpaste for 12 weeks to 3 years. ",105,,"NaF/silica toothpaste in 78 subjects, in total 153 subjects participated in the study ",,colgate-palmolive,
triclosan,non OECD,https://ec.europa.eu/health/ph_risk/committees/04_sccp/docs/sccp_o_166.pdf,in vivo,,,,"the data showed increases in white blood cells and lymphocytes throughout the study, with decreases in mean corpuscular haemoglobin/concentration",,"biochemical analyses showed increases in sodium, cholesterol (total, ldl, and hdl), uric acid, and creatinine and decreases in bilirubin at all time points in the study in either males or females or both sexes. the average triclosan concentration in the blood of 15.5 ng/mL was reported to rise to 31.2 ng/mL after a period of 4 weeks on study. this concentration was reported to subsequently level off with further use of the triclosancontaining dentifrice. ",,,,,,,no,,these changes were not attributed to triclosan. ,,,,,0.2 ,toothpaste containing 0.2% of triclosan and 0.5% zinc citrate ,,,,,,human ,,,,,,,,112,,,,daily ,"yes, brushing ",,,,,,,,,,,,,52 weeks + 13 weeks,1991,no,,106,,,,safford.,the recovery period is called washout period 
triclosan,non OECD,https://ec.europa.eu/health/ph_risk/committees/04_sccp/docs/sccp_o_166.pdf,in vivo,,,,"standard haematology results showed some statistically significant changes periodically (compared to baseline values), but no pattern to the changes. some significant correlations were found between parameters and triclosan blood levels, but these were inconsistent over the course of the study in terms of time or sex of subject.",,"standard clinical biochemistry results showed some statistically significant changes periodically (compared to baseline values), but no pattern to the changes. some significant correlations were found between parameters and triclosan blood levels, but these were inconsistent over the course of the study in terms of time or sex of subject.",,,,,,,no,,these changes were not attributed to triclosan toothpaste use.,,,,,0.2,toothpaste containing 0.2% of triclosan and 0.5% zinc citrate ,,,,,,human ,,,,,,,,112,,,,normal daily use according to subject's normal brushing habits,"yes, brushing ",,,,,,,,,,,"blood samplings at baseline and 4, 12, 24, 38, 52, and 65 weeks.",,12 weeks (extended to 52 weeks)+13 weeks,1991,no,,107,,,,barnes. 86 subjects completed the study. oral irritation data including subjective “complaint level” for the whole trial period were summarised and found to be similar to effects experienced in similar trials involving toothpaste. there were no withdrawals from the trial due to adverse reactions. ,
triclosan,non OECD,https://ec.europa.eu/health/ph_risk/committees/04_sccp/docs/sccp_o_166.pdf,in vivo,,,,,,,,,,,,,no,,"no treatment-related changes were reported for any parameter measured, including haematology, clinical chemistry, and urinalysis parameters. the data shows that the use of toothpaste containing 0.3% triclosan produces no adverse effects compared to triclosan-free toothpaste formulations",,,,,,silicon dioxide-based toothpaste containing 0.243% fluoride and 0.3% triclosan,,,,,,human ,,,,,,,,3000,,,,normal dentifrice use,,,,,,,,,,,,,,3 years,1994,no,,108,,"silicon dioxide-based toothpaste containing 0.243% NaF, or 0.331% NaF. ",,fishman,
triclosan,non OECD,https://ec.europa.eu/health/ph_risk/committees/04_sccp/docs/sccp_o_166.pdf,in vivo,"there were 6 dropouts (5 triclosan and 1 placebo) due to adverse effects (skin reactions - 3 subjects including 1 placebo subject; increase in liver enzymes - 2 subjects; and, antrum gastritis - 1 subject). these findings were not considered to be attributable to triclosan, as they are not uncommon in pharmacological studies",,,,,"there were slight increases in liver enzyme values including alt, ast, and gamma-glutamyltransferase",,,,,,,no,,"based on vital signs, ecg, lung function, neurological examination and most laboratory parameters, triclosan was considered to be well-tolerated",,,,,,,,,,,,human ,,,,,,,,20,"0, 1, 5, 9, 12, 15, 18, 21, 24, 27, 30",mg,,single & repeated ,"yes, capsule",,,,,,,,,,,,,up to 30 days,1990,no,,109,,,,lucker et al. the dosing regimnet depended on he study phase. ,
hc red n° 3,non OECD,https://ec.europa.eu/health/scientific_committees/consumer_safety/docs/sccs_o_043.pdf,in vivo,rat: differences in mean body weight gains were not dose related; mouse: mean body weight gains were comparable between dosed or control groups. ,,,,rat & mouse: the urine of all dosed animals was maroon to orange throughout the studies.,,"dark thyroid glands were observed in 5/5 male rats that received 1000 mg/kg/d, 2/5 males that received 500 mg/kg/d and 2/5 males that received 250 mg/kg/d. ",no histopathology examination was performed,,1000; 500,"noael, mg/kg bw/d in rat; in mouse",,no,,,,,,,,,97,,,lot 5890377,test substance: hc red n° 3,rat / f344/n; mouse / b6c3f1,,,,f & m,,,,10,"0, 62, 125, 250, 500, 1000;  0, 31, 62, 125, 250, 500 ",mg/kg bw/d in rats; in mice,,daily ,"yes, gavage",,,,,,,,,carboxymethylcellulose in water,1,,,14 days,1978,no,,17,,,,2 species tested. glp statement: not specified but performed following ntp practices,"both gavage and diet are mentioned for administration. for determining klimisch score, it matters which one is correct because if gavage the volume should be given."
hc red n° 3,non OECD,https://ec.europa.eu/health/scientific_committees/consumer_safety/docs/sccs_o_043.pdf,in vivo,rat: the final mean body weights of males that received doses of 1000 mg/kg bw/d and 500 mg/kg bw/d were respectively 7% and 5% lower than those of controls. final body weights of dosed female were greater than those of controls; mouse: the final mean body weights of males that received doses of 250 mg/kg bw/d were 7% lower than those of controls. final body weights of dosed female were comparable to those of controls.  ,,,,rat: the urine of all dosed animals was orange to purple throughout the studies; mouse: the urine of all dosed animals was red throughout the studies. ,,mouse :no compound-related microscopic pathologic effects were recorded. ,rat: granules of brown to golden-brown pigment were found in the cytoplasm of the thyroid gland follicular epithelial cells in 10/10 males and 10/10 females that received 1000 mg/kg bw/d and in 10/10 males and 7/10 females that received 500 mg/kg bw but not in any of the rats that received 250 mg/kg bw/d. similar pigment was found in the cytoplasm of convoluted tubular epithelial cells in the kidneys of all rats that received 1000 mg/kg bw/d and in 7/10 males and 10/10 females that received 500 mg/kg bw and in 6/10 males and 7/10 females that received 250 mg/kg/d; mouse :no compound-related microscopic pathologic effects were recorded. ,body weight decrease,250; 125,noael mg/kg bw/d in rat; noael mg/kg bw/d in mouse,,yes,"0 in rats, in mice all death occured were related to gavage technique","pigmentation was not considered by the applicant as adverse effects and based on the body weight decrease observed at 1000 mg/kg bw/d and 500 mg/kg bw/d, the noael is 250 mg/kg bw/d in rats while the noel is 125 mg/kg bw/d (adjusted for 5 days treatment per week: 180 and 90 mg/kg bw, respectively). in mice, based on the body weight decrease observed at 250 mg/kg bw/d the noael is 125 mg/kg bw/d (adjusted to 90 mg/kg bw). ",,,,,,,97,,,lot 5890377,test substance: hc red n° 3,rat / f344/n; mouse / b6c3f1,,,,f & m,,,,20,"0, 62, 125, 250, 500, 1000;  0, 31, 62, 125, 250",mg/kg bw/d in rats; in mice,,daily 5days/week ,"yes, gavage",,,,,,,,,corn oil ,,,,13 weeks,1979,no,,17,,,,2 species tested. glp statement: not specified but performed following ntp practices,
hc red n° 3,non OECD,https://ec.europa.eu/health/scientific_committees/consumer_safety/docs/sccs_o_043.pdf,in vivo,body weights and survival differed little between treated and control groups. ,,,differences between treated and control groups in haematological and urinary values were not considered to be indicative of toxicological effects.,differences between treated and control groups in haematological and urinary values were not considered to be indicative of toxicological effects.,,"differences between treated and control groups in absolute and relative liver and kidneys weights were not considered to be indicative of toxicological effects. chronic
inflammation of the skin was observed in the control and treated mice. ","microscopic examinations of the skin revealed occasional hyperplasia, necrosis, ulceration and other lesions not significantly increased by dye treatment.",,,,,no,,,,,,,0.3,test substance in a hair dye formulation (formula 7601),,,,,test substance: hc red n° 3,mouse/ eppley swiss,,,,f & m,,,,120,0.3,%,0.05ml,3 times per week,,yes,,1cm2,,,,,,hair dye formulation (formula 7601),,,,20 months,,no,the experiment did not conform to a guideline and was not performed according to glp. the purity and specifications of test article are not known. different hair dye formulations were tested in this study. the results are sparsely reported. no noael can be derived from this study. ,27,,,,"study period: not specified, before 1984. the administration was lifetime. 10 mice per sex per group were sacrificed nine months after treatment for clinical tests, haematology and necropsy.",
hc red n° 3,non OECD,https://ec.europa.eu/health/scientific_committees/consumer_safety/docs/sccs_o_043.pdf,in vivo,no noteworthy differences were seen in any of the parameters studied between the controls and the animals receiving 19.5 or 97.5 mg/kg bw/day. all dogs gained weight normally and survived to end of the 104 weeks.,,,,all dogs in the two test groups excreted urine of a bluebrown colour on a daily basis. however urine analysis showed no remarkable findings. colour was normal in urine collected after overnight fasting.,,no gross or microscopic changes were seen in the various tissues and organs that could be attributed to the test material.,no ultra-structural changes were observed in the electron microscopic studies conducted on sections of liver and urinary bladder. ,,,,,no,,the authors concluded that oral dosing exposure of a hair dye formulation containing 0.02% hc red n° 3 in formulations up to 97.5 mg/kg bw/day did not result in any signs of toxicity.,,,,,0.02,hair dye formulation containing test substance,,,,,test substance: hc red n° 3,dog/ beagle,,,,f & m,,,,12,"0, 19.5, 97.5",mg/kg bw/day,,,"yes, diet",,,,,,,,,,,,,24 months,,no,the experiment did not conform to a guideline and was not performed according to glp. the purity and specifications of test article are not known. different hair dyes were tested in this study. the concentration of hc red n° 3 tested was too low compared to commercial formulations. the results are sparsely reported. no conclusions concerning long term toxic effects can then be made from this study. ,28,,,,"study period: before 1975. necropsy was performed on one male and one female from each group at 6, 12 and 18 months.  individual organ weights and organ to body weight ratios of the major organs were recorded. sections from 30 tissues or organs were prepared and examined microscopically. electron microscopic evaluation of the livers and urinary bladder from all 18 dogs at 24 months was performed. ",
acid orange 7 ,non OECD,https://ec.europa.eu/health/scientific_committees/consumer_safety/docs/sccs_o_158.pdf,in vivo,"discoloration of faeces resulting from the oral administration of acid orange 7 was observed. no changes were observed in the body and body weight gains of the rats, nor in the food consumption.",,,,,,"a significant increase in the absolute and relative spleen weight was observed in the rats treated at the doses of 60, 100, 300 and 1000 mg/kg bw/day. at 10 mg/kg bw/day this increase was also observed but was not statistically significant.","enlarged spleens were macroscopically observed in all rats treated at the dose of 100, 300 and 1000 mg/kg bw/day. extramedullary hemopoiesis was observed in all rats treated at the dose of 10 and 60 mg/kg bw/day (no histological examination was performed on other groups). this was considered to be related to the tested compound. ",,,,,no,,"on the basis of the results obtained in the 14-day dose range finding study, a proposal of dose levels for 90 day sub-chronic toxicity study is not possible. therefore, an additional 14- day range finding study with the dose levels of 0, 2.5, 5, 10 mg/kg bw/day was envisaged.",,,,,,test substance in aqueous solution (bi-distilled water) + vehicle,90,,,"2097af, lot no. aj 3559",test substance: acid orange 7 ,rat / hanibm:wist spf,,,,f & m,,88-114 & 77-104,g male & female,10,"0, 10, 60, 100, 300, 1000",mg/kg bw/d,,once daily ,"yes, gavage",,,,,,,,,cmc,1,,,14 days,,no,,12,,,,range-finding study,
acid orange 7 ,non OECD,https://ec.europa.eu/health/scientific_committees/consumer_safety/docs/sccs_o_158.pdf,in vivo,"no changes were observed in the body weight gains of the rats,or food consumption.",,,heinz bodies were not reported in these animals,,methemoglobin levels were significantly increased in the female treated at the dose of 10 mg/kg bw/day after 14 days treatment. this increase was also observed in males at the same dose but was not statistically significant.  bilirubin levels were also increased in the male rats treated at 10 mg/kg bw/day but this increase was not considered to be related to the tested compound.,no test compound related findings in organ weight were observed.,no microscopic findings related to acid orange 7 were reported.,,,,,no,,"on the basis of the results obtained in the 14-day dose range finding study, the following dose levels for the 90-day subchronic study were proposed: 0, 2.5, 5, 10 mg/kg bw/day.",,,,,,test substance in aqueous solution (bi-distilled water) + vehicle,90,,,"2097af, lot no. aj 3559",,rat / hanibm:wist spf,,,,f & m,,94-118 & 85-106,g male & female,10,"0, 2.5, 5, 10",mg/kg bw/d,,"once daily, 7 dyas / week",yes gavage,,,,,,,,,cmc,1,,,14 days,,no,,13,,,,range-finding study,
acid orange 7 ,non OECD,https://ec.europa.eu/health/scientific_committees/consumer_safety/docs/sccs_o_158.pdf,in vivo,"no evidence of systemic toxicity, growth responses were normal",,,haematological values were normal,urinary components were normal,,fross autopsies disclosed no dose-related findings.,,,,,,no,,,,,,,0.1 & 1,test substance acid orange 7 dissolved in water as well as usp white ointment,,,,fda certified material,,rabbit,,,,,,,,3,,,,daily ,,yes,,,intact & abraded,,,,,,,,,90 days & 21 days,,no,,15,,control groups were treated with respective media.,,,
acid orange 7 ,non OECD,https://ec.europa.eu/health/scientific_committees/consumer_safety/docs/sccs_o_158.pdf,in vivo,,,,,,,,,,,,,no,,the authors conclude that no adverse reactions or pathological changes were observed following weekly dermal applications of d&c orange 4.,,,,,1,test substance dissolved in water ,,,,fda certified colour was used.,,mouse/swiss webster ,,,,f & m,,17-25,g ,100,1,%,0.1ml,once per week,,,,6cm2,,,,,,,,,,18 months,,no,the study cannot be regarded as sufficient for evaluation. for additional studies see carcinogenicity.,,,,,"after necropsy, organs were fixed in 10% formalin solution after recording any gross pathological findings.",
