triclosan,non OECD,https://ec.europa.eu/health/ph_risk/committees/04_sccp/docs/sccp_o_166.pdf,,erythema reactions were observed at 24 h after the start of exposure [3/6 positive responses in intact skin; 5/6 positive in abraded skin]. oedema reaction at 24 h was positive in 1/6 animals. erythema reactions improved at 72 h. triclosan did not induce corrosion effects. triclosan was classified as a moderate irritant based on an overall score of 3.58 (irritance scores of greater than 6 would have been considered “severe”).,,no,"erythema: intact skin mean score: 2.5,  abraded skin mean score 2.8; eythema after 72h: mean scores 1.3 intact skin, abraded skin 2.5. overall score: 3.58",,,,,,,,,,,,,,,,,,,,,,,,,in vivo,rabbit/russian,,,,,,,,,,,,,,,,,,,,,,,,,,,,dermal,,occlusive gauze patches soacked with triclosan,shaved intact and abraded skin on backs and flanks,2.5,24,,,,,,,,,,,,,,,,,1975,no,the study shows that  the erythema reactions are reversible. ,6,,,,sachsse and ullmann,,,,,,,,,,,,,,,,,,,,,,,,,,,,,,,,,,,,,,,,,,,,,,,,,,,,,,,,,,,,,,,,,,,,,,,,,,,,,,,,,,,,,,,,,,,,,,,,,,,,,,,,,,,,,,,,,,,,,,,,,,,,,,,,,,,,,,,,,,,,,,,,,,,,,,,,,,,,,,,,,,,,,,,,,,,,,,,,,,,,,,,,,,,,,,,,,,,,,,,,,,,,,,,,,,,,,,,,,,,
triclosan ,OECD 404,https://ec.europa.eu/health/ph_risk/committees/04_sccp/docs/sccp_o_166.pdf,,"dermal irritation such as erythema was observed at the site of application. oedema, fissuring, eschar was observed at the 2 highest doses which correlated with hyperkeratosis. acanthosis was also observed in males at 1.5 mg/d. the liver showed dose-related increase in absolute and relative liver weight in females at 1.5 and in both sexes at 3.0 and 6.0 mg/d. this increase associated with centrilobular hypertrophy. mononuclear infiltrate was also observed but only at the high dose. the noael is considered to be 0.6 mg/d. this corresponds to 24 mg/kg bw per day ",,,,,,,,,,,,,moderate to severe skin irritation,,,,,,,"0, 0.3, 0.6, 1.5, 3, 6",,,,,,,,,mouse/cd-1,,,,,,,,,,,,,,,,,,,,,,,,"0, 0.3, 0.6, 1.5, 3.0, 6.0", mg/animal/d,0.1,repeated once daily for 14 days,dermal,,,dorsal area,2*3,,,,,,,,,,,,,,acetone,,,,1997,yes,"these dermally-applied doses correspond to systemic doses of approximately 12, 24, 60, 120, or 240 mg/kg body weight/day for a 25 g mouse (triclosan concentrations of 0.3, 0.6, 1.5, 3, and 6 % in 0.1 mL application volume). the triclosan was applied to a 2 x 3 cm2 hairless area on the dorsal side of the animal. appropriate untreated and vehicle controls were used. as these were dose range finding studies, although glp-compliant, they were not entirely compliant with oecd guidelines for dermal studies (clinical chemistry, haematology, or urinalysis investigations were not conducted, and macroscopic and microscopic evaluations were limited). both mouse studies showed similar dose-related dermal and liver findings such as dermal irritation, increased liver weight, coagulative necrosis and centrilobular hypertrophy. dose-related dermal findings started at 1.5 mg / animal / day (60 mg/kg bw/d) for triclosan in propylene glycol and at 3.0 mg / animal / day for triclosan in acetone vehicle. liver effects were observed in animals treated with dermal doses of ≥ 1.5 mg / animal / day (≥ 60 mg/kg bw/d). the noael is 24 mg/kg bw/d. in summary, these 3 rodent dermal studies revealed a similar pattern of toxicity with respect to dose-related dermal irritation and hyperkeratosis at the site of application. in addition, liver-related effects such as increased organ weight associated with centrilobular hypertrophy were observed in both mouse studies but not in the rat, indicating a species difference in response to triclosan. the noael was determined to be 0.6 mg/day (24 mg/kg body weight/day) in both mouse studies, based on liver effects observed at doses of ≥ 1.5 mg / animal / day. the noael in the rat study was determined to be 3.0 mg / animal / day (12 mg/kg bw/day), based on dermal irritation at the highest dose of 6.0 mg / animal / day.",8,,,,burns 1997a,,,,,,,,,,,,,,,,,,,,,,,,,,,,,,,,,,,,,,,,,,,,,,,,,,,,,,,,,,,,,,,,,,,,,,,,,,,,,,,,,,,,,,,,,,,,,,,,,,,,,,,,,,,,,,,,,,,,,,,,,,,,,,,,,,,,,,,,,,,,,,,,,,,,,,,,,,,,,,,,,,,,,,,,,,,,,,,,,,,,,,,,,,,,,,,,,,,,,,,,,,,,,,,,,,,,,,,,,,,
triclosan ,OECD 404,https://ec.europa.eu/health/ph_risk/committees/04_sccp/docs/sccp_o_166.pdf,,"dose-related dermal irritation was observed at the site of application starting at 1.5 mg/d. dose-related increases in absolute and relative liver weights in both sexes at 6.0 mg/d and in males at 0.3, 1.5 and 3.0 mg/d. centrilobular hypertrophy at doses ≥1.5 mg/d. the statistical increase in male liver weights at 0.3 mg/d was not correlated with any histopathology changes. the noael is considered to be 0.6 mg/d. this corresponds to 24 mg/kg bw per day",,,,,,,,,,,,,,,,,,,,"0, 0.3, 0.6, 1.5, 3, 6",,,,,,,,,mouse/cd-1,,,,,,,,,,,,,,,,,,,,,,,,"0, 0.3, 0.6, 1.5, 3.0, 6.0
",mg/animal/d,0.1,repeated once daily for 14 days,,,,dorsal area,2*3,,,,,,,,,,,,,,propylene glycol ,,,,1996,yes,"these dermally-applied doses correspond to systemic doses of approximately 12, 24, 60, 120, or 240 mg/kg body weight/day for a 25 g mouse (triclosan concentrations of 0.3, 0.6, 1.5, 3, and 6 % in 0.1 mL application volume). the triclosan was applied to a 2 x 3 cm2 hairless area on the dorsal side of the animal. appropriate untreated and vehicle controls were used. as these were dose range finding studies, although glp-compliant, they were not entirely compliant with oecd guidelines for dermal studies (clinical chemistry, haematology, or urinalysis investigations were not conducted, and macroscopic and microscopic evaluations were limited). both mouse studies showed similar dose-related dermal and liver findings such as dermal irritation, increased liver weight, coagulative necrosis and centrilobular hypertrophy. dose-related dermal findings started at 1.5 mg / animal / day (60 mg/kg bw/d) for triclosan in propylene glycol and at 3.0 mg / animal / day for triclosan in acetone vehicle. liver effects were observed in animals treated with dermal doses of ≥ 1.5 mg / animal / day (≥ 60 mg/kg bw/d). the noael is 24 mg/kg bw/d. in summary, these 3 rodent dermal studies revealed a similar pattern of toxicity with respect to dose-related dermal irritation and hyperkeratosis at the site of application. in addition, liver-related effects such as increased organ weight associated with centrilobular hypertrophy were observed in both mouse studies but not in the rat, indicating a species difference in response to triclosan. the noael was determined to be 0.6 mg/day (24 mg/kg body weight/day) in both mouse studies, based on liver effects observed at doses of ≥ 1.5 mg / animal / day. the noael in the rat study was determined to be 3.0 mg / animal / day (12 mg/kg bw/day), based on dermal irritation at the highest dose of 6.0 mg / animal / day.",9,,,,burns 1996,,,,,,,,,,,,,,,,,,,,,,,,,,,,,,,,,,,,,,,,,,,,,,,,,,,,,,,,,,,,,,,,,,,,,,,,,,,,,,,,,,,,,,,,,,,,,,,,,,,,,,,,,,,,,,,,,,,,,,,,,,,,,,,,,,,,,,,,,,,,,,,,,,,,,,,,,,,,,,,,,,,,,,,,,,,,,,,,,,,,,,,,,,,,,,,,,,,,,,,,,,,,,,,,,,,,,,,,,,,
triclosan ,OECD 404,https://ec.europa.eu/health/ph_risk/committees/04_sccp/docs/sccp_o_166.pdf,,"dose-related skin irritation such as erythema was observed at 6.0 mg/d, with findings in 1 animal at 1.5 mg/d considered incidental. other related signs of skin irritation such as eschar, oedema were also noted. histopathology of the erythema, scaling and eschar showed acanthosis and hyperkeratosis at the highest dose. gross pathology revealed dark areas of the liver noted in a few treated animals (not dose-related); however, no change in organ weight was observed and no histopathology accompanied this gross finding. the noael was estimated by investigators to be 3.0 mg/animal/d equivalent to 12 mg/kg bw per day. ",,,,,,,,,,,,,,,,,,,,"0.1, 0.2, 0.5, 1, 2",,,,,,,,,rat/crl:cdbr,,,,,,,,,,,,,,,,,,,,,,,,"0, 0.3, 0.6, 1.5, 3.0, 6.0
",mg/animal/d,0.3,repeated once daily for 14 days,,,,dorsal area,2*3,,,,,,,,,,,,,,acetone,,,,1997,yes,"in rats, a similar dose range finding study was conducted using an acetone vehicle. dermally-applied doses of 0.3, 0.6, 1.5, 3.0, or 6.0 mg/day in the rat study correspond to systemic doses of approximately 1.2, 2.4, 6, 12, or 24 mg/kg body weight/day for a 250 g rat (triclosan concentrations of 0.1, 0.2, 0.5, 1, and 2 % in 0.3 mL application volume). skin irritation such as erythema was observed at 6.0 mg/day, with findings in one female animal at 1.5 mg/day considered to be incidental. other related signs of skin irritation such as eschar, and oedema were also noted. histopathology of the erythema, scaling, and eschar showed acanthosis and hyperkeratosis at the highest dose. gross pathology revealed dark areas of the liver in a few treated animals (not dose-related); however, no change in organ weight was observed and no histopathology was associated with the gross pathology findings. in summary, these 3 rodent dermal studies revealed a similar pattern of toxicity with respect to dose-related dermal irritation and hyperkeratosis at the site of application. in addition, liver-related effects such as increased organ weight associated with centrilobular hypertrophy were observed in both mouse studies but not in the rat, indicating a species difference in response to triclosan. the noael was determined to be 0.6 mg/day (24 mg/kg body weight/day) in both mouse studies, based on liver effects observed at doses of ≥ 1.5 mg / animal / day. the noael in the rat study was determined to be 3.0 mg / animal / day (12 mg/kg bw/day), based on dermal irritation at the highest dose of 6.0 mg / animal / day.",10,,,,"burns, 1997b",,,,,,,,,,,,,,,,,,,,,,,,,,,,,,,,,,,,,,,,,,,,,,,,,,,,,,,,,,,,,,,,,,,,,,,,,,,,,,,,,,,,,,,,,,,,,,,,,,,,,,,,,,,,,,,,,,,,,,,,,,,,,,,,,,,,,,,,,,,,,,,,,,,,,,,,,,,,,,,,,,,,,,,,,,,,,,,,,,,,,,,,,,,,,,,,,,,,,,,,,,,,,,,,,,,,,,,,,,,
triclosan,non OECD,https://ec.europa.eu/health/ph_risk/committees/04_sccp/docs/sccp_o_166.pdf,,"the histological structure of the mucosa of the triclosan-treated animals (group 3) was similar to that of the control specimens. structural changes, including basal hyperplasia, acanthosis, hypergranulosis, and orthokeratotic hyperkeratosis, were present in animals treated with sls, or with sls and triclosan. no signs of inflammation were observed in the subepithelial connective tissue. ",,,,,,,,,,,,,,the results of this study show that the application of triclosan in a paste (0.3% triclosan) does not result in mucosal irritation in the hamster cheek pouch.,,,,,,0.3,"group 1: 1.5% sls, group 2: 1.5%sls + 0.3% triclosan, group 3: 0.3% triclosan in paste",,,,,,test substance: triclosan,,hamster/syrian golden ,,,,,,,,,,,,,,,,,,,,,,,,1 to 6,%,,4 application at 24-hour intervals,dermal,,,right cheek pouch,1,15,s,,,,,,,,,,,,,,,,1996,no,,14,,,group 1: 1.5% sls only ,baert et al.,,,,,,,,,,,,,,,,,,,,,,,,,,,,,,,,,,,,,,,,,,,,,,,,,,,,,,,,,,,,,,,,,,,,,,,,,,,,,,,,,,,,,,,,,,,,,,,,,,,,,,,,,,,,,,,,,,,,,,,,,,,,,,,,,,,,,,,,,,,,,,,,,,,,,,,,,,,,,,,,,,,,,,,,,,,,,,,,,,,,,,,,,,,,,,,,,,,,,,,,,,,,,,,,,,,,,,,,,,,
triclosan,OECD 405,https://ec.europa.eu/health/ph_risk/committees/04_sccp/docs/sccp_o_166.pdf,,,,,,,,,,,,,,,slight eye irritation,"based on mean irritation scores in the cornea, iris, and conjunctiva, triclosan was found to cause slight primary eye irritation when applied to the rabbit eye mucosa.",,,solid,,,,,100,,,,,,,rabbit/new zeland white,,,,,,,,,,,,,,,,,,,,,,,,0.1,g,,"single,  applied in the conjunctival sac of the left eye of each animal. ",eye,,,,,,,,"day 1, 2, 3, 4, 7",,,,,,,,,,,,,,1980,yes,,15,,,control: right eye,ullmann,,,,,,,,,,,,,,,,,,,,,,,,,,,,,,,,,,,,,,,,,,,,,,,,,,,,,,,,,,,,,,,,,,,,,,,,,,,,,,,,,,,,,,,,,,,,,,,,,,,,,,,,,,,,,,,,,,,,,,,,,,,,,,,,,,,,,,,,,,,,,,,,,,,,,,,,,,,,,,,,,,,,,,,,,,,,,,,,,,,,,,,,,,,,,,,,,,,,,,,,,,,,,,,,,,,,,,,,,,,
triclosan,non OECD,https://ec.europa.eu/health/ph_risk/committees/04_sccp/docs/sccp_o_166.pdf,,"triclosan at concentrations of 1, 2, 5, and 10% produced only slight to moderate reddening of the conjunctiva as observed 2 hours after exposure, with recovery within 24 hours. triclosan at a 20% concentration caused reddening and slight swelling of the conjunctiva as observed 24 hours after the start of exposure. the undiluted (pure) triclosan caused fully reversible eye irritation effects, as observed in rinse experiments, with a return to normal eye state between 7 and 11 days after exposure.",,,,,,,,,,,,,,,,,,,,,,,,,,,,,rabbit,,,,,,,,,,,,,,,,,,,,,,,,"1, 2, 5, 10, 20, 100","% in gum arabic ( 1,2,5,10,20) /undiluted (100)",,,,,,,,2 or 4,s,24h / 11 days,,,,,,,,,,with and without rinsing,,,,,1969,no,,16,,,,lyman and furia,,,,,,,,,,,,,,,,,,,,,,,,,,,,,,,,,,,,,,,,,,,,,,,,,,,,,,,,,,,,,,,,,,,,,,,,,,,,,,,,,,,,,,,,,,,,,,,,,,,,,,,,,,,,,,,,,,,,,,,,,,,,,,,,,,,,,,,,,,,,,,,,,,,,,,,,,,,,,,,,,,,,,,,,,,,,,,,,,,,,,,,,,,,,,,,,,,,,,,,,,,,,,,,,,,,,,,,,,,,
hc red n° 17,"in vitro episkinSM skin irritation test, ecvam validated protocol (esac statement 2007)",,,,,,,,,,,,,,,,,,,,,,,,,,,,,,,,,,,,,,,,,,,,,,,,,,,,,,,,,,,,,,,,,,,,,,,,,,,,,$,,,,,2012,yes,,"1, 2",,,,,,,,,,,,,,,,,,,,,,,,,,,,,,,,,,,,,,,,,,,,,,,,,,,,,,,,,,,,,,,,,,,,,,,,,,,,,,,,,,,,,,,,,,,,,,,,,,,,,,,,,,,,,,,,,,,,,,,,,,,,,,,,,,,,,,,,,,,,,,,,,,,,,,,,,,,,,,,,,,,,,,,,,,,,,,,,,,,,,,,,,,,,,,,,,,,,,,,,,,,,,,,,,,,,,,,,,,,,,,,
hc red n° 3,non OECD,https://ec.europa.eu/health/scientific_committees/consumer_safety/docs/sccs_o_043.pdf,,,,,,,,,,,,,,,,no irritant under these test condition,,,liqui ( aqueous slurry),,,,,,,,,,test substance: hc red #3,in vivo,rabbit/new zealand white,,,,f & m,,,,"6 ( 4 m, 2 f)",,,,,,,,,,,,,,,,500,mg applied as aqueous slurry,,,dermal,,open,shaved intact skin,1 square inch,not specified,,,24 and 72h post application ,,,,,,,,,,,,,,1987,no,"none of the experiments followed a guideline and the specifications of the test substance were not described. curiously, the 3% aqueous solution caused some irritation in one experiment while the slurry caused no irritation to rabbit skin. a 3% preparation in ‘schultz vehicle’ caused no irritation. ",6,,,,,,,,,,,,,,,,,,,,,,,,,,,,,,,,,,,,,,,,,,,,,,,,,,,,,,,,,,,,,,,,,,,,,,,,,,,,,,,,,,,,,,,,,,,,,,,,,,,,,,,,,,,,,,,,,,,,,,,,,,,,,,,,,,,,,,,,,,,,,,,,,,,,,,,,,,,,,,,,,,,,,,,,,,,,,,,,,,,,,,,,,,,,,,,,,,,,,,,,,,,,,,,,,,,,,,,,,,,,,,,
hc red n° 3,non OECD,https://ec.europa.eu/health/scientific_committees/consumer_safety/docs/sccs_o_043.pdf,,slight erythema of the scarified (abraded) and intact skin 30 minutes after application. ,,,,,,,,,,,,,,hc red #3 non-irritating under these test conditions. skin alterations were not observed after 24 hours. ,,,liquid,,,3,,,,,,geb.3,,in vivo,rabbit/new zealand white,,,,,,,,6,,,,,,,,,,,,,,,,,,0.5,,dermal,,occluded,"shaved intact skin right side, abraded skin on the left",,4,h,,"30 and 60 minutes, 24, 48, 72 h post application",,,,,,,,,,water,,,,1983,no,,7,,,,,,,,,,,,,,,,,,,,,,,,,,,,,,,,,,,,,,,,,,,,,,,,,,,,,,,,,,,,,,,,,,,,,,,,,,,,,,,,,,,,,,,,,,,,,,,,,,,,,,,,,,,,,,,,,,,,,,,,,,,,,,,,,,,,,,,,,,,,,,,,,,,,,,,,,,,,,,,,,,,,,,,,,,,,,,,,,,,,,,,,,,,,,,,,,,,,,,,,,,,,,,,,,,,,,,,,,,,,,,,
hc red n° 3,non OECD,https://ec.europa.eu/health/scientific_committees/consumer_safety/docs/sccs_o_043.pdf,,no evidence of oedema or erythema at the scoring intervals.,,,,,,,,,,,,,,hc red #3 was non-irritating under these test conditions ,,,,,,3,,,,,,,test substance: rm148 (not identified as hc red n° 3 in the study),in vivo,rabbit/new zealand white,,, ,f & m,,,,"6 ( 2 m, 4 f)",,,,,,,,,,,,,,,,,,0.5,applied every 24 hours for 3 consecutive days to a single test site,dermal,,open,shaved intact skin,1 square inch,,,,"24 hours after each application, each test site was rinsed and scored for irritation and the test material reapplied. irritation was scored at 24, 48 and 72 hours following the first application. ",,,,,,,,,"yes, after eacj application",schultz vehicle ,,,,1983,no,,8,,,,,,,,,,,,,,,,,,,,,,,,,,,,,,,,,,,,,,,,,,,,,,,,,,,,,,,,,,,,,,,,,,,,,,,,,,,,,,,,,,,,,,,,,,,,,,,,,,,,,,,,,,,,,,,,,,,,,,,,,,,,,,,,,,,,,,,,,,,,,,,,,,,,,,,,,,,,,,,,,,,,,,,,,,,,,,,,,,,,,,,,,,,,,,,,,,,,,,,,,,,,,,,,,,,,,,,,,,,,,,,
hc red n° 3,non OECD,https://ec.europa.eu/health/scientific_committees/consumer_safety/docs/sccs_o_043.pdf,,"conjunctival redness, swelling, and discharge in treated, rinsed eyes after 1 hour. similar irritation, with the addition of low grade corneal opacity with ulceration in one eye, occurred in the treated non-rinsed eyes. recovery: after one day, treated, rinsed eyes displayed slight redness which resolved within one or two days. treated, non-rinsed eyes appeared normal by the third day. ",,,,,,,,,,,,,,,,,,,,,,,,,,,test substance: hc red 3,in vivo,rabbit/new zealand white,,,,,,,,4,,,,,,,,,,,,,,,,100,mg,,instilled into left eye ,ocular,,,,,,,,"1 hour, 1, 2 and 3 days post instillation. ",,,,,,,,,the eyes of two animals were rinsed with 20 ml distilled water 20 seconds post instillation.,neat,,,,1987,no, neither of the experiments followed a guideline and the specifications of the test substance were not described. both the neat and a 3% aqueous solution caused irritation to rabbit eyes. ,4,,,negative control: untreated right eye.,,,,,,,,,,,,,,,,,,,,,,,,,,,,,,,,,,,,,,,,,,,,,,,,,,,,,,,,,,,,,,,,,,,,,,,,,,,,,,,,,,,,,,,,,,,,,,,,,,,,,,,,,,,,,,,,,,,,,,,,,,,,,,,,,,,,,,,,,,,,,,,,,,,,,,,,,,,,,,,,,,,,,,,,,,,,,,,,,,,,,,,,,,,,,,,,,,,,,,,,,,,,,,,,,,,,,,,,,,,,
hc red n° 3,non OECD,https://ec.europa.eu/health/scientific_committees/consumer_safety/docs/sccs_o_043.pdf,,slight redness of the conjunctiva was observed in unwashed eyes with no corneal or iridial involvement. no ocular irritation appeared in eyes washed out 4 or 30 seconds after administration throughout the observation period. unwashed eyes appeared normal 8 hours post administration,,,,,,,,,,,,,,,,,,,,3,,,,,,,test substance: hc red #3,in vivo,rabbit/new zealand white,,,,,,,,9,,,,,,,,,,,,,,,,,,0.1,instilled into left eye per animal. ,,,,,,"4, 30",seconds,,"1, 2, 8, 24 hours and 1, 2, 3, 4, 5, 6 and 7 days post instillation ",,,,,,,,,the eyes of three animals were washed with 20 ml distilled water 4 seconds post instillation and the eyes of three animals were washed with 20 ml distilled water 30 seconds post instillation. the eyes of the remaining three animals were not washed.,water,,,,1983,no,,5,,,negative control: untreated right eye. ,,,,,,,,,,,,,,,,,,,,,,,,,,,,,,,,,,,,,,,,,,,,,,,,,,,,,,,,,,,,,,,,,,,,,,,,,,,,,,,,,,,,,,,,,,,,,,,,,,,,,,,,,,,,,,,,,,,,,,,,,,,,,,,,,,,,,,,,,,,,,,,,,,,,,,,,,,,,,,,,,,,,,,,,,,,,,,,,,,,,,,,,,,,,,,,,,,,,,,,,,,,,,,,,,,,,,,,,,,,,
acid orange 7 ,non OECD,https://ec.europa.eu/health/scientific_committees/consumer_safety/docs/sccs_o_158.pdf,,orange 2 produced very slight redness of abraded skin in some of the rabbits when observed at only 24 hours after application. the authors concluded that this was a false positive reaction.,,,,,,,,,,,,,,"under the conditions in this experiment, the material is classified as non-irritant to the skin.",,,,,,,,,,,,,test substance: orange 2,in vivo,rabbit/albino,,,,m,1.5 – 2.0 ,kg,,4,,,,,,,,,,,,,,,,,100,mg,,single,dermal,,,,,,,,24 h after exposure,,,,,,,,,,,,,,no,assessment of skin irritation is not complying with the actual standards. the substance is considered as a mild skin irritant.,6.7,,,,taken from sccs/1382/10. no experimental data are presented. the protocol followed the modified method of draize (ref. 6). results were published in the literature in 1981 (ref. 7). ,,,,,,,,,,,,,,,,,,,,,,,,,,,,,,,,,,,,,,,,,,,,,,,,,,,,,,,,,,,,,,,,,,,,,,,,,,,,,,,,,,,,,,,,,,,,,,,,,,,,,,,,,,,,,,,,,,,,,,,,,,,,,,,,,,,,,,,,,,,,,,,,,,,,,,,,,,,,,,,,,,,,,,,,,,,,,,,,,,,,,,,,,,,,,,,,,,,,,,,,,,,,,,,,,,,,,,,,,,,
acid orange 7 ,non OECD,https://ec.europa.eu/health/scientific_committees/consumer_safety/docs/sccs_o_158.pdf ,,,,,,,,,,,,,,,,based on the result of the experiment the authors conclude that orange 2 can be classified as non-irritant to the eyes.,,,,,,,,,,,,,test substance: orange 2,in vivo,rabbit,,,,m,,,,3,,,,,,,,,,,,,,,,,100,mg,,,occular,,,,,,,,,,,,,,,,,,,,,,no,,7,,,,taken from sccs/1382/10.no experimental data are presented. protocol and results were published in the literature in 1981 (ref. 7). ,,,,,,,,,,,,,,,,,,,,,,,,,,,,,,,,,,,,,,,,,,,,,,,,,,,,,,,,,,,,,,,,,,,,,,,,,,,,,,,,,,,,,,,,,,,,,,,,,,,,,,,,,,,,,,,,,,,,,,,,,,,,,,,,,,,,,,,,,,,,,,,,,,,,,,,,,,,,,,,,,,,,,,,,,,,,,,,,,,,,,,,,,,,,,,,,,,,,,,,,,,,,,,,,,,,,,,,,,,,
acid orange 7 ,non OECD,https://ec.europa.eu/health/scientific_committees/consumer_safety/docs/sccs_o_158.pdf ,,,,,,,,,,,,,,,,orange 2 was not irritant to the eyes in this test.,,,,,,,,,,,,,test substance: orange 2,in vivo,rabbit,,,,,,,,6,,,,,,,,,,,,,,,,,10,%,,"twice daily, 5 days/week, 4 weeks ",occular,,,,,,,,,4 weeks,,,,,,,,,,,,,no,"assessment of eye irritation is not complying with the actual standards. based on the data submitted, eye irritation potential cannot be evaluated. ",7,,,,"taken from sccs/1382/10.no experimental data are presented. protocol and results were published by burnett and opdyke in 1971, and were briefly cited in ref. 7. ",,,,,,,,,,,,,,,,,,,,,,,,,,,,,,,,,,,,,,,,,,,,,,,,,,,,,,,,,,,,,,,,,,,,,,,,,,,,,,,,,,,,,,,,,,,,,,,,,,,,,,,,,,,,,,,,,,,,,,,,,,,,,,,,,,,,,,,,,,,,,,,,,,,,,,,,,,,,,,,,,,,,,,,,,,,,,,,,,,,,,,,,,,,,,,,,,,,,,,,,,,,,,,,,,,,,,,,,,,,
acid red 92,OECD 404,https://ec.europa.eu/health/scientific_committees/consumer_safety/docs/sccs_o_087.pdf,,"the test item did not elicit any observable skin reaction at the application site of any animal. a light to marked red staining was apparent in all animals from 1 hour to day 7 of the observation period and was still present in one animal 14 days after removal of the dressing, the end of the observation period for all animals. no corrosive effects were noted on the treated skin of any animal at any of the measuring intervals. ",,,,,,,,,,,,,,acid red 92 is considered to be not irritating to skin. ,,,,moistened with 0.1ml of water ,,,,99.5 hplc at 548nm,,,,ar92-020420 ,test substance: acid red 92,in vivo,rabbit/new zealand albino white,,,young adult ,f & m,,,,"3 (1 male, 2 females) ",,,,,,,,,,,,,,,,0.5 ,g,,single,"dermal, intact left flank ",,semi-occluded,intact left flank skin ,,4,h,14,"1, 24, 48 and 72 hours, 7, 10 and 14 days after removal of the dressing",,,,,,,,,,,,,,2002,yes,"skin staining caused by acid red 92 would have masked any irritant erythema. therefore, some irritant potential of acid red 92 applied to rabbit skin has not been excluded.",14,,,,,,,,,,,,,,,,,,,,,,,,,,,,,,,,,,,,,,,,,,,,,,,,,,,,,,,,,,,,,,,,,,,,,,,,,,,,,,,,,,,,,,,,,,,,,,,,,,,,,,,,,,,,,,,,,,,,,,,,,,,,,,,,,,,,,,,,,,,,,,,,,,,,,,,,,,,,,,,,,,,,,,,,,,,,,,,,,,,,,,,,,,,,,,,,,,,,,,,,,,,,,,,,,,,,,,,,,,,,,,,
acid red 92,OECD 405,https://ec.europa.eu/health/scientific_committees/consumer_safety/docs/sccs_o_087.pdf,,"the instillation of the test item into the eye resulted in mild to moderate, early-onset and transient ocular changes, such as reddening of the conjunctivae and sclerae, discharge and chemosis. a slight corneal opacity, affecting up to the whole area of the cornea, was also apparent in one animal from 24 hours to 10 days after treatment. a light to marked red staining was also observed in the treated eye of all animals during the first 7 days after treatment. all ocular effects were reversible and were no longer evident 17 days after treatment. no abnormal findings were observed in the iris of any animal at any reading. no corrosion was observed at any of the measuring intervals.",,,,,,,,,,,,,,the test item did not induce significant or irreversible damage to the rabbit eye.,,,,moistened with 0.1ml of water ,,,,99.5,,,,ar92-020420 ,test substance: acid red 92,in vivo,rabbit/new zealand albino white,,,,f & m,,,,"3 (1 male, 2 females) ",,,,,,,,,,,,,,,,100,mg,,"single, instillation into one eye",occular,,,,,,,17,"1, 24, 48 and 72 hours, as well as 7 and 10, 14 and 17 days after test item application",,,,,,,,,,,,,,2002,yes,"under the conditions of this experiment, acid red 92 was irritating to the rabbit eye.",15,,,,,,,,,,,,,,,,,,,,,,,,,,,,,,,,,,,,,,,,,,,,,,,,,,,,,,,,,,,,,,,,,,,,,,,,,,,,,,,,,,,,,,,,,,,,,,,,,,,,,,,,,,,,,,,,,,,,,,,,,,,,,,,,,,,,,,,,,,,,,,,,,,,,,,,,,,,,,,,,,,,,,,,,,,,,,,,,,,,,,,,,,,,,,,,,,,,,,,,,,,,,,,,,,,,,,,,,,,,,,,,
