"toluene-2,5-diamine and its sulfate",non OECD,https://ec.europa.eu/health/scientific_committees/consumer_safety/docs/sccs_o_052.pdf,,mild conjunctival irritation was observed in 2 animals on days 1 and 3 respectively,no,,,,,,,,,,,,,"under the conditions of this test, a 2.5% toluene-2,5-diamine solution caused slight irritation to rabbit eyes.",,7.0,,,,2.5,"2.5% w/v solution of toluene-2,5-diamine in 0.05% aqueous sodium sulphite",,,,,,"test substance: toluene-2,5-diamine",in vivo,rabbit / new zealand white,,,,m,,,,3,,,,,,,,,,,,,,,,0.1 ml,,,single,ocular,,,,,10,s,7,"1 h and then at days 1, 2, 3, 4, and 7",,,,,,,,,eye was rinsed after 10 seconds with 50 ml of lukewarm water,water,,,,,no,"eye irritation studies have demonstrated that undiluted Imexine OD is irritant to the rabbit eye. some irritant effects were also seen with 2.5% toluene-2,5-diamine solution in rabbits and undiluted toluene-2,5-diamine sulfate in the HET-CAM test. the intended on-head concentration is up to 7.2%",20,,,,,,,,,,,,,,,,,,,,,,,,,,,,,,,,,,,,,,,,,,,,,,,,,,,,,,,,,,,,,,,,,,,,,,,,,,,,,,,,,,,,,,,,,,,,,,,,,,,,,,,,,,,,,,,,,,,,,,,,,,,,,,,,,,,,,,,,,,,,,,,,,,,,,,,,,,,,,,,,,,,,,,,,,,,,,,,,,,,,,,,,,,,,,,,,,,,,,,,,,,,,,,,,,,,,,,,,,,,,,,,
"toluene-2,5-diamine and its sulfate",non OECD,https://ec.europa.eu/health/scientific_committees/consumer_safety/docs/sccs_o_052.pdf,,"the test substance was tested undiluted for its irritation potential on the chorioallantoic membrane of fertilized chicken eggs using the endpoint assessment for non-transparent solid test items. endpoints (haemorrhage, coagulation, and blood vessel lysis) were assessed and semi-quantitatively scored at 30 sec (reference substance) or 180 sec (test substance) after rinsing. for the relevant endpoints of haemorrhage, coagulation and lysis, scores of 0, 0, and 0, respectively, were obtained with p-toluenediamine sulfate. with texapon asv 70(positive control) scores of 12, 9, and 0, respectively, were obtained.",,,"haemorrhage, coagulation and lysis, scored 0, 0, and 0, respectively",,,,,,,,,,,"p-toluenediamine sulfate was predicted to be ‘no more than slightly irritating to mucous membranes’, including the eye. the results with the reference substance, texapon asv 70, were indicative of a moderately irritating effect",,,,,,,,99.9,,,,46847 ,test substance: p-toluenediamine sulfate (code SAT 010935) undiluted,in vitro,,,,,,,,,,chicken eggs  white leghorn ,freshly fertilized,6,,,,,,,,,,,,,,,,,,,,,,,,,30 sec and 180 sec after rinsing.,,30,s,,,,,,rinsed off after 30seconds  with physiological saline ,,,,,,no,"eye irritation studies have demonstrated that undiluted Imexine OD is irritant to the rabbit eye. some irritant effects were also seen with 2.5% toluene-2,5-diamine solution in rabbits and undiluted toluene-2,5-diamine sulfate in the HET-CAM test. the intended on-head concentration is up to 7.2%",21,,,texapon asv 70 (sodium magnesium laurylmyristyl-6-ethoxy-sulfate) at a test concentration of 5% was used as reference substance with this internal benchmark being defined to be moderately irritating to the rabbit eye in vivo. ,,,,,,,,,,,,,,,,,,,,,,,,,,,,,,,,,,,,,,,,,,,,,,,,,,,,,,,,,,,,,,,,,,,,,,,,,,,,,,,,,,,,,,,,,,,,,,,,,,,,,,,,,,,,,,,,,,,,,,,,,,,,,,,,,,,,,,,,,,,,,,,,,,,,,,,,,,,,,,,,,,,,,,,,,,,,,,,,,,,,,,,,,,,,,,,,,,,,,,,,,,,,,,,,,,,,,,,,,,,,
sodium perborate  and perboric acid,,https://ec.europa.eu/health/scientific_committees/consumer_safety/docs/sccs_o_031.pdf,,treatment sites were assessed for the presence of irritation using a 4 point scale. a positive skin reaction included irritation of all grades at any time point. 1 of 26 test persons  showed a positive skin reaction while 21 of the 26 reacted to the positive control (SDS),,,,,,,,,,,,,,the material was evaluated as non-irritant to human skin,,,,,,,,,,,,,test substance: sodium perborate monohydrate,in vivo,human healthy ,,18 --> 65,year,,,,,26,,,,,,,,,,,,,,,,0.2 ,g,,single,dermal,,25mm pain hill top chamber containing a moisture Webril,applied onto the upper outer arm,,15 --> 4,progressively minutes to hours,,,,,,,,,,,,,,,,1996,no,,,,,positive control (SDS),"conclusion by ecb (2007):both, sodium perborate monohydrate and tetrahydrate tested in rabbits as a solid substance according to the criteria for classification should not be classified as skin irritants. however, in some studies with the monohydrate after prolonged exposure very mild irritating effects were observed which were not completely reversible in some cases. solutions of 10% sodium perborate tetrahydrate are mildly irritating. ",,,,,,,,,,,,,,,,,,,,,,,,,,,,,,,,,,,,,,,,,,,,,,,,,,,,,,,,,,,,,,,,,,,,,,,,,,,,,,,,,,,,,,,,,,,,,,,,,,,,,,,,,,,,,,,,,,,,,,,,,,,,,,,,,,,,,,,,,,,,,,,,,,,,,,,,,,,,,,,,,,,,,,,,,,,,,,,,,,,,,,,,,,,,,,,,,,,,,,,,,,,,,,,,,,,,,,,,,,,
sodium perborate  and perboric acid,,https://ec.europa.eu/health/scientific_committees/consumer_safety/docs/sccs_o_031.pdf,,"sodium perborate showed severe eye irritating effects when applied as solid substance, moderate corneal opacity, severe iritis and conjunctival effects which consisted of severe redness, moderate chemosis and severe discharge were recorded. the effects were not completely reversible. rinsing within 30 seconds after application reduced the severity of the effect considerably. also with lower concentrations than in standard protocols the effect was weaker. the irritating potential of sodium perborate tetrahydrate seems to be lower than for the monohydrate, being consistent with its higher water content.",,,,,,,,,,,,,,,,,solid,,,,,,,,,,test substance: sodium perborate monohydrate and tetrahydrate,in vivo,,,,,,,,,,,,,,,,,,,,,,,,,,,,,ocular,,,,,,,,,,,,,,,,,,,,,,,no,,"ici, 1986 a, b",,,,"conclusion by ECB (2007) :sodium perborate caused strong eye irritation in animal studies, the effects being not reversible in most of the animals tested. although the scores for irritation are not sufficientfor classification with R41, due to the irreversible effect, both sodium perboratemonohydrate and sodium perborate tetrahydrate are proposed to be classified with R41, ""risk of serious damage to eyes"".",,,,,,,,,,,,,,,,,,,,,,,,,,,,,,,,,,,,,,,,,,,,,,,,,,,,,,,,,,,,,,,,,,,,,,,,,,,,,,,,,,,,,,,,,,,,,,,,,,,,,,,,,,,,,,,,,,,,,,,,,,,,,,,,,,,,,,,,,,,,,,,,,,,,,,,,,,,,,,,,,,,,,,,,,,,,,,,,,,,,,,,,,,,,,,,,,,,,,,,,,,,,,,,,,,,,,,,,,,,
"quinolinium, 4-formyl-1-methyl-, salt with 4-methylbenzene sulfonic acid (1:1)",non OECD,https://ec.europa.eu/health/scientific_committees/consumer_safety/docs/sccs_o_080.pdf,,"the skin reaction was assessed according to the numerical scoring system listed in the guideline. well-defined erythema were noted in all animals at the 24 h examination and persisted through 15 days (1 animal), slightly decreased at the day examination (1 animal) or increased in severity at 48 h before diminishing to clear by day 15 (1 animal). very slight to slight oedema was observed in all animals at the 1 h or 24 h examination to disappear at 24-48 hour examination in two animals and persisting through 48 h in one animal. a very slight oedema still appeared in one animal at the 72 h examination. slight to moderate scaling was observed in all animals at the 7 day reading and persisted in one animal through 15 days.  no staining by the test substance of the treated skin was observed during the observation period. no irreversible alterations of the treated skin were observed in two animals nor were corrosive effects evident on the skin.",,,primary irritation score of 2.78. local signs (mean values from 24 to 72 hours) consisted of grade 2.22 erythema and grade 0.56 oedema,,,,,,,,,,,moe-hm-6116-190 is considered to be an irritant to rabbit skin.,,,,mosietened with bi-distilled water ,,,,97.9 ,,,,sat 990705,test substance: moe-hm-6116-190,in vivo,rabbit / new zealand white,,15,weeks,f & m,,,,3,,,,,,,,,,,,,,,,0.5 ,g,,single,"dermal, intact skin of the shaved area on the left side of the animals",,"semi-occlusive,  the dressing was wrapped around the abdomen and anchored with tape. surgical gauge patch (ca. 2.5 cm x 2.5 cm)",intact shaved skin on the left side,6,4,h,15," 1, 24, 48 and 72h as well as 7 and 15 days after removal ",,,,,,,,,after the exposure the dressing was removed and the skin was flushed with lukewarm tap water to clean the application site so that any reactions (erythema) were clearly visible at that time.,bi-distilled water,,,,,yes,,7,,,,"guideline: 92/69/EEC, b.4, acute toxicity – skin irritation. 1 male, 2 females",,,,,,,,,,,,,,,,,,,,,,,,,,,,,,,,,,,,,,,,,,,,,,,,,,,,,,,,,,,,,,,,,,,,,,,,,,,,,,,,,,,,,,,,,,,,,,,,,,,,,,,,,,,,,,,,,,,,,,,,,,,,,,,,,,,,,,,,,,,,,,,,,,,,,,,,,,,,,,,,,,,,,,,,,,,,,,,,,,,,,,,,,,,,,,,,,,,,,,,,,,,,,,,,,,,,,,,,,,,
"quinolinium, 4-formyl-1-methyl-, salt with 4-methylbenzene sulfonic acid (1:1)",non OECD,https://ec.europa.eu/health/scientific_committees/consumer_safety/docs/sccs_o_080.pdf,,"the ocular reaction was assessed according to the numerical scoring system listed in the guideline. moderate to marked (watery) discharge was observed in all animals at the 1h examination disappearing at the 72 h examination in 2 animals at the 48 h in one animal, but being described as moderate mucous discharge at the 24 h. the sclera was not visible at the 1 h examination in two animals, being moderately reddened in one of the two animals at the 24 and 48 h reading, diminishing in severity at the 72 h or being slightly reddened at the 24 h examination in the second animal. all animals were observed at the 7-day examination. the eye reactions were cleared in all animals within 7 days. the application of the test substance in healthy rabbit conjunctivae resulted in primary irritation score of 2.22.",,,2.22,,,,,,,,,,,moe-hm-6116-190 is considered to be irritating to rabbit eye under experimental conditions.,,,,,,,,97.9 ,,,,sat 990706,test substance: Moe-HM-6116-191,in vivo,rabbit / new zealand white,,15-17,weeks,f & m,,,,3,,,,,,,,,,,,,,,,0.1 ,g,,"single, test substance placed in the conjuctival sac of the left eye after pulling the lower lid away, the lids were gently held together for about one second to prevent loss of test substance, ",ocular,no,,,,,,7,"1, 24, 48, 78 and 168 h after application ",,,,,,,,,,,,,,,yes,,8,,,the right eye remained untreated and served as reference control,"guideine: 92/69/EEC, B.5, acute toxicity – eye irritation. 1 male, 2 females.",,,,,,,,,,,,,,,,,,,,,,,,,,,,,,,,,,,,,,,,,,,,,,,,,,,,,,,,,,,,,,,,,,,,,,,,,,,,,,,,,,,,,,,,,,,,,,,,,,,,,,,,,,,,,,,,,,,,,,,,,,,,,,,,,,,,,,,,,,,,,,,,,,,,,,,,,,,,,,,,,,,,,,,,,,,,,,,,,,,,,,,,,,,,,,,,,,,,,,,,,,,,,,,,,,,,,,,,,,,
resorcinol,OECD 404,https://ec.europa.eu/health/scientific_committees/consumer_safety/docs/sccs_o_015.pdf,,no cutaneous reactions were observed in any of the animals tested.,,,,,,,,,,,,,,a 2.5% aqueous solution of resorcinol was not irritant when applied to rabbit skin.,,,liquid,,,2.5,solution of the test substance in water ,98.8,,,,706030517,test substance: resorcinol,in vivo,rabbit/new zealand white ,,,,m,,,,3,,,,,,,,,,,,,,,,0.5 ,ml,,single dose,"dermal application on posterior right flank, the anterior right flank and the left flank ",,semi-occlusive dressing and a restraining bandage,resorcinol was placed on a dry gauze pad and then applied to a clipped area on the posterior right flank,,"4, 1, 3 ","h on the anterior right flank, h on the left flank, m on one animal ",4,"1, 24, 48 and 72 hours after removal of the dressing, and then daily until day 4",,,,,,,,,,water,,,,2004,yes,,2,,,untreated skin served as a control. ,,,,,,,,,,,,,,,,,,,,,,,,,,,,,,,,,,,,,,,,,,,,,,,,,,,,,,,,,,,,,,,,,,,,,,,,,,,,,,,,,,,,,,,,,,,,,,,,,,,,,,,,,,,,,,,,,,,,,,,,,,,,,,,,,,,,,,,,,,,,,,,,,,,,,,,,,,,,,,,,,,,,,,,,,,,,,,,,,,,,,,,,,,,,,,,,,,,,,,,,,,,,,,,,,,,,,,,,,,,,
resorcinol,OECD 405,https://ec.europa.eu/health/scientific_committees/consumer_safety/docs/sccs_o_015.pdf,,grade 1 conjunctival redness was observed in 2/3 animals on day 1 or day 2. no other ocular lesions were observed during the study.,grade 1 conjunctival redness,no,grade 1 conjuctival redness,,,,,,,,,,,a 2.5% aqueous solution of resorcinol caused mild conjunctival irritation to the rabbit eye.,,,liquid,,,2.5,solution of resorcinol in purified water ,98.8,,,,706030517,,in vivo,rabbit / new zealand white ,,,,,,,,3,,,,,,,,,,,,,,,,0.1,ml,,"single instillation into the conjunctival sac of the left eye, the upper and lower lids were held closed for about 1 second after application to avoid any loss of the test substance",ocular,,,,,,,3,"1hour, 24, 48 and 72hours",,,,,,,,fresh maintenance medium,no,purified water,,,,2004,yes,,3,,,the untreated right eye of each animal served as a control ,,,,,,,,,,,,,,,,,,,,,,,,,,,,,,,,,,,,,,,,,,,,,,,,,,,,,,,,,,,,,,,,,,,,,,,,,,,,,,,,,,,,,,,,,,,,,,,,,,,,,,,,,,,,,,,,,,,,,,,,,,,,,,,,,,,,,,,,,,,,,,,,,,,,,,,,,,,,,,,,,,,,,,,,,,,,,,,,,,,,,,,,,,,,,,,,,,,,,,,,,,,,,,,,,,,,,,,,,,,,
hydroxypropyl p-phenylenediamine and its dihydrochloride salt ,OECD 439,https://ec.europa.eu/health/sites/health/files/scientific_committees/consumer_safety/docs/sccs_o_230.pdf,,"at the end of the 42 hours ± 1 hour treatment period, each epidermis unit was transferred to 12- well plate containing a dye solution (mtt) except for the negative control and the test item-treated epidermis without mtt which were transferred into a 12-well plate containing fresh medium. plates were incubated for 3 hours approximately at 37°C. at the end of the incubation period, a biopsy of the entire epidermis was taken. for all tissues with the test item, the superficial epidermis layer (containing most of the remaining colour) was removed and discarded. the epidermis was separated from the collagen matrix and both were transferred into a tube containing 500 μL of acidified isopropanol. formazan crystals were extracted and stirred to homogenise the solution. 2 x 200 μL of each extract were transferred onto a 96-well plate and the optical density (OD) was measured at 570 nm versus acidified isopropanol. IL-1α released in the culture medium was determined by a classic quantitative sandwich enzyme immunoassay technique. the optical density (OD values related to the IL-1 α amount) was measured at 450 nm. ",,,,85.3%,,,,,,,,,85.3% (SD 5.2%) and the final IL-1α release was 4 pg/mL,"under the conditions of this study, the in vitro evaluation of acute skin irritation by using the reconstructed human epidermis EpiskinSM model, suggests that hydroxypropyl p-phenylenediamine HCl when tested at the concentration of 2% in water was considered as potentially non-irritating.",,,,,,2,raw material diluted at 2.0%  in water ,98,positive,positive,,R0025521B 004 P 001,test substance: hydroxypropyl p-phenylenediamine HCl,in vitro,,,,,,,,,3,"human reconstructed epidermis model Episkin, small model (0.38 cm2)",,3,,,,,,,,,,,,,2,%,0.01,,,,,,0.38,,,,3h after the end of  incubation time ,,15,m,room temperature,,37,42 ± 1 hour,,tissues were rinsed with PBS+,,,"for all tissues with the test item, the superficial epidermis layer (containing most of the remaining colour) was removed and discarded. the epidermis was separated from the collagen matrix and both were transferred into a tube containing 500 μL of acidified isopropanol. formazan crystals were extracted and stirred to homogenise the solution. 2 x 200 μL of each extract were transferred onto a 96-well plate and the optical density (OD) was measured at 570 nm versus acidified isopropanol. IL-1α released in the culture medium was determined by a classic quantitative sandwich enzyme immunoassay technique. the optical density (OD values related to the IL-1 α amount) was measured at 450 nm. the test item is predicted to be non-irritant when mean viability value is above 50 and final IL-1α release is below 50 pg/mL. the test item is predicted to be irritant when mean viability value is lower than (≤) 50% or final IL-1α release is above (≥) 50 pg/mL.",,2014,yes,"even though hydroxypropyl p-phenylenediamine 2HCl diluted to 2% w/w in water has a very low pH of 2, which may lead to corrosive effects, skin irritation was not detected in the in vitro Episkin study.","amsellem, 2014",,,"positive control: 10 µL of 50 mg/mL aqueous solution of sodium dodecyl sulfate; negative control: 10 µL of PBS+; solvent control: 10 µL of the water; dead dermis negative control: 10 µL of PBS+ tested in triplicate on dead epidermis, two additional negative controls (one dead and one alive tissue) which followed the same treatment as the negative control except the MTT incubation period were added, six additional tissues (three alive and three dead tissues) were used and followed the same treatment with the test item as the other tissues (except for the MTT incubation period). these tissues as well as the additional negative control were used as additional specific controls in order to quantify the ""non specific colour"" due to the colouring chemical interactions with the tissue. ",,,,,,,,,,,,,,,,,,,,,,,,,,,,,,,,,,,,,,,,,,,,,,,,,,,,,,,,,,,,,,,,,,,,,,,,,,,,,,,,,,,,,,,,,,,,,,,,,,,,,,,,,,,,,,,,,,,,,,,,,,,,,,,,,,,,,,,,,,,,,,,,,,,,,,,,,,,,,,,,,,,,,,,,,,,,,,,,,,,,,,,,,,,,,,,,,,,,,,,,,,,,,,,,,,,,,,,,,,,,
hydroxypropyl p-phenylenediamine and its dihydrochloride salt ,non OECD,https://ec.europa.eu/health/sites/health/files/scientific_committees/consumer_safety/docs/sccs_o_230.pdf,,,,,,,,,,,,,,,"the score obtained for hydroxypropyl p-phenylenediamine HCl at the concentration of 2% (w/w) in water after 30-minutes and 4-hour contact was 2.3±1.9 and 3.5±6.3, respectively. ","under the conditions of this study, the in vitro evaluation of the acute ocular irritation potential of hydroxypropyl p-phenylenediamine HCl at a concentration of 2% in the BCOP assay suggested that this ingredient is slightly irritant for the isolated bovine cornea after 30 minutes and 4 hours of contact.",,,,,,2,2%(w/w) in distilled water ,97.2,,,,R0025521B 004 P 001,,in vitro,,,,,,,,,,bovine cornea,cattle aged at least 9months collected from slaughterhouse and prepared within 4 hours after collection.  ,6,,,,,eyes that were too big or cornea showing defects were discarded.,basal opacity measured on the fresh corneas,"after a 1 hour±10 minutes pre-incubation period at 32±1°C, a first basal opacity measurement of the fresh corneas was performed.",,,,9 months,,,,0.75,,,,,,,,,,on fresh corneas and after 90minutes incubation with sodium fluorescein post incubation,,"30  ± 5, 4  ± 10","m ± m, h ± m",,,32 ± 1,"2 hours for 30 minutes incubation time, none for 4 hours incubation time",,yes after treatment period corneas were rinsed,,,"opacity again measured after incubation time. following the opacity readings, the permeability endpoint was measured. the cornea were brought into contact via the anterior chamber of the corneal holder with 1ml of a 0.5% (w/v) sodium fluorescein solution in PBS+ and incubated for 90±10 minutes at 32±1 °C. medium from the posterior compartment of the corneal holder was sampled to measure the optical density at 490nm. the corneal score which is the combination of opacity and permeability was then calculated.",,2012,yes,"the BCOP assay is an in vitro method that can be used to identify ocular corrosive and severe irritants, but not mild irritants. even though hydroxypropyl p-phenylenediamine 2HCl diluted to 2% w/w in water has a very low pH of 2, which may lead to corrosive effects, the BCOP assay did not indicate severe eye irritation. this, however, does not exclude mild or moderate eye irritancy potential. under the conditions of this study, a mild to moderate eye irritation potential of the test item cannot be excluded.","maillet, 2012",,,positive control: CTAB in distilled water; negative control: nutritive medium; negative and positive control substances were tested according to the same experimental conditions.,guideline: modified version of OECD 437,,,,,,,,,,,,,,,,,,,,,,,,,,,,,,,,,,,,,,,,,,,,,,,,,,,,,,,,,,,,,,,,,,,,,,,,,,,,,,,,,,,,,,,,,,,,,,,,,,,,,,,,,,,,,,,,,,,,,,,,,,,,,,,,,,,,,,,,,,,,,,,,,,,,,,,,,,,,,,,,,,,,,,,,,,,,,,,,,,,,,,,,,,,,,,,,,,,,,,,,,,,,,,,,,,,,,,,,,,,
polysilicone-15,non OECD,https://ec.europa.eu/health/scientific_committees/consumer_safety/docs/sccs_o_024.pdf,,,,,,,,,,,,,,,"no adverse reactions were found to any application. there were several deviations from the protocol, but none of these seemed sufficiently marked to make the results untrustworthy.",the authors concludes that the active ingredient shows no evidence of a potential for the production of sensitisation or irritation in this test,,,,,,10,solution in liquid paraffin,,,,,,,in vivo ,human,,,,f & m,,,,103,,,,,,,,,,,,,,,,0.4 ,ml,,"induction, 8 induction patches over 3 weeks, not all subjects achieved the full number of induction patches, but the trial lists decided that 6 or 7 induction patches (achieved in 11 subjects) could be accepted in the study. each site was inspected 24, 48, and 72 hours after each application (in some cases it was necessary to replace the 72 hour reading by a 96 hour reading). after the final induction patch a 2 week rest period was allowed, and the challenge patches were then applied, one to the original site and another to a new site on the opposite arm,",dermal,,occlusive,"the upper outer arm, provision was made for the use of an alternative site if a defined level of reaction was exceeded, but this appears to have been done once only, in which case sunburn had made it difficult to read any reaction and a new site was used instead. a problem with the study appears to have been a number of reactions to the plaster used to hold the patches in place, but these, it seems, were not generally so severe as to prevent reading of the sites; however, in 3 subjects it was severe enough to warrant the use of a new site for subsequent applications. ",,24,h,4,48 and 96 hours,,,,,,,,,,,,test carried out using a modified shelanski and shelanski procedure.,,,yes,"a repeated insult patch with modified Shelanski and Shelanski procedure. 11 subjects failed to cmplete the study for other reasons. dose applied to the upper outer arm,  a problem with the study appears to have been a number of reactions to the plaster used to hold the patches in place, but these, it seems, were not generally so severe as to prevent reading of the sites; however, in 3 subjects it was severe enough to warrant the use of a new site for subsequent applications.  the protocol originally seems to have called for the application of more than 8 induction patches, but following discussion with the sponsors 8 patches were deemed sufficient. not all subjects achieved the full number of induction patches, but the trial lists decided that 6 or 7 induction patches (achieved in 11 subjects) could be accepted in the study. the induction patches were applied over 3 weeks; each application was of 0.4 ml, and each site was inspected 24, 48, and 72 hours after each application (in some cases it was necessary to replace the 72 hour reading by a 96 hour reading). after the final induction patch a 2 week rest period was allowed, and the challenge patches were then applied, one to the original site and another to a new site on the opposite arm, for 24 hours. these sites were inspected 48 and 96 hours after the application. ",10,,,,"83 females and 20 males, eleven subjects failed to complete the study, for reasons unrelated to the testing procedures. the protocol lists various exclusion criteria, including a history of allergy or skin disease likely to interfere with the test, and previous participation in a test of this sort in the preceding 3 months.",,,,,,,,,,,,,,,,,,,,,,,,,,,,,,,,,,,,,,,,,,,,,,,,,,,,,,,,,,,,,,,,,,,,,,,,,,,,,,,,,,,,,,,,,,,,,,,,,,,,,,,,,,,,,,,,,,,,,,,,,,,,,,,,,,,,,,,,,,,,,,,,,,,,,,,,,,,,,,,,,,,,,,,,,,,,,,,,,,,,,,,,,,,,,,,,,,,,,,,,,,,,,,,,,,,,,,,,,,,
polysilicone-15,non OECD,https://ec.europa.eu/health/scientific_committees/consumer_safety/docs/sccs_o_024.pdf,,"clinical observations were carried out daily during the experiment, and body weights recorded before the experiment, 1 day after, and at termination of the experiment. necropsies were not carried out. a conventional scoring system was used to record the reactions.no abnormal clinical signs. body weights were as would be expected in this strain. skin at the area of application showed very slight erythema at 24 hours in one female animal. otherwise, no effect was noted. cumulative mean score for irritation was 0.11.",,,0.11,,,,,,,,,,,active ingredient showed no evidence of having an irritant action on the skin,,5,,,,,undiluted test substance,,,,,,,in vivo ,rabbit/ nzw white strain,,,,f & m,,,,3,,,,,,,,,,,,,,,,0.5,ml,,single,dermal,,semi-occlusive ,"24 hours before treatment, areas of the skin on the dorsum about 10 X 10 cm were prepared by clipping. the sites were inspected before treatment to ensure that the skin had not been damaged by the preparation",6,4,h,3,"1, 24, 48 and 72h after removal of dressing",,,,,,,,,yes washed with warm water ,,,,,,no,,4,,,,"1 male & 2 females, ",,,,,,,,,,,,,,,,,,,,,,,,,,,,,,,,,,,,,,,,,,,,,,,,,,,,,,,,,,,,,,,,,,,,,,,,,,,,,,,,,,,,,,,,,,,,,,,,,,,,,,,,,,,,,,,,,,,,,,,,,,,,,,,,,,,,,,,,,,,,,,,,,,,,,,,,,,,,,,,,,,,,,,,,,,,,,,,,,,,,,,,,,,,,,,,,,,,,,,,,,,,,,,,,,,,,,,,,,,,
