methoxypropylamino cyclohexenylidene ethoxyethylcyanoacetate (S87),OECD 437,https://ec.europa.eu/health/sites/health/files/scientific_committees/consumer_safety/docs/sccs_o_227.pdf,spectrophotometry,,,,ivis:  test substance: 5.4 ± 1.6,,490,,,,test item: mean opacity: 5.5 ± 1.6; mean permeability - 0.004 ± 0.002 ,,,, ivis value of c 1701 b_c_3 did not indicate a test item-related risk of serious damage to eyes. ,c-1701 b_c_3 does not cause serious eye damage,,,liquid,,,20,suspension in deionized water ,96.3,,,,c 1701/8,test substance: c-1701 b_c_3 no. 11/0473-3 ,in vitro,,,,,,,,,,fresh bovine corneas,"they were collected from the slaughterhouse from 12-16 month old donor cattle, and examined for defects",3,,,,," those presenting defects such as opacity, scratches, pigmentation etc. were discarded. the corneae were carefully removed from the eyes and mounted in a holder. ",,,,,,12-16months,,,,0.075,,,,,,,,,,,,4,h,32,,,,,,,,"permeability of the corneae was determined by measuring at 490 nm the transfer of 0.5% (w/v) sodium fluorescein upon incubation in a horizontal position for 90 minutes at about 32 °C. after a first basal opacity measurement of the fresh bovine corneae, 750 μL of the test item, the positive and the negative controls were applied onto the corneae and incubated for 4 hours at about 32 °C. after the incubation phase, the test item, the positive and the negative controls were each rinsed from the corneae and the opacity was measured again. ",,2012,yes,"due to an outlier, negative control values were not within the historical range. consequently, negative control corrections for permeability and opacity measurements were not performed for results obtained for the positive control and the test substance. based on the unambiguous results of the study, even without background corrections, the sccs has accepted that s87 does not cause serious eye damage. however, a mild or moderate eye irritation potential cannot be excluded.",21,,,"positive control: 20% (w/v) imidazole in deionised water and negative control: deionised water. the PC item demonstrated appropriate sensitivity (IVIS value within 2 SD of the laboratory’s historical mean value, i.e. 87.7-144.2) of the test system. negative control: mean opacity 1.5 ± 3.2; mean permeability 0.201 ± 0.358, ivis 4.5 ± 3.9, positive control: mean opacity 72.2 ± 6.4, mean permeability 3.847 ± 0.959, ivis 129.9 ± 16.4. ","bovine corneal opacity and permeability test, guideline:  commission regulation (EU) no 1152/2010, b.47; ",,,,,,,,,,,,,,,,,,,,,,,,,,,,,,,,,,,,,,,,,,,,,,,,,,,,,,,,,,,,,,,,,,,,,,,,,,,,,,,,,,,,,,,,,,,,,,,,,,,,,,,,,,,,,,,,,,,,,,,,,,,,,,,,,,,,,,,,,,,,,,,,,,,,,,,,,,,,,,,,,,,,,,,,,,,,,,,,,,,,,,,,,,,,,,,,,,,,,,,,,,,,,,,,,,,,,,,,,,,
methoxypropylamino cyclohexenylidene ethoxyethylcyanoacetate (S87),OECD 492,https://ec.europa.eu/health/sites/health/files/scientific_committees/consumer_safety/docs/sccs_o_227.pdf,spectrophotometry,yellow discoloration of the tissues was observed after washing. ,,,,"104%, ",570,,,,,,,,,c1701 b_c_3 did not show an eye irritation potential,,,,,,,,96.3,negative,positive,,c-1701/8,test substance: c-1701 b_c_3 no. 11/0473-3 ,in vitro,,,,,,,,,,epiocular™ human cornea model,tissues were wetted with 20 μl PBS and incubated for 30 minutes,2,,,,,,,,,,,,,8,mg,0.05,,,,,,0.6,,,,,,90,m,,,,18 hours,standard culture condition ,tissues were rinsed with pbs after 90minutes incubation ,,,"mtt assay for measuring cell viability: the medium was replaced by 300 µl of mtt solution. after a 3-hour incubation period, the mtt solution was removed and the tissues were washed with PBS. the formed formazan was extracted by incubation of the tissues in isopropanol at room temperature overnight or for at least 2 hours on a plate shaker. the optical density was determined spectrophotometrically at 570 nm (OD570). ",,2012,yes,"this study was performed prior to the acceptance of the official oecd tg 492 guideline for the epiocularTM test. however, an amount of 8 mg/0.6 cm2 or 13.33 mg/cm2 of s87 was applied on the tissue surface, being too low to accurately predict eye irritation potential. due to these shortcomings, sccs considers that the potential of s87 to be irritating to the eye cannot be excluded.",22,,,"positive control: methyl acetate and negative control: deionised water.the positive control item demonstrated appropriate sensitivity (relative viability < 50%, expected tissue viability of approximately 25%) of the tissues used under test conditions. nc: mean viability: 100%, inter-tissue variability: 8.7%; pc: mean viability: 16%, inter-tissue variability: 0.9%. test item-treated tissue: inter-tissue variablity: 0.7","guideline: mattek, epiocularTM human cell construct: procedure details version 3.1a; harbell j.w. et al. (2009): colipa program on optimization of existing in vitro eye irritation assays for entry into formal validation: technology transfer and intra/inter laboratory evaluation of epiocular assay for chemicals, poster #378, society of toxicology march 2009.",,,,,,,,,,,,,,,,,,,,,,,,,,,,,,,,,,,,,,,,,,,,,,,,,,,,,,,,,,,,,,,,,,,,,,,,,,,,,,,,,,,,,,,,,,,,,,,,,,,,,,,,,,,,,,,,,,,,,,,,,,,,,,,,,,,,,,,,,,,,,,,,,,,,,,,,,,,,,,,,,,,,,,,,,,,,,,,,,,,,,,,,,,,,,,,,,,,,,,,,,,,,,,,,,,,,,,,,,,,
methoxypropylamino cyclohexenylidene ethoxyethylcyanoacetate (S87),OECD 437,https://ec.europa.eu/health/sites/health/files/scientific_committees/consumer_safety/docs/sccs_o_227.pdf,spectrophotometry,,,,the ivis value of c-1701 b_c_3 diluted at 3% is quite similar to the vehicle control: 0.5 ± 0.1,,,,,,mean opacity: 0.3 ± 0.0; mean permeability: 0.009 ± 0.005,,,,,c-1701 b_c_3 diluted at 3% (w/w) in 50% dmso does not cause serious eye damage and can be classified as “no category”,,5.8,,,,3,test substance in 50% (w/w) dmso in pure water,99.4,,,,0009511412,test substance: e212657,in vitro,,,,,,,,,,fresh bovine corneas,they were collected at slaughterhouses  from 6-8 months old cattle and prepared within 4 hours of collection.  ,3,,,,,eyes that were too big or that had defects were rejected.,a first basal opacity measurement of the fresh bovine corneas,the corneas were carefully removed from the eyes and mounted in a holder and incubated for at least 1 hour at 32 ± 1 °C,,,,6-8 months old ,,,,0.075,,,,,,,,,,,,10 ± 1,m,32,,32 ± 1 °C,2h,,,dmso in pure water, 50% (w/w) ,"after the post-exposure incubation period, the opacity was measured again. thereafter, permeability of the corneas was determined by measuring spectrophotometrically at 490 nm the transfer of 0.4% (w/v) sodium fluorescein upon incubation for 90 ± 5 minutes at 32 ± 1 °C. ",,2019,yes,"the sccs agrees with the conclusions of the applicant. however, historical data for negative and positive controls are not provided. the ivis score for the negative control is not provided either.",23,,,"positive control: 10% (w/w) NaOH in pure water and negative control: 0.9% (w/v) NaCl in pure water, negative control: mean opacity 0.7 ± 0.6, mean permeability 0.001 ± 0.002, ivis not applicable; vehicle control (50% dmso): mean opacity 0.3 ± 1.0, mean permeability 0.009 ± 0.007, ivis 0.5 ± 1.0;  pc (10% w/w NaOH) mean opacity (± SD; n = 3)140.7 ± 5.8, mean permeability (± SD; n = 3) 5.989 ± 0.217, ivis (± SD; n = 3) 230.5 ± 7.2. all the validation criteria were met",,,,,,,,,,,,,,,,,,,,,,,,,,,,,,,,,,,,,,,,,,,,,,,,,,,,,,,,,,,,,,,,,,,,,,,,,,,,,,,,,,,,,,,,,,,,,,,,,,,,,,,,,,,,,,,,,,,,,,,,,,,,,,,,,,,,,,,,,,,,,,,,,,,,,,,,,,,,,,,,,,,,,,,,,,,,,,,,,,,,,,,,,,,,,,,,,,,,,,,,,,,,,,,,,,,,,,,,,,,,
methoxypropylamino cyclohexenylidene ethoxyethylcyanoacetate (S87),OECD 492,https://ec.europa.eu/health/sites/health/files/scientific_committees/consumer_safety/docs/sccs_o_227.pdf,spectrophotometry,"slight or moderate residues (light yellowish coloured) remained on the tissues treated with 8 mg or 50 mg test substance after the washing procedure. however, this did not interfere with the MTT assay as the test substance was not able to reduce mtt directly",,,,"50 mg, 8 mg and  3% application, 93.5%, 106.5% and 103.6%  realtive mean cell viability, respectively. ",570,,,,,,,,,c-1701 b_c_3 did not show an eye irritation potential,,,,,,3,"3 dosage groups: neat substance, neat substance and 3 % suspension of test substance in deionized water",99.5,negative,positive,,0009511412,test substance: c-1701 b_c_3 no. 11/0473-5 ,in vitro,,,,,,,,,,epiocular™ human cornea model,,2,,,,,,,tissues pre-wetted with 20µl pbs and incubated for 30-34 mins,,,,,,"50, 8, 3","mg neat substane, mg neat substance, % test substance in vehicle 50 μl volume",0.05,,,,,,0.6,,,,,,6,h,,,,18h,,,deionized water,,"cell viability was measured with the MTT assay. here the medium was replaced by 300 µl of MTT solution. after a 3-hour incubation period, the MTT solution was removed and the tissues were washed with PBS. the formed formazan was extracted by incubation of the tissues in isopropanol at room temperature overnight or for at least 2 hours on a plate shaker. the optical density was determined spectrophotometrically at 570 nm (OD570). ",,2019,yes,the sccs considers that s87 is not irritating to the eye at the use concentration and undiluted.,24,,,"positive control: methyl acetate and negative control: deionised water. application of the negative and positive control showed a relative viability of 21.9%. nc: mean relative vaiability: 100%, inter-tissue variability: 8.8%; pc: mean relative viability: 21.9%, inter-tissue variability: 6.7%. inter-tissue variability at 50mg dosed group: 13.5%; at 8mg : 2.9%, at 3%: 12.3%",,,,,,,,,,,,,,,,,,,,,,,,,,,,,,,,,,,,,,,,,,,,,,,,,,,,,,,,,,,,,,,,,,,,,,,,,,,,,,,,,,,,,,,,,,,,,,,,,,,,,,,,,,,,,,,,,,,,,,,,,,,,,,,,,,,,,,,,,,,,,,,,,,,,,,,,,,,,,,,,,,,,,,,,,,,,,,,,,,,,,,,,,,,,,,,,,,,,,,,,,,,,,,,,,,,,,,,,,,,,
hydroxyethyl-p-phenylenediamine sulfate ,non OECD,https://ec.europa.eu/health/scientific_committees/consumer_safety/docs/sccs_o_017.pdf,,,,,,,,,,,,,,,no skin reactions at all were observed at any observation time point.,"no indication of a skin irritating potential of 1-β-hydroxyethyl-2,5-diaminobenzene dihydrochloride tested at a 3 % aqueous solution in a repeated application assay in guinea pigs was noted.",,,,,,3,aqueous dilution thickened with 0.5% tylose,,,,,,"test substance: 1-β-hydroxyethyl-2,5-diaminobenzene dihydrochloride ",in vivo,guinea pig/ strain white pirbright (spf),,,,f,,,,15,,,,,,,,,,,,,,,,,,,"daily, for 5 consecutive days",dermal,,open,"clipped flank region by means of a brush. the skin was not covered, but animals were restrained from movement in order to avoid contact with the treated area during the first 5 hours after application. ",12,,,,5 hours after each application,,,,,,,,,,water,,,,1985,no,"although the experiment was not in compliance with guidelines and performed with the dihydrochloride instead of the sulfate, the data indicates that 1-β-hydroxyethyl-2,5- diaminobenzene dihydrochloride is not irritant to guinea pig skin at concentrations up to 3%. this applies probably also for the sulfate. ",19,,,,,,,,,,,,,,,,,,,,,,,,,,,,,,,,,,,,,,,,,,,,,,,,,,,,,,,,,,,,,,,,,,,,,,,,,,,,,,,,,,,,,,,,,,,,,,,,,,,,,,,,,,,,,,,,,,,,,,,,,,,,,,,,,,,,,,,,,,,,,,,,,,,,,,,,,,,,,,,,,,,,,,,,,,,,,,,,,,,,,,,,,,,,,,,,,,,,,,,,,,,,,,,,,,,,,,,,,,,,,,,
hydroxyethyl-p-phenylenediamine sulfate ,OECD 405,https://ec.europa.eu/health/scientific_committees/consumer_safety/docs/sccs_o_017.pdf,,"iridial irritation (grade 1 on a scale from 1-4) was observed in all animals after 1 and 24 hours. irritation of the conjunctiva was seen as redness, chemosis and discharge, which had completely resolved within 7 days in two animals and within 14 days in one animal. no corneal opacity was observed, and treatment of the eyes with 2% fluorescein revealed no corneal epithelial damage in any of the animals. there was no evidence of ocular corrosion. no staining of peri-ocular tissues by the test item was observed. ",,no,,,,,,,,,,,,"under the conditions of the test, undiluted betoxol was irritant to rabbit eyes.",,,,,,,aqueous paste,99.7,,,,"""j.robinson 10.7.89""",test substance: betoxol,in vivo,rabbit/ albino new zealand white (spf),,,,m,,,,3,,,,,,,,,,,,,,,,60,mg,0.1,,,,,,,,,,"1, 24, 48, and 72 hours as well as 7 and 14 days after application. further readings by means of fluorescein-instillation took place 24 h and 48 h after substance application. ",,,,,,,,,no,water to form paste,,,,1999,yes,,20,,,the right eye served as control.,,,,,,,,,,,,,,,,,,,,,,,,,,,,,,,,,,,,,,,,,,,,,,,,,,,,,,,,,,,,,,,,,,,,,,,,,,,,,,,,,,,,,,,,,,,,,,,,,,,,,,,,,,,,,,,,,,,,,,,,,,,,,,,,,,,,,,,,,,,,,,,,,,,,,,,,,,,,,,,,,,,,,,,,,,,,,,,,,,,,,,,,,,,,,,,,,,,,,,,,,,,,,,,,,,,,,,,,,,,,
hydroxyethoxyphenyl butanone ,non OECD,https://ec.europa.eu/health/sites/health/files/scientific_committees/consumer_safety/docs/sccs_o_225.pdf,mtt/elisa,"compared to the negative control, there were no changes in viability rates and IL-1α concentrations following application of HEPB. ",,,,100,,10 pg/mL for HEPB.,,,,,,,,undiluted hepb can be considered as potentially non-irritant to the skin.,,,solid,,,,test item: neat (100% powder) ,95.9,negative,no information provided in the study report ,,r0069279a 019 d 004,test substance: r0069279a,in vitro,,,,,,,,,,EPISKIN reconstructed human epidermis (RHE) small model ,"Skin Ethic Laboratories, 3 tissue batches, slightly wetted ",3,,,,,,,,,,,,,10,mg,0.01,,,,,,0.38,,,,,,15,m,room temperature,,37,42 hour ± 1 hour,fresh medium ,the tissues were rinsed with PBS+ after treatment,,,,,2012,yes,an ecvam validated protocol was used and certificates of analysis with IC50 values (for SDS) for each tissue batch were presented in annex of the study report. barrier function has been checked by determination of the concentration at which SDS reduces the viability of the tissues by 50% and the obtained values fell within the defined acceptance range.,1,,,"positive control: 5% (w/v) aqueous solution of sodium dodecyl sulphate (sds), negative control: pbs+. mean cell viability values obtained for negative and positive controls were 100% and 8.3%. the amounts of IL-1α released were not determined for the positive control. ",guideline: in vitro episkin skin irritation test. post-treatment temprature: °C,,,,,,,,,,,,,,,,,,,,,,,,,,,,,,,,,,,,,,,,,,,,,,,,,,,,,,,,,,,,,,,,,,,,,,,,,,,,,,,,,,,,,,,,,,,,,,,,,,,,,,,,,,,,,,,,,,,,,,,,,,,,,,,,,,,,,,,,,,,,,,,,,,,,,,,,,,,,,,,,,,,,,,,,,,,,,,,,,,,,,,,,,,,,,,,,,,,,,,,,,,,,,,,,,,,,,,,,,,,
hydroxyethoxyphenyl butanone ,OECD 437,https://ec.europa.eu/health/sites/health/files/scientific_committees/consumer_safety/docs/sccs_o_225.pdf,,detachment of the epithelium and oedema were observed. ,,,the mean ivis : 13.9 ± 0.6 ,,,,,,,,,,,hepb is not classified as corrosive or as a severe eye irritant.,,5.5,liquid (suspension),,,20,,95.9 ± 0.5%,,,,r0069279a 019 d 004,test substance: r0069279a,in vitro,,,,,,,,,,isolated bovine eyes,from cattle less than 12 months old. they were collected at slaughterhouses and prepared within 4 hours of collection.,3,,,,, eyes that were too big or were presenting defects were rejected. ,,the pre-incubation and equilibration period of the corneas of at least 1hour at 32 ± 1 C. ,,,,12 months old,,,,0.075,,,,,,,,,,,,4 ± 10 ,h ± min,,,,,,,poly ethylene glycol ,,"at the end of the contact period, corneas were rinsed and prepared to measure opacity (changes in light transmission) and permeability (evaluation of transfer of 5 mg/ml fluorescein through the cornea by measuring the optical density at 490 nm of the media in the ocular posterior compartment)",,2012,yes,"the sccs notes that the permeability (OD) values of the vehicle control are much higher (20-fold) than for the negative control, suggesting that the vehicle polyethylene glycol itself might have an adverse effect on the test system. therefore, the results of the bcop assay are inconclusive. an appropriate vehicle should be used for which it can be demonstrated that it has no adverse effect on the test system.",2,,,"positive control: 20% (w/w) imidazole in NaCl 0.9%, negative control: NaCl 0.9% in sterile water. the mean IVIS for the vehicle polyethylene glycol and the positive controls were 6.7 ± 0.7 and 182.1 ± 2.7, respectively. ",,,,,,,,,,,,,,,,,,,,,,,,,,,,,,,,,,,,,,,,,,,,,,,,,,,,,,,,,,,,,,,,,,,,,,,,,,,,,,,,,,,,,,,,,,,,,,,,,,,,,,,,,,,,,,,,,,,,,,,,,,,,,,,,,,,,,,,,,,,,,,,,,,,,,,,,,,,,,,,,,,,,,,,,,,,,,,,,,,,,,,,,,,,,,,,,,,,,,,,,,,,,,,,,,,,,,,,,,,,,
hydroxyethoxyphenyl butanone ,OECD 437,https://ec.europa.eu/health/sites/health/files/scientific_committees/consumer_safety/docs/sccs_o_225.pdf,,,,,the ivis scores obtained for 30-min contact time was: 4.7 ± 0.6  and the ivis scores obtained for 4-hour contact time was: 5.9 ± 0.1 ,,,,,,,,,,,hepb has at most a slight ocular irritation potential when tested at 2%,,5.5,liquid (suspension),,,2,,95.9 ± 0.5%,,,,r0069279a 019 d 004,test substance: r0069279a,in vitro,,,,,,,,,,isolated bovine eyes (corneas from cattle less than 12 months old),from cattle less than 12 months old. they were collected at slaughterhouses and prepared within 4 hours of collection. ,3,,,,,eyes that were too big or that had defects were rejected.,,the pre-incubation and equilibration period of the corneas of at least 1hour at 32 ± 1 C. ,,,,12 months old,,,,0.075,,,,,,,,,,,,"30, 4 ","min, h",,,,,,,polyethylene glycol (8 OE),,"at the end of the contact period, corneas were rinsed and prepared to measure opacity (changes in light transmission) and permeability (evaluation of transfer of 5 mg/ml fluorescein through the cornea by measuring the optical density at 490 nm of the media in the ocular posterior compartment)",,2012,yes,"the sccs notes that the permeability (OD) values of the vehicle control are much higher (8-fold for the 4-hour treatment period) than the negative control, suggesting that the vehicle polyethylene glycol itself might have an adverse effect on the test system. therefore, the results of the bcop assay are inconclusive. an appropriate vehicle should be used for which it can be demonstrated that it has no adverse effect on the test system. the sccs further notes that the bcop assay (oecd 437, 2009) is only able to identify severe eye irritants and cannot discriminate between slightly irritant, moderately irritant and severely irritant.",3,,,"positive control: 0.5 % (w/w) cetyl trimethylammonium bromide (CTAB) in distilled water, negative control: nutritive medium. negative, vehicle and positive controls were tested according to the same experimental conditions except that the 4-hour treatment period was not performed on the positive control. the mean ivis was  3.9 ± 0.6 for the vehicle control, and 96.0 ± 2.8 for the positive control, respectively.",guideline: OECD 437 with some deviations. ,,,,,,,,,,,,,,,,,,,,,,,,,,,,,,,,,,,,,,,,,,,,,,,,,,,,,,,,,,,,,,,,,,,,,,,,,,,,,,,,,,,,,,,,,,,,,,,,,,,,,,,,,,,,,,,,,,,,,,,,,,,,,,,,,,,,,,,,,,,,,,,,,,,,,,,,,,,,,,,,,,,,,,,,,,,,,,,,,,,,,,,,,,,,,,,,,,,,,,,,,,,,,,,,,,,,,,,,,,,
hydroxyethoxyphenyl butanone ,OECD 437,https://ec.europa.eu/health/sites/health/files/scientific_committees/consumer_safety/docs/sccs_o_225.pdf,,,,,the ivis score obtained for 10-min contact time were: 0.7 ± 0.9,,,,,,,,,,,hepb does not require classification for eye irritation or serious eye damage,,5.8,liquid (suspension),,,0.7,,95.9± 0.5%,,,,r0069279a 019 d 004,test substance: r0069279a,in vitro,,,,,,,,,,isolated bovine eyes ,corneas from cattle 6-8 months old they were collected at slaughterhouses and prepared within 4 hours of collection. ,3,,,,,eyes that were too big or that had defects were rejected.,,the pre-incubation and equilibration period of the corneas of at least 1hour at 32 ± 1 C. ,,,,6-8 months old,,,,0.075,,,,,,,,,,,,10 ± 1,m,,,,,,,propylene glycol (batch no dga17d0318) in distilled water,30,,,2018,yes,"according to sccs, the test substance should have been tested using the protocol for a non-surfactant solid, not a liquid. based on the study conducted, no conclusion can be made on the classification of hepb for eye irritation or serious eye damage.",4,,,"positive control: 10% (w/w) NaOH in sterile water, negative control: 0.9% (w/v) NaCl in sterile water, the mean ivis was 1.0 ± 1.2 for the vehicle control, and 249.6 ± 4.1 for the positive control, respectively.",,,,,,,,,,,,,,,,,,,,,,,,,,,,,,,,,,,,,,,,,,,,,,,,,,,,,,,,,,,,,,,,,,,,,,,,,,,,,,,,,,,,,,,,,,,,,,,,,,,,,,,,,,,,,,,,,,,,,,,,,,,,,,,,,,,,,,,,,,,,,,,,,,,,,,,,,,,,,,,,,,,,,,,,,,,,,,,,,,,,,,,,,,,,,,,,,,,,,,,,,,,,,,,,,,,,,,,,,,,,
hydroxyethoxyphenyl butanone ,OECD 492,https://ec.europa.eu/health/sites/health/files/scientific_committees/consumer_safety/docs/sccs_o_225.pdf,,mtt (cell viability was assessed by measuring the optical density of the extracts at 570nm),,,,89.9 ± 3.7% ,,,,,,,,neither the test item nor the vehicle were found to have direct mtt reducing properties or colouring potential.,,"hebp, as well as the vehicle substance propylene glycol, does not require classification for eye irritation or serious eye damage.",,5.8,liquid (suspension),,,0.67,,95.9± 0.5%,negative,negative,,r0069279a 019 d 004,test substance: r0069279a,in vitro,,,,,,,,,,skinethic reconstructed HCE® model,tissues were pre-moistened with 10µl pbs.,3,,,,,,,,,,,,,60,µl/cm2,,,,,,,0.5,,,,,,30 ± 2 ,m,37°C,,,30 ± 2 min,fresh medium,"after incubation time, tissues were rinsed with PBS and extracted in isopropanol overnight.",propylene glycol,,"post-treatment incubated for 30 ± 2 min with fresh medium, blotted on absorbent material and then incubated with mtt solution for another 3 hours ± 15 min. after incubation time, tissues were rinsed with pbs and extracted in isopropanol overnight. cell viability was assessed by measuring the optical density of the extracts at 570nm.",,2018,yes,"based on the newly submitted data, sccs considers that hepb is not irritating to the eye at 0.7% (w/w) in propylene glycol.",5,"preliminary tests were performed to detect the ability of the test item and the vehicle to directly reduce MTT as well as its colouring potential. following the preliminary tests, the eye irritation potential of the test item formulation was assessed in the main test.",,"positive control: methyl acetate, negative control: Ca2+/Mg2+-free phosphate buffered saline (PBS- ). cell viability for the vehicle control, 100 ± 6.7% for the negative control and 22.7 ± 2.8% for the positive control,respectively.",,,,,,,,,,,,,,,,,,,,,,,,,,,,,,,,,,,,,,,,,,,,,,,,,,,,,,,,,,,,,,,,,,,,,,,,,,,,,,,,,,,,,,,,,,,,,,,,,,,,,,,,,,,,,,,,,,,,,,,,,,,,,,,,,,,,,,,,,,,,,,,,,,,,,,,,,,,,,,,,,,,,,,,,,,,,,,,,,,,,,,,,,,,,,,,,,,,,,,,,,,,,,,,,,,,,,,,,,,,,
hc yellow n°9,non OECD,https://ec.europa.eu/health/scientific_committees/consumer_safety/docs/sccs_o_026.pdf,,"the skin was examined for erythema, eschar, formation and oedema. yellow coloration of the skin caused by the test material was seen at all treated sites, but interference with evaluation of erythema was not reported. erythema was noted in two animals at both intact and abraded sites at the 1 hour observation. no oedema was reported.",,,,,,,,,,,,,, the substance was non-irritant to the skin of the albino rabbit,,,,moistened with 0.5 ml of distilled water,,,,,,,,op 10,test substance: hc yellow n°9,in vivo ,rabbit/new zealand albino,,,,f & m,,,,3,,,,,,,,,,,,,,,,0.5,g,,,dermal,,occlusive , intact and abraded skin,6.25,24,h,,1 and 48 hours after removal of the patches,,,,,,,,,test susbatnce removed by swabbing with cotton wool swabs,,,,,,yes,,3 (subm.1),,,,"2 males and 1 female, as possible irritant effects were anticipated, the dosage form was first evaluated on a single animal. three different durations were investigated: 3 minutes, 1 hour and 4 hours. since the dosage form was not severely irritant on this first animal, it was then applied for 4 hours to two other animals. ",,,,,,,,,,,,,,,,,,,,,,,,,,,,,,,,,,,,,,,,,,,,,,,,,,,,,,,,,,,,,,,,,,,,,,,,,,,,,,,,,,,,,,,,,,,,,,,,,,,,,,,,,,,,,,,,,,,,,,,,,,,,,,,,,,,,,,,,,,,,,,,,,,,,,,,,,,,,,,,,,,,,,,,,,,,,,,,,,,,,,,,,,,,,,,,,,,,,,,,,,,,,,,,,,,,,,,,,,,,
