Dossier,Guideline,type of study,PDF link,observations,dose related increase in mutant frequency,mean number of mutants /dose,moribound or dead animals prior to study termination,conclusion,homogeneity,pH,concentration (%),composition,purity (%),solubility in vehicle,chemical batch nr,additional info,species/strain,source,age at start of experiment,sex,feed,method of euthanasia,n animals / group,dose levels,dose volume,administration scheme,oral,% of body surface,area of body,inhalation,vehicle,sampling time,transgenic model,method for DNA isolation,method for molecular analysis of mutants,SCCS comment to test,year,GLP,Ref. in dossier,range-finding study study,Control group,Study duration,additional info,own comment,observations,tissues with significant increase in DNA strand breaks,moribound or dead animals prior to study termination,cytotoxicity,conclusion,homogeneity,pH,concentration (%),composition,purity (%),solubility in vehicle,chemical batch nr,Tmax,additional info,species/strain,source,age at start of experiment,sex,feed,n animals / group,dose levels,administration scheme,oral,% of body surface,area of body,inhalation,intravenous,subcutaneous,time between sampling and last treatment (h),cell/nuclei isolation method ,method for scoring and measuring comets,SCCS comment to test,year,GLP,Ref. in dossier,range-finding study,control groups,Study duration,additional info,own comment,observations and recording,dose with significant increase in positive cells,moribound or dead animals prior to study termination,cytotoxicity measurment,viability of cells,conclusion,homogeneity,pH,concentration (%),composition,purity (%),solubility in vehicle,chemical batch nr,Tmax,additional info,species/strain,source,age at start of experiment,sex,feed,n animals / group,dose levels,administration scheme,dose volume,oral,% of body surface,area of body,inhalation,intravenous,subcutaneous,vehicle,method of liver cell preparation and autoradiographic technique,time between sacrifice and last treatment (h),number of cells scored,number of slides prepared,SCCS comment to test,year,GLP,Ref. in dossier,range-finding study,control groups,Study duration,additional info,own comment,observations,dose with significant increase in positive cells,moribound or dead animals prior to study termination,conclusion,homogeneity,pH,concentration (%),composition,purity (%),solubility in vehicle,chemical batch nr,Tmax,additional info,species/strain,source,age at start of experiment,sex,feed,n animals / group,dose levels,volume,administration scheme,oral,% of body surface,area of body,inhalation,intravenous,intraperitoneal,subcutaneous,vehicle,time between last treatment and sacrifice  (h),bone marrow or blood used for isolation,number of cells analyzed /animal,method to characterize micronuclei,SCCS comment to test,year,GLP,Ref. in dossier,preliminary study,control,Study duration,additional info,own comment,observations,dose with significant increase in positive cells,mean number of cells with abberations /dose,changes in ploidy,moribound or dead animals prior to study termination,conclusion,homogeneity,pH,concentration (%),composition,purity (%),solubility in vehicle,chemical batch nr,Tmax,additional info,species/strain,source,age at start of experiment,sex,feed,n animals / group,dose levels,administration scheme,oral,% of body surface,area of body,inhalation,intravenous,subcutaneous,vehicle,time between last treatment and sacrifice  (h),number of cells analyzed /animal,method used for staining,Study duration,preliminary study $,controls,SCCS comment to test,year,GLP,Ref. in dossier,additional info,own comment,resume,positive result at dose,positive result at dose + S9,outcome,conclusion,homogeneity,pH,concentration (%),composition,purity (%),solubility in vehicle,chemical batch nr,Tmax,additional info,strain,source,plate incorporation or pre-incubation,number of cells /culture,media,dose levels,amount of test substance /plate,type and composition of metabolic activation system,concentration metabolic activation system (%),temperature ,incubation period,replicates /dose,vehicle,SCCS comment to test,year,GLP,Ref. in dossier,preliminary study,control groups,Study duration,additional info,own comment,positive result at dose short term,positive result at dose short term + S9,positive result at dose long term,outcome,conclusion,homogeneity,pH,concentration (%),composition,purity (%),solubility in vehicle,chemical batch nr,additional info,cell line,source,media,number of passages,replicates /dose,dose levels,type and composition of metabolic activation system,concentration metabolic activation system (%),temperature ,exposure period short term ( incubation +harvest),exposure period long term (incubation + harvest),metaphases scored /concentration,vehicle,Study duration,preliminary study ,control groups,SCCS comment to test,year,GLP,Ref. in dossier,additional info,own comment,positive mutant frequency result at dose,positive mutant frequency result at dose + S9,relative cell survival % at dose, relative cell survival % at dose + S9,outcome,conclusion,homogeneity,pH,concentration (%),composition,purity (%),solubility in vehicle,chemical batch nr,additional info,cell line,source,media,number of passages,replicates /dose,dose levels,type and composition of metabolic activation system,concentration metabolic activation system (%),temperature ,exposure period ( incubation + expression + selection),vehicle,SCCS comment to test,year,GLP,Ref. in dossier,preliminary study,control groups,Study duration,additional info,own comment,positive result at dose short term,positive result at dose short term + S9,positive result at dose long term,outcome,conclusion,homogeneity,pH,concentration (%),composition,purity (%),solubility in vehicle,chemical batch nr,additional info,cell line,source,media,number of passages,replicates /dose,dose levels,temperature ,exposure period short term ( incubation +harvest),exposure period long term (incubation + harvest),metaphases scored /concentration,vehicle,Study duration,SCCS comment to test,year,GLP,Ref. in dossier,additional info,own comment,positive (mnbn cell and cytotoxicity)result at dose short term,positive result at dose short term + S9,positive result at dose long term,outcome,conclusion,homogeneity,pH,concentrations (actual and nominal),composition,stability,purity (%),solubility in vehicle,chemical batch nr,additional info,cell line,source,preparation of culture,media,number of passages,number of cells /culture,replicates /dose,dose levels,temperature ,exposure period short term ( incubation +harvest),exposure period long term (incubation + harvest),metaphases scored /concentration,type and composition of metabolic activation system,presence or absence of cytoB,cytotoxicity measurment ,vehicle,SCCS comment to test,year,GLP,Ref. in dossier,controls (positive and negative),preliminary test,Study duration,additional info,own comment,positive result at dose short term,positive result at dose short term + S9,positive result at dose long term,outcome,conclusion,homogeneity,pH,concentration (%),composition,purity (%),solubility in vehicle,chemical batch nr,additional info,species/strain,source,sex,n animals / group,dose levels,administration scheme,route of exposure,sacrifice times,vehicle,Study duration,SCCS comment to test,year,GLP,Ref. in dossier,additional info,own comment
"1,2,4-trihydroxybenzene ",471,in vitro ,https://ec.europa.eu/health/sites/health/files/scientific_committees/consumer_safety/docs/sccs_o_222.pdf,,,,,,,,,,,,,,,,,,,,,,,,,,,,,,,,,,,,,,,,,,,,,,,,,,,,,,,,,,,,,,,,,,,,,,,,,,,,,,,,,,,,,,,,,,,,,,,,,,,,,,,,,,,,,,,,,,,,,,,,,,,,,,,,,,,,,,,,,,,,,,,,,,,,,,,,,,,,,,,,,,,,,,,,,,,,,,,,,,,,,,,,,,,,,,,,,,,,,,,,,,,,,,,,,,,,,"yes, 3.8-fold maximum increase at 150 μg per plate; 3.3-fold increase at 200 μg per plate","expB1: no positive mutagenic responses were observed with any of the tester strains (including TA98) in either the presence or absence of S9 activation. an increase in revertant counts (3.5-fold at 100 μg per plate; 3.0-fold at 150 μg per plate; 4.0-fold maximum increase at 500 μg per plate that induced moderate toxicity) with tester strain TA1537 in the absence of S9 activation was observed. while this increase is an indicator of mutagenic activity, it was not evaluated as positive because of the variability in the individual revertant counts. this variability precluded demonstration of a definitive dose response, which is required for a positive evaluation. no precipitate was observed. toxicity was observed beginning at 500 or at 5000 μg per plate. to confirm the mutants, replicate plates were prepared for the following dose levels and the corresponding vehicle controls with tester strain TA1537 in the absence of S9 activation: 100, 150 and 500 μg per plate. the replicate plates confirmed that the correct colonies were evaluated as revertants. expB2: tester strain TA1537 in the absence of S9 activation was retested inthis experiment with an adjustment in dose levels to clarify the response observed. in exp B2, the dose levels tested were 5.0, 15, 50, 150, 200, 300, 400, 500, 600, 750 and 1500 μg per plate. a positive mutagenic response (3.8-fold maximum increase at 150 μg per plate; 3.3-fold increase at 200 μg per plate) was observed with tester strain TA1537 in the absence of S9 activation. This response was evaluated as positive because the revertant counts demonstrated a dose response, yielding average revertant counts of 4 for the vehicle, 6 to 8 at 5.0 to 50 μg per plate and 13 to 15 at 150 to 200 μg per plate, with the maximum revertant counts being outside of the upper 95% control limit of 13. No precipitate was observed. Toxicity was observed beginning at 300 μg per plate. This repeat experiment meets the criteria for a positive response in TA1537 in the absence of S9 activation. ","all criteria for a valid study were met as described in the protocol. the results of the bacterial reverse mutation assay indicate that, under the conditions of this study, 1,2,4 trihydroxybenzene induced a positive mutagenic response with tester strain TA1537 in the absence of Aroclor-induced rat liver S9. elevated revertant counts that exceeded the upper 95% control limit were observed in two trials. in one trial, there was a definitive dose response, and in the other trial, there was none. these increases were just over the minimum 3.0-fold increase required for evaluation as positive in TA1537, which suggests the presence of a weak or low-level mutagen. ",,,,,99.5 (provided by the Sponsor in the protocol) 97.8% (per results report),,THB0200312,,"test substance :1,2,4-trihydroxybenzene","salmonella typhimurium strains TA98, TA100, TA1535, TA1537, TA102",,,,,,"experiment B1 :+S9 mix plate incorporation test: all S. strains: 0, 15, 50, 150, 500, 1500 and 5000 μg/plate, :-S9 mix plate incorporation test: all S. strains: 0, 15, 50, 150, 500, 1500 and 5000 μg/plate, experiment B2 (retest assay with TA1537 strain) – Plate incorporation test: -S9 mix plate incorporation test: 0, 5.0, 15, 50, 150, 200, 300, 400, 500, 600, 750 and 1500 μg per plate","rat liver homogenate metabolising system (induced with Aroclor 1254, 10% liver S9 in standard co-factors)",,,,3,water (stock solution of A33 at 50 mg/mL in water was degassed with nitrogen with calcium carbonate as trap),"the results of the study indicate a clear mutagenic effect of 1,2,4-trihydroxybenzene in the absence of S9 mix in TA1537 strain. the SCCS noted considerable width of range of revertant numbers in historical negative and positive controls (especially for TA1537 strain), with no information on the number of studies performed. ",2015,yes,14,,,11 months,"two independent experiments, exp A (range finding) – plate incorporation test: ±S9 mix: all S. typhimurium strains: 0, 6.7, 10, 33, 67, 100, 333, 667, 1000, 3333 and 5000 μg/plate, positive control: -S9 mix: 2-nitrofluorene (2NF): 1 μg/plate for TA98; sodium azide (NaN3): 1 μg/plate for TA100, TA1535; 9-aminoacridine (AAC): 75 μg/plate for TA1537; mitomycin C (MMC): 1 μg/plate for TA102 +S9 mix: 2-Aminoanthracene (AAN): 1 μg/plate for TA98 and TA1535 or 2 μg/plate for TA100 and TA1537; sterigmatocystin: 15 μg/plate for TA102, Ames plate incorporation method, 1,2,4trihydroxybenzene in degassed deionized water, at concentrations of 0.253 and 43.7 mg/mL, was stable on wet ice for at least 2 hours. concentration analysis of the formulation samples collected prior to dosing indicated that the actual mean concentrations of the analysed low dose (0.50 mg/mL) and high dose (50 mg/mL) formulations in the initial mutagenicity assay were 86.5 and 88.2% of their respective target concentrations with < 5.0% relative standard deviation (RSD); and the actual mean concentrations of the analysed low dose (0.50 mg/mL) and high dose (15 mg/mL) formulations in the retest mutagenicity assay were 90.5 and 88.0% of their respective target concentrations with < 5.0% RSD. for information purposes only, the samples used to dose the main study were analysed at the end of dosing. for Experiment B1, the 0.050 mg/mL low dose formulation submitted to the analytical laboratory after dosing was the incorrect sample and was below the validated range. nevertheless, the result was found to be quantitative. the results of the analyses for Experiment B1 found the low and high doses to be 77.1% and 86.8% of target, respectively. the results of the analyses for experiment B2 found the low and high doses to be 89.0% and 84.7% of target, respectively. this indicates that the test article concentrations decreased only slightly during the dosing period.  preliminary toxicity assay: In this test, the maximum dose tested was 5000 μg per plate. this dose was achieved using a concentration of 50 mg/mL and a 100 μL plating aliquot. an increase in revertant counts (2.9 fold maximum increase) was observed only at 100 μg per plate with tester strain TA98 in the absence of S9 activation, with higher doses demonstrating toxicity. no precipitate was observed. toxicity was observed beginning at 333, 667, 1000 or 3333 μg per plate. based on the findings of the toxicity assay, the maximum dose tested in the mutagenicity assay was 5000 μg per plate. ",,,,,,,,,,,,,,,,,,,,,,,,,,,,,,,,,,,,,,,,,,,,,,,,,,,,,,,,,,,,,,,,,,,,,,,,,,,,,,,,,,,,,,,,,,,,,,,,,,,,,,,,,,,,,,,,,,,,,,,,,,,,,,,,,,,,,,,,,,,,,,,,,,,,,,,,,,,,,,,,,,,,,,,,,
"1,2,4-trihydroxybenzene ",471,in vitro ,https://ec.europa.eu/health/sites/health/files/scientific_committees/consumer_safety/docs/sccs_o_222.pdf,,,,,,,,,,,,,,,,,,,,,,,,,,,,,,,,,,,,,,,,,,,,,,,,,,,,,,,,,,,,,,,,,,,,,,,,,,,,,,,,,,,,,,,,,,,,,,,,,,,,,,,,,,,,,,,,,,,,,,,,,,,,,,,,,,,,,,,,,,,,,,,,,,,,,,,,,,,,,,,,,,,,,,,,,,,,,,,,,,,,,,,,,,,,,,,,,,,,,,,,,,,,,,,,,,,,,,"negative/in both the standard and control assays, the negative and positive controls met the acceptance criteria and the study was considered valid. three-fold (minimum criteria for a positive response) or greater increases in mutation frequency in TA 1537 were observed at 150 and 175 μg/plate 1,2,4-THB (standard method) and at 150, 175 and 200 μg/plate (control method). toxicity was observed at 250 and 500 μg/plate. no precipitate was observed. treatments with 1,2,4-THB with GSH (5-10 μM) were negative whereas at 15 µM GSH, 175 and 200 μg/plate 1,2,4-THB were still positive (3.6 and 3.2-fold increase in mutations respectively). all concentrations of 1,2,4-THB were negative in the presence of catalase at all doses (1000, 10,000, 20,000 IU). Toxicity was also reduced in the presence of catalase but not with GSH","under the conditions of this study, the previous mutagenic effect of 1,2,4-THB in TA1537 in the absence of metabolic activation (GLP study # AE03RS.502.BTL, 2015) was reproduced. this mutagenic effect was eliminated in the presence of 5 μM and 10 μM GSH, and in the presence of 1,000, 10,000 and 20,000 Units of catalase.  catalase also reduced the toxicity of 1,2,4-THB. ",,,,,98.1,,THB0318002 ,,"test substance :1,2,4-trihydroxybenzene",salmonella typhimurium TA1537 ,,plate incorporation,,,"100, 150, 175, 200, 250, 500 µg/plate without scavengers or metabolic activation. the same concentrations of 1,2,4-THB with 1000, 10,000 or 20,000 IU catalase or 5, 10 or 15 µM GSH",,,,,48-72h incubation in the absence of metabolic activation,3,deaerated water (N2-purged) ,"in the comment to the study #14 SMVI (Bacterial Reverse Mutation Assay of 1,2,4Trihydroxybenzene, BioReliance Corporation, Wagner, V.O., Report issued August 10, 2015) the SCCS indeed stated that the results of the study indicated a clear mutagenic effect of 1,2,4-THB in the absence of S9 mix in TA1537 strain. however, in the previous opinion (SCCS 1452/11, Ref. 1) the SCCS stated that 1,2,4-THB induced gene mutations in bacteria (a slight but reproducible mutagenic activity in S. typhimurium TA98 and TA100 without metabolic activation) but not in mammalian cells. it is therefore not clear why the applicant performed the additional studies with antioxidant factors using S. typhimurium TA1537 strain only.  TA1537 strain is known for very low spontaneous revertant numbers (Mortelmans K., E. Zeiger. Mutation Research 455 (2000) 29–60, Ref. 21) hence detection of any inhibitory effect of an anti-oxidant on a relatively weak mutagenic effect of A33 is a priori more difficult, compared to other strains (TA98 and TA100). It would therefore be more relevant to conduct the studies in the latter two strains. - the effect of GSH on the mutagenic effect of A33 is not clear. the applicant admitted that the results with GSH at 15 µM “are positive with a 3.6-fold, maximum increase. the results are dose-responsive, and the mean revertant count at the dose level where the maximum fold increase was observed is outside of the 95% HCL”. the SCCS has performed additional statistical analysis of all the results, which indicate that: there was a significant effect of GSH at 5 µM when A33 was used at 150-250 µg/plate; no effect of GSH at 10 µM; and separated significant effects of GSH at 15 µM when A33 was used at 150 or 250 µg/plate. overall, the effects of GSH seemed to be random and not concentration-dependent. ",2019,yes,17,,,1 month,"partially accorded to OECD471 since only one test strain, assay modifications: standard Assay, i.e. 1,2,4-THB alone, where all components are added to a tube containing 2.0 mL of molten selective top agar at 45±2°C and control Assay, i.e. 1,2,4-THB alone, where 2.0 mL of molten selective top agar is the last component added to the tube. the aim of the study: the purpose of this study was to evaluate the effect of radical scavengers, catalase and Lglutathione reduced (GSH) on the mutagenic response of 1,2,4-THB in S.typhimurium TA1537 without metabolic activation, that had been observed in a previous GLP study (SCCS 1598/18, Ref 14). dose solutions were prepared in deaerated water in a glove box where an inert environment was maintained with nitrogen gas in order to minimize the air oxidation of 1,2,4-THB prior to application. the actual concentration of the test substance in the dose solutions was determined by UPLC-UV using a validated method.  both a concurrent vehicle (degassed water) and 9 aminoacridine positive control were used. standard assay controls were conducted where the components were added to a tube already containing the molten top agar to verify the previously observed mutagenic response. in the treatments including scavengers, all the components were mixed before the molten top agar was added to provide exposure of the bacteria to the test article and ROS scavenger directly. controls were conducted without scavengers following the same procedure where the top agar was added last.",,,,,,,,,,,,,,,,,,,,,,,,,,,,,,,,,,,,,,,,,,,,,,,,,,,,,,,,,,,,,,,,,,,,,,,,,,,,,,,,,,,,,,,,,,,,,,,,,,,,,,,,,,,,,,,,,,,,,,,,,,,,,,,,,,,,,,,,,,,,,,,,,,,,,,,,,,,,,,,,,,,,,,,,,
"1,2,4-trihydroxybenzene ",487,in vitro ,https://ec.europa.eu/health/sites/health/files/scientific_committees/consumer_safety/docs/sccs_o_222.pdf,,,,,,,,,,,,,,,,,,,,,,,,,,,,,,,,,,,,,,,,,,,,,,,,,,,,,,,,,,,,,,,,,,,,,,,,,,,,,,,,,,,,,,,,,,,,,,,,,,,,,,,,,,,,,,,,,,,,,,,,,,,,,,,,,,,,,,,,,,,,,,,,,,,,,,,,,,,,,,,,,,,,,,,,,,,,,,,,,,,,,,,,,,,,,,,,,,,,,,,,,,,,,,,,,,,,,,,,,,,,,,,,,,,,,,,,,,,,,,,,,,,,,,,,,,,,,,,,,,,,,,,,,,,,,,,,,,,,,,,,,,,,,,,,,,,,,,,,,,,,,,,,,,,,,,,,,,,,,,,,,,,,,,,,,,,,,,,,,,,,,,,,,,,,,,"the dose levels selected for analysis of micronucleus test in the non-activated 4-hour exposure group were 12.5, 25, and 50 μg/mL. at the highest test concentration, 50 μg/mL, cytotoxicity was 52% relative to the vehicle control. the percentage of cells with micronuclei in the test article-treated group was not significantly increased relative to vehicle control at any dose level (p > 0.05, fisher's exact test).
the dose levels selected for analysis of micronucleus test in the s9-activated 4-hour exposure group were 25, 50, and 100 μg/mL. at the highest test concentration, 100 μg/mL, cytotoxicity was 54% relative to the vehicle control. the percentage of cells with micronuclei in the test article-treated group was not significantly increased relative to vehicle control at any dose level (p > 0.05, fisher's exact test). the dose levels selected for analysis of micronucleus test in the non-activated 24-hour exposure group were 1.26, 12.5, and 30 μg/mL. at the highest test concentration, 30 μg/mL, cytotoxicity was 55% relative to the vehicle control. the percentage of cells with micronuclei in the test article-treated group was not significantly increased relative to vehicle control at any dose level (p > 0.05, fisher's exact test).","under the conditions of the assay described in this report, 1,2,4-trihydroxybenzene was concluded to be negative for the induction of micronuclei in the non-activated and s9- activated test systems in the in vitro mammalian micronucleus test using human peripheral blood lymphocytes.",,,the results of the analysis indicate that the actual mean concentrations of the analysed samples (0.25 and 1.5 mg/mL) were within the acceptance criteria of 85.0% to 115.0% of target with ≤ 5.0% relative standard deviation (RSD). no test article was detected in the vehicle control samples. concentration analysis of the dose formulation samples collected after dosing indicated that the actual mean concentrations of the analysed samples (0.25 and 1.5 mg/mL) were 91.8% and 77.6% of target with ≤ 5.0% RSD. the results of the post-dosing sample are reported but are not subject to the acceptance criteria specified in the protocol.,,"the results of stability of the dosing formulations indicated that 1,2,4-trihydroxybenzene in degassed deionized water, at concentrations of 0.253 and 43.7 mg/mL, was stable on wet ice for at least 2 hours.",97.8,,thb0200312,,peripheral blood lymphocyte,"human, 1 male donor",48 hours following mitogen stimulation with pha,,,1000,"duplicate cultures, one experiment"," -s9 mix (4 h exposure + 20 h): 1.26, 3.15, 6.3, 12.5, 25, 50, 85, 100, 125, 135, 150 μg/mL; -s9 mix (24 h exposure): 0.1, 0.25, 0.5, 1.26, 12.5, 30, 40, 50, 85, 100 μg/mL; +s9 mix (4 h exposure + 20 h): 12.5, 25, 50, 100, 125, 135, 150 μg/mL",,4h + 20h with and without s9-mix,24h without s9-mix,,s9-mix from the liver of aroclor 1254 induced rats,,ri,water (stock suspension of a33 at 50 mg/mL); degassed with nitrogen with calcium carbonate as trap,,2015,yes,15,"negative control: culture medium, positive control: -s9mix: vb 5, 7.5 and 10 ng/mL; +s9 mix: cp, 2.5, 5 and 7.5 μg/mL. In accordance with OECD. the percentage of micronucleated cells in the CP (positive control) group (1.1%) was statistically significant (p ≤ 0.01, f-fisher's exact test). the percentage of micronucleated cells in the VB (positive control) group (1.1%) was statistically significant (p ≤ 0.01, fisher's exact test). the positive and vehicle controls fulfilled the requirements for a valid test.","concentrations: ±s9 mix (4 h exposure + 20 h): 0.126, 0.378, 1.26, 3.78, 12.6, 37.8, 126, 378, 1260 μg/mL;  -s9 mix (24 h exposure): 0.126, 0.378, 1.26, 3.78, 12.6, 37.8, 126, 378, 1260 μg/mL. the maximum concentrations analysed were determined following a preliminary cytotoxicity experiment. suitable maximum concentrations for analysis were selected. the results of the evaluation of CBPI and % cytotoxicity showed substantial cytotoxicity [≥ 50% cytokinesis-blocked proliferation index (CBPI) relative to the vehicle control] observed at dose levels ≥ 126 μg/mL in all three exposure groups. ",6 month,,,,,,,,,,,,,,,,,,,,,,,,,,,,,,,
"1,2,4-trihydroxybenzene ",non-OECD ( Cosmetics Europe Genotoxicity Taskforce Protocol),in vitro ,https://ec.europa.eu/health/sites/health/files/scientific_committees/consumer_safety/docs/sccs_o_222.pdf,,,,,,,,,,,,,,,,,,,,,,,,,,,,,,,,,,,,,,,,,,,,,,,,,,,,,,,,,,,,,,,,,,,,,,,,,,,,,,,,,,,,,,,,,,,,,,,,,,,,,,,,,,,,,,,,,,,,,,,,,,,,,,,,,,,,,,,,,,,,,,,,,,,,,,,,,,,,,,,,,,,,,,,,,,,,,,,,,,,,,,,,,,,,,,,,,,,,,,,,,,,,,,,,,,,,,,,,,,,,,,,,,,,,,,,,,,,,,,,,,,,,,,,,,,,,,,,,,,,,,,,,,,,,,,,,,,,,,,,,,,,,,,,,,,,,,,,,,,,,,,,,,,,,,,,,,,,,,,,,,,,,,,,,,,,,,,,,,,,,,,,,,,,,,,,,,,,,,,,,,,,,,,,,,,,,,,,,,,,,,,,,,,,,,,,,,,,,,,,,,,,,,,,,,,,,,,
"1,2,4-trihydroxybenzene ",non-OECD,in vitro ,https://ec.europa.eu/health/sites/health/files/scientific_committees/consumer_safety/docs/sccs_o_222.pdf,,,,,,,,,,,,,,,,,,,,,,,,,,,,,,,,,,,,,,,,,,,,,,,,,,,,,,,,,,,,,,,,,,,,,,,,,,,,,,,,,,,,,,,,,,,,,,,,,,,,,,,,,,,,,,,,,,,,,,,,,,,,,,,,,,,,,,,,,,,,,,,,,,,,,,,,,,,,,,,,,,,,,,,,,,,,,,,,,,,,,,,,,,,,,,,,,,,,,,,,,,,,,,,,,,,,,,,,,,,,,,,,,,,,,,,,,,,,,,,,,,,,,,,,,,,,,,,,,,,,,,,,,,,,,,,,,,,,,,,,,,,,,,,,,,,,,,,,,,,,,,,,,,,,,,,,,,,,,,,,,,,,,,,,,,,,,,,,,,,,,,,,,,,,,,,,,,,,,,,,,,,,,,,,,,,,,,,,,,,,,,,,,,,,,,,,,,,,,,,,,,,,,,,,,,,,,,
