hydroxyethyl-2-nitro-p-toluidine ,OECD 476,in vitro ,https://ec.europa.eu/health/scientific_committees/consumer_safety/docs/sccs_o_061.pdf,,,,,,,,,,,,,,,,,,,,,,,,,,,,,,,,,,,,,,,,,,,,,,,,,,,,,,,,,,,,,,,,,,,,,,,,,,,,,,,,,,,,,,,,,,,,,,,,,,,,,,,,,,,,,,,,,,,,,,,,,,,,,,,,,,,,,,,,,,,,,,,,,,,,,,,,,,,,,,,,,,,,,,,,,,,,,,,,,,,,,,,,,,,,,,,,,,,,,,,,,,,,,,,,,,,,,,,,,,,,,,,,,,,,,,,,,,,,,,,,,,,,,,,,,,,,,,,,,,,,,,,,,,,,,,,,,,,,,,,,,,,,,,"the required toxic range of 10-20% of the relative total growth was generally reached. in the first experiment without S9 mix, an increase in the mutant frequency was measured at a concentration of 250 µg/ml. however, no induction of mutants was observed in the parallel culture and in the culture treated with a higher concentration (375 µg/ml) causing very high toxicity (4% relative total growth). moreover the data of the second culture with metabolic activation were not considered valid since the positive control failed to respond. therefore experiment I was repeated. a substantial biological relevant increase in the mutant frequency was not observed in any of the main experiments. no relevant shift of the ratio of small versus large colonies was recorded up to the maximum concentration of the test item. ","under the experimental conditions used, wr 20883 methylgelb was not mutagenic in mammalian cells (L5178Y mouse lymphoma cells) in vitro",,,,,99.8 ,,6718 fass 10/20,test substance: wr 20883 methylgelb ,mouse/L5178Y  lymphoma cells (tk+/-) ,,,,2 independent tests (experiment II without S9 mix) ,"experiment I:  31.3, 62.5, 125, 250 and 375 µg/ml without and with metabolic activation / experiment Ia:  31.3, 62.5, 125, 250, 300 and 375 µg/ml without and with metabolic activation / experiment II:  31.3, 62.5, 125, 250 and 375 µg/ml without metabolic activation",liver S9 fraction from phenobarbital/ß-naphthoflavone-induced rats ,,,"experiment I and Ia: 4h without and with S9-mix; expression period 72 h, selection growth 10-15 days / experiment II: 24 h without S9-mix; expression period 48 h, selection growth 10-15 days",dmso,,2004,yes,"24, submission III",,,4 months,test concentrations were based on the level of toxicity in an initial range-finding study. negative and positive controls were in accordance with the OECD guideline.,,,,,,,,,,,,,,,,,,,,,,,,,,,,,,,,,,,,,,,,,,,,,,,,,,,,,,,,,,,,,,,,,,,,,,,,,,,,,,,,,,,,,,,,,,,,,,,,,,,,
hydroxyethyl-2-nitro-p-toluidine ,OECD 487 (draft),in vitro ,https://ec.europa.eu/health/scientific_committees/consumer_safety/docs/sccs_o_061.pdf,,,,,,,,,,,,,,,,,,,,,,,,,,,,,,,,,,,,,,,,,,,,,,,,,,,,,,,,,,,,,,,,,,,,,,,,,,,,,,,,,,,,,,,,,,,,,,,,,,,,,,,,,,,,,,,,,,,,,,,,,,,,,,,,,,,,,,,,,,,,,,,,,,,,,,,,,,,,,,,,,,,,,,,,,,,,,,,,,,,,,,,,,,,,,,,,,,,,,,,,,,,,,,,,,,,,,,,,,,,,,,,,,,,,,,,,,,,,,,,,,,,,,,,,,,,,,,,,,,,,,,,,,,,,,,,,,,,,,,,,,,,,,,,,,,,,,,,,,,,,,,,,,,,,,,,,,,,,,,,,,,,,,,,,,,,,,,,,,,,,,,,,,,,,,,,,,,,,,,,,,,,,,,,,,,,,,,,,,,,,,,,,,,,,,,,,,,,,,,,,,,,,,,,,,,,,,,
hydroxyethyl-2-nitro-p-toluidine ,OECD 474,in vivo,https://ec.europa.eu/health/scientific_committees/consumer_safety/docs/sccs_o_061.pdf,,,,,,,,,,,,,,,,,,,,,,,,,,,,,,,,,,,,,,,,,,,,,,,,,,,,,,,,,,,,,,,,,,,,,,,,,,,,,,,,,,,,,,,,,,,,,,,,,,,,,,,,,,,,,,,,,,,,,,,,,,,,,,"in the pre-experiment for toxicity, exposure to 1000 mg/kg bw/day methylgelb – 20883 resulted in the death of 1 male and 1 female mouse after the second treatment. many animals of both 1000 and 750 mg/kg bw/day expressed toxic effects like reduction of spontaneous activity, abdominal position, eyelid closure, ruffled fur and apathy. these effects were strongest and observed in the highest number of animals after the second application. in the main experiment similar toxic effects were observed with an almost identical timing. additionally, orange coloured urine was reported in treated animals 24 h after the first, from 6 h after the second and after the third treatment. the signs of toxicity and the discoloured urine indicated systemic distribution of the compound and thus exposure of the bone marrow. however, the PCE/TE ratio was not affected by the treatment. in comparison to the concurrent vehicle controls there was no biologically relevant or statistically significant increase in the number of erythrocytes with micronuclei at any preparation interval and dose level. the positive control substance gave the expected result. ",,,"under the experimental conditions used Methylgelb – 20883 did not induce micronuclei in erythrocytes of treated mice and, consequently, Methylgelb – 20883 was not genotoxic (clastogenic and/or aneugenic) in erythrocytes of mice.",,,,,99.8,,6718,,test substance: methylgelb - 20883,mouse/NMRI,,,f & m,,10,"187.5, 375, 750 mg/kg bw/day ",,"three consecutive treatments by gavage, 24 hour interval",gavage,,,,,,,PEG 400,24,bone marrow,, bone marrow preparations were stained and examined microscopically for the NCE/TE ratio and micronuclei,,2002,yes,"25, submission III",,,4 months,"dose selection was based on the result of a pre-experiment for toxicity in which 2 mice were orally (on 3 consecutive days at 24 h intervals) exposed to 1000 mg/kg bw/day. the animals were examined for acute toxic symptoms at intervals of around 1, 2-4, 6, and 24 h after each administration of methylgelb - 20883. in the main experiment mice were treated on 3 consecutive days at 24 h intervals (positive control only single treatment). in the main test, the animals of the highest dose group were examined for acute toxic symptoms at intervals around 1, 2-4, 6 and 24 h after treatment. bone marrow cells were collected 24h after final treatment. toxicity and thus exposure of the target cells was determined by measuring the ratio between polychromatic and total erythrocytes (PCE/TE ratio). negative and positive controls were in accordance with the OECD guideline. the concurrent positive control group was sampled 24 hours after a single dose.",,,,,,,,,,,,,,,,,,,,,,,,,,,,,,,,,,,,,,,,,,,,,,,,,,,,,,,,,,,,,,,,,,,,,,,,,,,,,,,,,,,,,,,,,,,,,,,,,,,,,,,,,,,,,,,,,,,,,,,,,,,,,,,,,,,,,,,,,,,,,,,,,,,,,,,,,,,,,,,,,,,,,,,,,,,,,,,,,,,,,,,,,,,,,,,,,,,,,,,,,,,,,,,,,,,,,,,,,,,,,,,,,,,,,,,,,,,,,,,,,,,,,,,
hc yellow n° 4,OECD 471,in vitro ,https://ec.europa.eu/health/scientific_committees/consumer_safety/docs/sccs_o_008.pdf,,,,,,,,,,,,,,,,,,,,,,,,,,,,,,,,,,,,,,,,,,,,,,,,,,,,,,,,,,,,,,,,,,,,,,,,,,,,,,,,,,,,,,,,,,,,,,,,,,,,,,,,,,,,,,,,,,,,,,,,,,,,,,,,,,,,,,,,,,,,,,,,,,,,,,,,,,,,,,,,,,,,,,,,,,,,,,,,,,,,,,,,,,,,,,,,,,,,,,,,,,,,,,,,,,,,,,"hc yellow n° 4 induced concentration related significant increases in revertant numbers in all strains tested without s9-mix. no toxicity was observed up to 5000mcg/plate (50mg/ml). increased numbers of revertants were observed for all tester strains without metabolic activation and with all strains, except for ta 1535, with metabolic activation.",the compound is a directly acting frameshift / base substitution mutagen,,,,,,,,,test substance: 1708,"salmonella typhimurium ta 98, ta100, ta1535, ta1537",,plate incorporation,,,"8, 40, 200, 1000 and 5000 µg/plate, without and with s9-mix",,,,,,"triplicate, two independent experiments",dmso,no data on batch number and purity were provided. ,1987,yes,"18, submission I",,,2 months,"control: without s9-mix: sodium azide, 9-aminoacridine, 2-nitrofluorene. with s9-mix: 2-aminoanthracene",,,,,,,,,,,,,,,,,,,,,,,,,,,,,,,,,,,,,,,,,,,,,,,,,,,,,,,,,,,,,,,,,,,,,,,,,,,,,,,,,,,,,,,,,,,,,,,,,,,,,,,,,,,,,,,,,,,,,,,,,,,,,,,,,,,,,,,,,,,,,,,,,,,,,,,,,,,,,,,,,,,,,,,,,
hc yellow n° 4,non OECD,in vitro ,https://ec.europa.eu/health/scientific_committees/consumer_safety/docs/sccs_o_008.pdf,,,,,,,,,,,,,,,,,,,,,,,,,,,,,,,,,,,,,,,,,,,,,,,,,,,,,,,,,,,,,,,,,,,,,,,,,,,,,,,,,,,,,,,,,,,,,,,,,,,,,,,,,,,,,,,,,,,,,,,,,,,,,,,,,,,,,,,,,,,,,,,,,,,,,,,,,,,,,,,,,,,,,,,,,,,,,,,,,,,,,,,,,,,,,,,,,,,,,,,,,,,,,,,,,,,,,,,,,,,,,,,,,,,,,,,,,,,,,,,,,,,,,,,,,,,,,,,,,,,,,,,,,,,,,,,,,,,,,,,,,,,,,,,,,,,,,,,,,,,,,,,,,,,,,,,,,,,,,,,,,,,,,,,,,,,,,,,,,,,,,,,,,,,,,,,,,,,,,,,,,,,,,,,,,,,,,,,,,,,,,,,,,,,,,,,,,,,,,,,,,,,,,,,,,,,,,,
hc yellow n° 4,OECD 476 ,in vitro ,https://ec.europa.eu/health/scientific_committees/consumer_safety/docs/sccs_o_008.pdf,,,,,,,,,,,,,,,,,,,,,,,,,,,,,,,,,,,,,,,,,,,,,,,,,,,,,,,,,,,,,,,,,,,,,,,,,,,,,,,,,,,,,,,,,,,,,,,,,,,,,,,,,,,,,,,,,,,,,,,,,,,,,,,,,,,,,,,,,,,,,,,,,,,,,,,,,,,,,,,,,,,,,,,,,,,,,,,,,,,,,,,,,,,,,,,,,,,,,,,,,,,,,,,,,,,,,,,,,,,,,,,,,,,,,,,,,,,,,,,,,,,,,,,,,,,,,,,,,,,,,,,,,,,,,,,,,,,,,,,,,,,,,,"hc yellow n° 4 was assayed for gene mutations at the tk locus of mouse lymphoma cells both in the absence and presence of s9 metabolic activation. hc yellow n° 4 was tested up to the required level of toxicity (10-20 % survival compared to the concurrent negative controls) both in the initial as well as in the confirmatory assay. in the initial assay at concentrations from 200 to 1000 µg/ml no positive response was observed. a confirmatory assay was performed (- s9-mix, approximately 24 hours) at concentrations of 50.0 to 400 µg/ml. again none of the treatments induced a mutant frequency that met criteria for a positive response. in the activation mutation assay with a 4-hour treatment period, eight concentrations ranging from 400 to 1100 µg/ml were tested for mutant induction. no increase in the mutant frequency was observed.",hc yellow n° 4 (gts 03976) did not induce forward mutations with and without metabolic activation at the tk-locus in l5178y mouse lymphoma cells,,,,hc yellow n° 4 (gts 03976),95.0,,17,test substance: hc yellow n°4 (gts 03976),mouse lymphoma cell line L5178Y tk+/,,,,"single cultures, two independent experiments","initial assay: without s9-mix: 200, 400, 500, 600, 750, 800, 900 and 1000 µg/ml; with s9-mix: 400, 500, 600, 750, 800, 900, 1000 and 1100 µg/ml. confirmatory assay: without s9-mix: 50, 75, 100, 150, 200, 250, 300 and 400 µg/ml",,,,"initial assay: 4h treatment without and with s9; expression period 48h and selection period of 12 days. confirmatory assay: experiment ii: 24h treatment without s9; expression period 48h and selection period of 12 days. control: without s9-mix: methyl methane sulfonate, with s9-mix: methylcholanthrene",dmso,,2004,yes,16,,,3 months,"control: without S9-mix: methyl methane sulfonate, with S9-mix: methylcholanthrene",,,,,,,,,,,,,,,,,,,,,,,,,,,,,,,,,,,,,,,,,,,,,,,,,,,,,,,,,,,,,,,,,,,,,,,,,,,,,,,,,,,,,,,,,,,,,,,,,,,,
hc yellow n° 4,OECD 473,in vitro ,https://ec.europa.eu/health/scientific_committees/consumer_safety/docs/sccs_o_008.pdf,,,,,,,,,,,,,,,,,,,,,,,,,,,,,,,,,,,,,,,,,,,,,,,,,,,,,,,,,,,,,,,,,,,,,,,,,,,,,,,,,,,,,,,,,,,,,,,,,,,,,,,,,,,,,,,,,,,,,,,,,,,,,,,,,,,,,,,,,,,,,,,,,,,,,,,,,,,,,,,,,,,,,,,,,,,,,,,,,,,,,,,,,,,,,,,,,,,,,,,,,,,,,,,,,,,,,,,,,,,,,,,,,,,,,,,,,,,,,,,,,,,,,,,1200 µg/ml,,375µg/ml,"a small but statistically significant increase in structural and numerical (polyploidy and endoreduplication) chromosomal aberrations was observed in the cultures treated with 1200 µg/ml at 4h without s- 9 activation (47% cell growth inhibition). with 20h treatment, a small but statistically significant increase in cells with structural chromosomal aberrations was observed at 375 µg/ml (16% cell growth inhibition), but no statistically significant increase in numerical (polyploidy and endoreduplication) chromosomal aberrations. at 4 h treatment with s-9 activation no significant increase in cells with structural chromosomal aberrations was observed but a small, statistically significant increase in numerical (polyploidy and endoreduplication) chromosomal aberrations was observed at 1000 µg/ml (59% cgi). the small increase in numerical aberrations was within the historical range for polyploidy and endoreduplicated cells and therefore was not considered to be biologically significant. ","hc yellow n° 4 was exclusively positive for inducing structural and numerical chromosomal aberrations in chinese hamster ovary (cho) cells without metabolic activation. under the experimental conditions used hc yellow n° 4 was positive in this in vitro chromosomal aberration assay and, consequently, is genotoxic (clastogenic and possibly aneugenic) in cho cells.",,,,,95.0,,,17,hamster/chinese ovary cell (cho-wbl),,,,duplicate cultures (initial toxicity assay: single cultures),"250, 500 and 1200 µg/ml, without s9-mix, 4h treatment / 250, 375 and 500 µg/ml, without s9-mix, 20h treatment / 250, 500 and 1000 µg/ml, with s9-mix, 4h treatment",,,,"4h treatment, harvest time 20h after beginning of treatment, without and with s9-mix","20h treatment, harvest time 20h after beginning of treatment, without s9-mix",,dmso,10 months,,,,2005,yes,15,control: without s9-mix: mitomycin c; with s9-mix: cyclophosphamide,,,,,,,,,,,,,,,,,,,,,,,,,,,,,,,,,,,,,,,,,,,,,,,,,,,,,,,,,,,,,,,,,,,,,,,,,,,,,,,,,,,,,,,,,,,,,,,,,,,,,,,,,,,,,,,,,,,,,,,,,,,,,,,,,,,,,,
hc yellow n° 4,non OECD,in vivo,https://ec.europa.eu/health/scientific_committees/consumer_safety/docs/sccs_o_008.pdf,,,,,,,,,,,,,,,,,,,,,,,,,,,,,,,,,,,,,,,,,,,,,,,,,,,,,,,,,,,,,,,,,,,,,,,,,,,,,,,,,,,,,,,,,,,,,,,,,,,,,,,,,,,,,,,,,,,,,,,,,,,,,,,,,,,,,,,,,,,,,,,,,,,,,,,,,,,,,,,,,,,,,,,,,,,,,,,,,,,,,,,,,,,,,,,,,,,,,,,,,,,,,,,,,,,"in vivo mammalian erythrocytes micronucleus test : species/strain: mouse/cflp. group size: 70 (35 males and 35 females). test substance: hc yellow 4. batch and purity: not provided. vehicle: dmso, 10% in deionised water. dose level: 300 mg/kg bw. dosing volume: 60 ml/kg bw. route: intraperitoneal injection. sampling: 24, 48 and 72 hours after treatment; positive control: 24 hours after treatment. control: cyclophosphamide. glp: in compliance. study period: january – march 1985. hc yellow n° 4 was tested at the single dose level of 300 mg/kg (approximate mtd, because at 500 mg/kg 1/5 male and female, respectively died within 1 hour). 30 mice (15 male, 15 female) were treated with vehicle or hc yellow n° 4 and were killed 24, 48 and 72 hours later. the positive control, (5 males, 5 females) received cpa (40 mg/kg) and was killed 24 hours later. bone marrow was obtained from both femurs and 1000 polychromatic erythrocytes (pce) were counted from each animal (where possible), from coded slides. results: no toxic effects of hc yellow n° 4 on erythropoiesis indicating exposure were observed. there were more cells with micronuclei in treated versus control animals but these increases were not statistically significant at all time points tested. the positive control showed a marked increase in micronucleated pce versus controls. conclusion: under the experimental conditions used hc yellow n° 4 was not clastogenic and/or aneugenic in this in vivo micronucleus test in mice. comment: toxic effects on erythropoiesis indicating exposure were not observed. however, systemic availability is expected following intraperitoneal application. ref.: 17",,,,,,,,,,,,,,,,,,,,,,,,,,,,,,,,,,,,,,,,,,,,,,,,,,,,,,,,,,,,,,,,,,,,,,,,,,,,,,,,,,,,,,,,,,,,,,,,,,,,,,,,,,,,,,,,,,,,,,,,,,,,,,,,,,,,,,,,,,,,,,,,,,,,,,,,,,,,,,,,,,,,,,,,,,,,,,,,,,,,,,,,,,,,,,,,,,,,,,,,,,,
hc yellow n° 4,non OECD,in vivo,https://ec.europa.eu/health/scientific_committees/consumer_safety/docs/sccs_o_008.pdf,,,,,,,,,,,,,,,,,,,,,,,,,,,,,,,,,,,,,,,,,,,,,,,,,,,,,,,,,,,,,,,,,,,,,,,,,,,,,,,,,,,,,,,,,,,,,,,,,,,,,,,,,,,,,,,,,,,,,,,,,,,,,,,,,,,,,,,,,,,,,,,,,,,,,,,,,,,,,,,,,,,,,,,,,,,,,,,,,,,,,,,,,,,,,,,,,,,,,,,,,,,,,,,,,,,"unscheduled dna synthesis (uds) test with mammalian liver cells in vivo: species/strain: rat/male fisher-344 . group size: 18 (3 males per dose point). test substance: c7634/43 (hc yellow n° 4). batch and purity: not provided. vehicle: carboxymethylcellulose, 1% w/v. dose level: 100, 250, 500 and 1000 mg/kg bw. dosing volume: 10 ml/kg bw. route: oral gavage. control: dimethylnitrosamine. glp: in compliance. study period: 1 september – 1 december 1992. hc yellow n° 4 (dose range 100-1000 mg/kg), vehicle control and positive control (dmn, 10 mg/kg) were administered by gavage to 3 rats/dose point and dna repair (tritiated thymidine incorporation into nuclear dna of hepatocytes not in s-phase) was assessed approximately 16h later. hepatocytes isolated from treated animals were incubated in wme medium containing 10% calf serum. 6 cultures per dose were seeded. uds was quantified by counting net nuclear silver grain increase from 50 hepatocytes/ coverslip, 3 coverslips / rat and 3 rats /dose point. result: hc yellow n° 4 did not induce a mean net nuclear grain count ≥ 5 and thus no dna repair synthesis at any of the dose levels scored. vehicle and positive control induced nng counts within the criteria of a valid test. conclusion: hc yellow n° 4 does not induce unscheduled dna repair in rat hepatocytes under the conditions tested. comment:batch number and purity were not given. ef.: 18",,,,,,,,,,,,,,,,,,,,,,,,,,,,,,,,,,,,,,,,,,,,,,,,,,,,,,,,,,,,,,,,,,,,,,,,,,,,,,,,,,,,,,,,,,,,,,,,,,,,,,,,,,,,,,,,,,,,,,,,,,,,,,,,,,,,,,,,,,,,,,,,,,,,,,,,,,,,,,,,,,,,,,,,,,,,,,,,,,,,,,,,,,,,,,,,,,,,,,,,,,,
hc yellow n° 4,non OECD,in vivo,https://ec.europa.eu/health/scientific_committees/consumer_safety/docs/sccs_o_008.pdf,,,,,,,,,,,,,,,,,,,,,,,,,,,,,,,,,,,,,,,,,,,,,,,,,,,,,,,,,,,,,,,,,,,,,,,,,,,,,,,,,,,,,,,,,,,,,,,,,,,,,,,,,,,,,,,,,,,,,,,,,,,,,,,,,,,,,,,,,,,,,,,,,,,,,,,,,,,,,,,,,,,,,,,,,,,,,,,,,,,,,,,,,,,,,,,,,,,,,,,,,,,,,,,,,,,"dominant lethal study (combined sub-chronic feeding, teratology and dominant lethal study): species/strain: rat/sprague-dawley (tac:n(sd)fbr). group size: 20 males/group. test substance: hc yellow n° 4. batch: 22900186. purity: 98.9% (approximately). dose levels: 0, 0.1, 0.3 and 1.0% hc yellow n° 4 in diet prior to mating basal laboratory chow through mating until end of study. study period: 1987. results: there was a significant increase in body weights over the controls at the doses of 0.1% and 0.3% during weeks 14-27 with the exception of week 23 where the rats treated at the dose of 0.3% only exhibited a significant increase in body weight over the controls. several significant differences in the reproductive parameters were observed. hc yellow n°4 when fed to male sprague dawley rats at dose levels up to 1.0% in the diet for 21 weeks does not have a dominant lethal effect. it does however cause a significant decrease in the fertility of the male rats. a significant decrease was indeed noted in the average number of corpora lutea per dam, the average number of implant sites per dam, and the average number of live foetuses per dam at the higher dose. a significant decrease was also noted in the number of animals pregnant in all treated groups. 5 rats (one at the dose of 0.3% and 4 at the dose of 1%) which had failed to sire a litter with any of 8 females after being on test diet for 21 weeks were killed and testes were macroscopically and microscopically examined. in all testes, there was a severe diffuse atrophy affecting the whole of both testes leaving only sertoli cells in the tubules. aspermatogenesis was present with total loss of spermatogonia, spermatids, and spermatocytes. the interstitial cells appeared normal. in two rats from the high dose group (1%), mineralization within the lumen of some of the seminiferous tubules, as well as clumping of eosinophilic proteinaceous material, and degeneration and loss of sertoli cells were present. conclusion males fed with hc yellow n°4 for 21 weeks prior to mating showed a significant decrease in fertility. hc yellow n°4 appeared to have caused a severe diffuse atrophy of the testes in some animals at 0.3% and 1% during the dominant lethal study resulting in permanent sterility. the mechanism by which this occurred is yet unknown. comment: the experiment did not conform to a guideline and was not performed according to glp. the low dose level of 0.1% of hc yellow n°4 in the diet was not an unequivocal noael in the dominant lethal phase. ref.: 17, submission i",,,,,,,,,,,,,,,,,,,,,,,,,,,,,,,,,,,,,,,,,,,,,,,,,,,,,,,,,,,,,,,,,,,,,,,,,,,,,,,,,,,,,,,,,,,,,,,,,,,,,,,,,,,,,,,,,,,,,,,,,,,,,,,,,,,,,,,,,,,,,,,,,,,,,,,,,,,,,,,,,,,,,,,,,,,,,,,,,,,,,,,,,,,,,,,,,,,,,,,,,,,
hc yellow n° 4,non OECD,in vivo,https://ec.europa.eu/health/scientific_committees/consumer_safety/docs/sccs_o_008.pdf,,,,,,,,,,,,,,,,,,,,,,,,,,,,,,,,,,,,,,,,,,,,,,,,,,,,,,,,,,,,,,,,,,,,,,,,,,,,,,,,,,,,,,,,,,,,,,,,,,,,,,,,,,,,,,,,,,,,,,,,,,,,,,,,,,,,,,,,,,,,,,,,,,,,,,,,,,,,,,,,,,,,,,,,,,,,,,,,,,,,,,,,,,,,,,,,,,,,,,,,,,,,,,,,,,,"dominant lethal study (combined teratology and dominant lethal study): species/strain: rat/sprague-dawley (tac:n(sd)fbr). group size: 60 (20 males/group). test substance: hc yellow n° 4. batch: 22900186. purity: not provided. dose levels: 0, 0.03 and 0.1% hc yellow n° 4 in diet (for 10 weeks until mating) basal laboratory chow during mating. glp: no. study period: 1988 – 1989. the 60 male sprague-dawley rats received their appropriate test diets for a period of 10 weeks prior to the initiation of mating. at the initiation of mating, all males were placed on basal laboratory chow and untreated females were placed in the male cages at a ration of 2 females per male. viabilities, clinical observations, body weights and feed consumption values were recorded. all pregnant female rats were sacrificed on day 17 of gestation. the gravid uterus was weighed and examined for gross external alterations and sex. caesarean-sectioning and subsequent foetal observations were conducted without knowledge of dosage group. results: no evidence of a reduction in body weight gain was seen. a significant decrease in body weight gain for day 17 was noted for rats treated at the dose of 0.03% and 0.1% during the second mating. the number of pregnancies, pre-implantation and post-implantation loss and the number of live pups was comparable among all groups. conclusion: hc yellow n°4 did not produce a dominant lethal effect or cause infertility of male sprague-dawley rats when fed in the diet for 10 weeks prior to mating at dose levels of 0.03% and 0.1%. ref.: 22, submission I. comment: as in the previous study (ref 17) an unequivocal noel was not determined in the teratology and dominant lethal phases, this study was done to serve as a repeat of the reproductive phases using a control level and 2 dose levels. an examination of testis should have been done as an atrophy was observed at the dose of 0.3% in the combined sub-chronic feeding, teratology and dominant lethal study (ref 17).",,,,,,,,,,,,,,,,,,,,,,,,,,,,,,,,,,,,,,,,,,,,,,,,,,,,,,,,,,,,,,,,,,,,,,,,,,,,,,,,,,,,,,,,,,,,,,,,,,,,,,,,,,,,,,,,,,,,,,,,,,,,,,,,,,,,,,,,,,,,,,,,,,,,,,,,,,,,,,,,,,,,,,,,,,,,,,,,,,,,,,,,,,,,,,,,,,,,,,,,,,,
"o-phenylphenol, sodium o-phenylphenate and potassium o-phenylphenate",/,in vitro ,https://ec.europa.eu/health/scientific_committees/consumer_safety/docs/sccs_o_177.pdf,,,,,,,,,,,,,,,,,,,,,,,,,,,,,,,,,,,,,,,,,,,,,,,,,,,,,,,,,,,,,,,,,,,,,,,,,,,,,,,,,,,,,,,,,,,,,,,,,,,,,,,,,,,,,,,,,,,,,,,,,,,,,,,,,,,,,,,,,,,,,,,,,,,,,,,,,,,,,,,,,,,,,,,,,,,,,,,,,,,,,,,,,,,,,,,,,,,,,,,,,,,,,,,,,,,,,,,,,,,,,,,,,,,,,,,,,,,,,,,,,,,,,,,,,,,,,,,,,,,,,,,,,,,,,,,,,,,,,,,,,,,,,,,,,,,,,,,,,,,,,,,,,,,,,,,,,,,,,,,,,,,,,,,,,,,,,,,,,,,,,,,,,,,,,,,,,,,,,,,,,,,,,,,,,,,,,,,,,,,,,,,,,,,,,,,,,,,,,,,,,,,,,,,,,,,,,,
