"2,4-diaminophenoxyethanol dihydrochloride and sulfate",OECD 471,in vitro ,https://ec.europa.eu/health/scientific_committees/consumer_safety/docs/sccs_o_035.pdf,,,,,,,,,,,,,,,,,,,,,,,,,,,,,,,,,,,,,,,,,,,,,,,,,,,,,,,,,,,,,,,,,,,,,,,,,,,,,,,,,,,,,,,,,,,,,,,,,,,,,,,,,,,,,,,,,,,,,,,,,,,,,,,,,,,,,,,,,,,,,,,,,,,,,,,,,,,,,,,,,,,,,,,,,,,,,,,,,,,,,,,,,,,,,,,,,,,,,,,,,,,,,,,,,,,,,,"no clear evidence of toxicity was observed in any of the test strains in the first experiment (1.6 - 5000 µg/plate), but the data were considered to be acceptable for mutation assessment. a statistically significant increase in revertants was observed in strains ta98 and ta102 in the presence of s9-mix. in the second experiment, different dose intervals were used for strains ta100, ta1535 and ta1537 (20.48 - 5000 µg/plate), strain ta98 (8.192 - 5000 µg/plate), and strain ta102 (1.3 - 5000 µg/plate); in the presence of metabolic activation a pre-incubation step was used. for strains ta98 and ta102 in the presence of s9-mix, plate-incorporation treatments were additionally included to assess the reproducibility of increases in revertants observed in experiment 1. following these treatments, evidence of toxicity was observed in strain ta102 only in the presence of s9- mix for pre-incubation and plate-incorporation treatments. a statistically significant and dose-related increase in revertants was observed for ta98 in the presence of s9-mix also in the second experiment. as an increase was not observed for ta102 in the second experiment, the initial positive effect was considered to be due to a chance event. ","2,4-diaminophenoxyethanol HCl induced mutations in salmonella typhimurium strain TA98 in the presence of S9-mix when tested under the conditions of this study.
",,,,,99.5,,0120022,,"test substance: 2,4-diaminophenoxyethanol HCl ","salmonella typhimurium, ta98, ta100, ta1535, ta1537, ta102 ",,,,,1.6 - 5000 µg/plate with and without s9-mix (1.3 - 5000 µg/plate for strain ta102 in the absence and presence of s9-mix.,,liver s9 fraction from rats induced with aroclor 1254 ,,,,,,,,yes,8,concentrations were defined by a preliminary toxicity range-finder study in ta100 only.,negative and positive controls were in accordance with the OECD guideline,,,,,,,,,,,,,,,,,,,,,,,,,,,,,,,,,,,,,,,,,,,,,,,,,,,,,,,,,,,,,,,,,,,,,,,,,,,,,,,,,,,,,,,,,,,,,,,,,,,,,,,,,,,,,,,,,,,,,,,,,,,,,,,,,,,,,,,,,,,,,,,,,,,,,,,,,,,,,,,,,,,,,,,,,,,
"2,4-diaminophenoxyethanol dihydrochloride and sulfate",OECD 476,in vitro ,https://ec.europa.eu/health/scientific_committees/consumer_safety/docs/sccs_o_035.pdf,,,,,,,,,,,,,,,,,,,,,,,,,,,,,,,,,,,,,,,,,,,,,,,,,,,,,,,,,,,,,,,,,,,,,,,,,,,,,,,,,,,,,,,,,,,,,,,,,,,,,,,,,,,,,,,,,,,,,,,,,,,,,,,,,,,,,,,,,,,,,,,,,,,,,,,,,,,,,,,,,,,,,,,,,,,,,,,,,,,,,,,,,,,,,,,,,,,,,,,,,,,,,,,,,,,,,,,,,,,,,,,,,,,,,,,,,,,,,,,,,,,,,,,,,,,,,,,,,,,,,,,,,,,,,,,,,,,,,,,,,,,,,,"in the first experiment, the highest doses selected, 2200 µg/ml in the absence of s9-mix and 1800 µg/ml in the presence of s9-mix, yielded 8% and 6% relative survival, respectively. in the second experiment, the highest dose tested (2410 µg/ml) yielded 28% and 9% relative survival in the absence and presence of s9-mix, respectively. no statistically significant increases in mutant frequency were observed following treatment with 2,4-diaminophenoxyethanol HCl in the absence of s9-mix. in the presence of s9-mix, a small but statistically significant increase in mutant frequency were observed at 1000 and 1600 µg/ml 2,4-diaminophenoxyethanol HCl in the first experiment and at 400, 1600 and 2410 µg/ml in the second experiment. however, there was no evidence of a statistically significant linear trend in experiment 1 and only a weak linear trend in experiment 2, and all mutant frequencies observed for the treated cultures fell within historical negative control range (mean ±2 standard deviations).","the report considered the positive signs as chance events with little or no biological relevance, concluding that, under the conditions employed in this study, 2,4- diaminophenoxyethanol HCl is not mutagenic in this test system. the result is considered equivocal.",,,,,> 99.5% ,,0120022,"test substance: 2,4-diaminophenoxyethanol HCl ",mouse/ l5178y lymphoma cells (hprt) ,,,,two independent tests with and without s9-mix ,"400 – 2410 µg/ml without metabolic activation, 200 – 1800 µg/ml with metabolic activation",liver S9 fraction from aroclor 1254-induced rats ,,,3h,,,,yes,9,"test concentrations were based on the level of toxicity. in the cytotoxicity range-finding experiment, extreme toxicity ( < 3% relative survival) was observed at the highest dose tested (2410 µg/mL). ",negative and positive controls were in accordance with the OECD guideline.,,,,,,,,,,,,,,,,,,,,,,,,,,,,,,,,,,,,,,,,,,,,,,,,,,,,,,,,,,,,,,,,,,,,,,,,,,,,,,,,,,,,,,,,,,,,,,,,,,,,,,
"2,4-diaminophenoxyethanol dihydrochloride and sulfate",OECD 473,in vitro ,https://ec.europa.eu/health/scientific_committees/consumer_safety/docs/sccs_o_035.pdf,,,,,,,,,,,,,,,,,,,,,,,,,,,,,,,,,,,,,,,,,,,,,,,,,,,,,,,,,,,,,,,,,,,,,,,,,,,,,,,,,,,,,,,,,,,,,,,,,,,,,,,,,,,,,,,,,,,,,,,,,,,,,,,,,,,,,,,,,,,,,,,,,,,,,,,,,,,,,,,,,,,,,,,,,,,,,,,,,,,,,,,,,,,,,,,,,,,,,,,,,,,,,,,,,,,,,,,,,,,,,,,,,,,,,,,,,,,,,,,,,,,,,,,"exp1: at 1542µg/ml, 54% reduction in mitotic index","exp 1: at 1542µg/ml, 55% reduction in mitotic index; exp2: at 2200µg/ml, 39% reduction in mitotic index with metabolic activation also at 1760µg/ml,44% mitotic inhibition","exp2: at 120.9µg/ml, 66% reduction in mitotic index without metabolic activation","the highest concentration chosen for analysis in the first experiment (1542 µg/ml) induced approximately 54% and 55% mitotic inhibition (reduction in mitotic index) in the absence and presence of s9-mix, respectively. in the second experiment, the highest concentrations chosen for analysis, 120.9 µg/ml in the absence of s9-mix and 2200 µg/ml in the presence of s9-mix, induced approximately 66% and 39% mitotic inhibition, respectively. the intermediate concentration applied in the presence of s9-mix (1760 µg/ml) showed 44% mitotic inhibition. in the second experiment, the 3-h treatment with 2,4-diaminophenoxyethanol HCl in the presence of s9-mix induced an increase in structural chromosome aberrations (p< ¬0.001, compared with concurrent solvent control cultures). in experiment 1, where the concentration range was lower, no statistically significant increases were observed following the 3-h treatment with s9-mix. also the 20-h continuous treatment with 2,4-diaminophenoxyethanol HCl in the absence of s9-mix resulted in a significant elevation of chromosome aberrations compared with the concurrent solvent control cultures. ","2,4-diaminophenoxyethanol HCl induced chromosome aberrations in cultured human peripheral blood lymphocytes, when tested in the absence or presence of a rat liver metabolic activation system. ",,,,,98.7,,0120022,"test substance: 2,4-diaminophenoxyethanol HCl ",human/ lymphocytes,,,,two independent tests with and without s9-mix ,"exp1: 987.1, 1234, 1542 µg/ml with and without metabolic activation; exp 2: 1408, 1760, 2200 µg/ml with metabolic activation,  49.54, 77.41, 96.76, and 120.9 µg/ml, without metabolic activation.",liver s9 fraction from aroclor1254-induced rats,,,"exp1: 3h with and without metabolic activation, exp2: 3h with metablic activation",exp2: 20 h continuously without metabolic activation,,,,,,,,yes,10,in vitro mammalian chromosome aberration test. concentrations were chosen for scoring based upon reduction in mitotic index. negative and positive controls were in accordance with the OECD guidelines. ,,,,,,,,,,,,,,,,,,,,,,,,,,,,,,,,,,,,,,,,,,,,,,,,,,,,,,,,,,,,,,,,,,,,,,,,,,,,,,,,,,,,,,,,,,,,,,,,,,,,,,,,,,,,,,,,,,,,,,,,,,,,,,,,,,,,,,
"2,4-diaminophenoxyethanol dihydrochloride and sulfate",OECD draft 487,in vitro ,https://ec.europa.eu/health/scientific_committees/consumer_safety/docs/sccs_o_035.pdf,,,,,,,,,,,,,,,,,,,,,,,,,,,,,,,,,,,,,,,,,,,,,,,,,,,,,,,,,,,,,,,,,,,,,,,,,,,,,,,,,,,,,,,,,,,,,,,,,,,,,,,,,,,,,,,,,,,,,,,,,,,,,,,,,,,,,,,,,,,,,,,,,,,,,,,,,,,,,,,,,,,,,,,,,,,,,,,,,,,,,,,,,,,,,,,,,,,,,,,,,,,,,,,,,,,,,,,,,,,,,,,,,,,,,,,,,,,,,,,,,,,,,,,,,,,,,,,,,,,,,,,,,,,,,,,,,,,,,,,,,,,,,,,,,,,,,,,,,,,,,,,,,,,,,,,,,,,,,,,,,,,,,,,,,,,,,,,,,,,,,,,,,,,,,,,,,,,,,,,,,,,,,,,,,,,,,,,,,,,,,,,,,,,,,,,,,,,,,,,,,,,,,,,,,,,,,,
"2,4-diaminophenoxyethanol dihydrochloride and sulfate",OECD 474,in vivo,https://ec.europa.eu/health/scientific_committees/consumer_safety/docs/sccs_o_035.pdf,,,,,,,,,,,,,,,,,,,,,,,,,,,,,,,,,,,,,,,,,,,,,,,,,,,,,,,,,,,,,,,,,,,,,,,,,,,,,,,,,,,,,,,,,,,,,,,,,,,,,,,,,,,,,,,,,,,,,,,,,,,,,,"the highest dose chosen for the micronucleus assay was 1500 mg/kg bw, the estimated maximum tolerated dose. 2,4-diaminophenoxyethanol HCl induced signs of clinical toxicity at 1500 mg/kg bw. no statistically significant increases in micronucleus frequencies were observed in polychromatic erythrocytes (PCEs) from male and female rats at any dose of 2,4-diaminophenoxyethanol HCl examined. one male (48-h time-point) and one female (24-h time-point) at the 1500 mg/kg bw dose level had elevated micronucleus responses. however, the overall micronucleus responses were not statistically significant when compared with the concurrent vehicle control, and these isolated increases were considered to bear no biological relevance. no statistically significant decreases in the PCE:NCE ratios (an indicator of cytotoxicity) were observed with 2,4-diaminophenoxyethanol at doses up to 1500 mg/kg bw in either male or female rats. although there were no indications of bone marrow toxicity, the oral bioavailability of 2,4-diaminophenoxyethanol HCl was evidenced by the clinical signs observed at 750 and 1500 mg/kg bw and the death observed at 1500 mg/kg bw. in a contemporary 3-month toxicity study, systemic exposure to unchanged 2,4- diaminophenoxyethanol HCl was achieved in rats given a single gavage at 20 and 100 mg/kg bw.",,"yes, one animal treated at 1500 mg/kg bw was found dead.","2,4-diaminophenoxyethanol HCl was considered negative in the rat bone marrow micronucleus test under the conditions of this assay. ",,,,the test article was formulated in water and administered once as follows.,> 99.5,,0120022,,"test substance: 2,4-diaminophenoxyethanol HCl ",rat/ crl:cd (sd)br ,,,f & m,,10,"375, 750 and 1500 mg/kg bw",,single,"oral, gavage",,,,,,,,24 and 48 (highest dose group only) h after the treatment,bone marrow,,,,,yes,12,negative and positive controls were in accordance with the oecd guideline,dose selection was based on a dose range-finding assay.,,,,,,,,,,,,,,,,,,,,,,,,,,,,,,,,,,,,,,,,,,,,,,,,,,,,,,,,,,,,,,,,,,,,,,,,,,,,,,,,,,,,,,,,,,,,,,,,,,,,,,,,,,,,,,,,,,,,,,,,,,,,,,,,,,,,,,,,,,,,,,,,,,,,,,,,,,,,,,,,,,,,,,,,,,,,,,,,,,,,,,,,,,,,,,,,,,,,,,,,,,,,,,,,,,,,,,,,,,,,,,,,,,,,,,,,,,,,,,,,,,,,,,,,,
"2,4-diaminophenoxyethanol dihydrochloride and sulfate",OECD 494,in vivo,https://ec.europa.eu/health/scientific_committees/consumer_safety/docs/sccs_o_035.pdf,,,,,,,,,,,,,,,,,,,,,,,,,,,,,,,,,,,,,,,,,,,,,,,,,,,,,,,,,,,,,,,,,,,,,,,,,,,,,,,,,,,,,,,,,,,,,,,,,,,,,,,,,,,,,,,,,,,,,,,,,,,,,,,,,,,,,,,,,,,,,,,,,,,,,,,,,,,,,,,,,,,,,,,,,,,,,,,,,,,,,,,,,,,,,,,,,,,,,,,,,,,,,,,,,,,,,,,,,,,,,,,,,,,,,,,,,,,,,,,,,,,,,,,,,,,,,,,,,,,,,,,,,,,,,,,,,,,,,,,,,,,,,,,,,,,,,,,,,,,,,,,,,,,,,,,,,,,,,,,,,,,,,,,,,,,,,,,,,,,,,,,,,,,,,,,,,,,,,,,,,,,,,,,,,,,,,,,,,,,,,,,,,,,,,"among the animals treated with 375 mg/kg bw of 2,4-diaminophenoxyethanol HCl at the 14-16 hour time point, high percentages of nuclei with ≥5 net nuclear grains occurred in two out of three animals, and one of the responding animals had a response in only one out of three slides. in the other groups, UDS response was similar to that obtained for the vehicle control animals for both harvest times. based on the inconsistent results across animals and slides, and the observation that the response was not dose-related, the slight changes at 375 mg/kg bw were considered spurious and unrelated to the treatment.","2,4-diaminophenoxyethanol HCl was evaluated as negative in the in vivo/in vitro assay for UDS in the livers of male rats under the conditions of this study. ",,,,,> 99.5,,0120022,"test substance: 2,4-diaminophenoxyethanol HCl ",rat/ crl:cd (sd)br ,,m,4 or 6,"375, 750, and 1500 mg/kg bw",single,"oral, by gavage",2-4 h or 14-16 h ,,,,,yes,13,"rat liver in vivo/in vitro UDS assay. 2,4-diaminophenoxyethanol HCl was investigated for the induction of unscheduled DNA synthesis (UDS) in rat hepatocytes in vitro following in vivo dosing. the dose levels were selected on the basis of a preliminary toxicity study. negative and positive controls were in accordance with the OECD guideline. ",
"2,5,6-triamino-4-pyrimidinol sulfate",OECD 471,in vitro ,https://ec.europa.eu/health/scientific_committees/consumer_safety/docs/sccs_o_185.pdf,,,,,,,,,,,,,,,,,,,,,,,,,,,,,,,,,,,,,,,,,,,,,,,,,,,,,,,,,,,,,,,,,,,,,,,,,,,,,,,,,,,,,,,,,,,,,,,,,,,,,,,,,,,,,,,,,,,,,,,,,,,,,,,,,,,,,,,,,,,,,,,,,,,,,,,,,,,,,,,,,,,,,,,,,,,,,,,,,,,,,,,,,,,,,,,,,,,,,,,,,,,,,,,,,,,,,,"plates showed normal background growth up to 5000 μg/plate. toxic effects, evident as a reduction in the number of revertants, occurred in strain ta98 at ≥ 1000 μg/plate in experiment 1. there were no indications of biologically relevant increases in revertant colony numbers in any of the five strains at any concentration tested neither in the presence nor in the absence of metabolic activation. strains ta1535 and ta1537 both with and without metabolic activation showed a weak increase at all concentrations tested that was not concentration-related and within the range of the historical control data. the only exception was observed in ta1537 in the absence of s9-mix in experiment 2 where the number of colonies exceeded the threshold of thrice the number of the corresponding solvent control at concentrations of 1000 and 5000 μg/plate. therefore, a confirmatory experiment (experiment 2a) was performed with both strains. a biological relevant increase in the number of relevant colony numbers at any concentration tested was not observed.",not mutagenic in this gene mutation test in bacteria,,,,the test item was mixed with sodium sulfite (5:1) and the mixture was dissolved in deionised water ,98.67,,to312151,,"test substance: 2,5,6-triamino-4-pyrimidinol sulfate (trap) ","salmonella typhimurium ta98, ta100, ta102, ta1535 and ta1537",,experiment 1: standard plate incorporation method without and with s9-mix; experiment 2: pre-incubation method with 60 minutes pre-incubation and at least 48 h incubation without and with s9-mix,,,,"experiment 1: ta98 and ta100: 0, 33, 100, 333, 1000, 2500 and 5000 μg/plate without and with s9-mix ta102, ta1535 and ta1537: 0, 10, 33, 100, 333, 1000, 2500 and 5000 μg/plate without and with s9- mix; experiment 2: 0, 33, 100, 333, 1000, 2500 and 5000 μg/plate without and with s9-mix; experiment 2a: ta1535 and ta1537: 0, 33, 100, 333, 1000, 2500 and 5000 μg/plate without and with s9-mix",liver s9 fraction from phenobarbital/β-naphthoflavone-induced rats,,,at least 48 h,triplicates in four independent experiments,mixed with sodium sulfite (5:1) and the mixture was dissolved in deionised water,,2004,yes,2 (submission 2),"test concentrations were based on the results of a pre-experiment for toxicity and mutation induction with strains ta98 and ta100 both without and with s9-mix. toxicity was evaluated for 8 concentrations up to the prescribed maximum concentration of 5000 μg/plate on the basis of a reduction in the number of revertant colonies and/or clearing of the bacterial background lawn. since in this pre-experiment evaluable plates were obtained for five concentrations or more in all strains used, the pre-experiment is reported as experiment 1.",negative and positive controls were in accordance with the oecd guideline.,,,,,,,,,,,,,,,,,,,,,,,,,,,,,,,,,,,,,,,,,,,,,,,,,,,,,,,,,,,,,,,,,,,,,,,,,,,,,,,,,,,,,,,,,,,,,,,,,,,,,,,,,,,,,,,,,,,,,,,,,,,,,,,,,,,,,,,,,,,,,,,,,,,,,,,,,,,,,,,,,,,,,,,,,,,
"2,5,6-triamino-4-pyrimidinol sulfate",OECD 476,in vitro ,https://ec.europa.eu/health/scientific_committees/consumer_safety/docs/sccs_o_185.pdf,,,,,,,,,,,,,,,,,,,,,,,,,,,,,,,,,,,,,,,,,,,,,,,,,,,,,,,,,,,,,,,,,,,,,,,,,,,,,,,,,,,,,,,,,,,,,,,,,,,,,,,,,,,,,,,,,,,,,,,,,,,,,,,,,,,,,,,,,,,,,,,,,,,,,,,,,,,,,,,,,,,,,,,,,,,,,,,,,,,,,,,,,,,,,,,,,,,,,,,,,,,,,,,,,,,,,,,,,,,,,,,,,,,,,,,,,,,,,,,,,,,,,,,,,,,,,,,,,,,,,,,,,,,,,,,,,,,,,,,,,,,,,,"in the first experiment, precipitation was observed at ³ 600 μg/ml in the absence and at 1200 μg/ml in the presence of metabolic activation. in the second experiment, precipitation occurred at ≥ 600 μg/ml. toxic effects were observed at precipitating concentrations of both main experiments without s9-mix; no substantial toxic effect was observed with s9-mix at any tested concentration. however, the recommended toxic range of approximately 10-20% survival compared to the concurrent negative controls was covered in experiment 2 but not always in experiment 1. the quality of the performance of experiment 1 did not allow a conclusion. consequently the results of experiment 1 are considered inconclusive. in the second experiment with 24 h treatment without s9-mix, an increase in mutant frequency at the highest tested concentration, 3.1 and 1.8 fold above the control values in the two cultures respectively, was observed. this increase, however, was not considered valid since it occurred at precipitating concentrations. particularly, during long-term treatment precipitates tend to damage cells by mechanical shear forces","under the test conditions used, the results for 2,5,6-triamino-4-pyrimidinol sulfate in this in vitro gene mutation test in mammalian cells is considered inconclusive",,,,test item was mixed with sodium sulfite (5:1) and the mixture was dissolved in deionised water,98.67,,to312151,"test substance: 2,5,6-triamino-4-pyrimidinol sulfate (trap)",mouse lymphoma cell line L5178Y (tk+/- ),,,,duplicates in two independent experiments,"experiment 1: 0, 75, 150, 300, 600 and 1200 μg/ml; experiment 2: 0, 37.5, 75, 150, 300 and 600 μg/ml",liver s9 fraction from phenobarbital/β-naphthoflavone-induced rats,,,experiment 1: 4 h treatment with and without s9-mix + expression period 72 h + selection period of 10-15 days; experiment 2: 24 h treatment without s9-mix + expression period 72 h + selection period of 10-15 days,mixed with sodium sulfite (5:1) and the mixture was dissolved in deionised water,"in experiment 1, the result without s9-mix is equivocal and an intermediate concentration should be tested for clarification (i.e. repetition with narrow spacing of the higher concentrations). in experiment 1, sufficient toxicity at the maximum concentration tested was not reached",2004,yes,1 (submission 2),"test concentrations were based on the results of a pre-test on toxicity measuring suspension grow at the end of the growth period. on the pre-test, toxic effects were observed at ³ 600 μg/ml (4 and 24 hour treatment) in the absence of metabolic activation and at ³ 1200 μg/ml (4 h treatment) in the presence of metabolic activation",negative and positive controls were in accordance with the OECD guideline.,,toxicity was measured in the main experiments as percentage total growth of the treated cultures relative to the total growth of the solvent control cultures. to discriminate between large (indicative for mutagenic effects) and small colonies (indicative for a clastogenic effect) colony sizing was performed.,,,,,,,,,,,,,,,,,,,,,,,,,,,,,,,,,,,,,,,,,,,,,,,,,,,,,,,,,,,,,,,,,,,,,,,,,,,,,,,,,,,,,,,,,,,,,,,,,,,,
"2,5,6-triamino-4-pyrimidinol sulfate",OECD 476,in vitro ,https://ec.europa.eu/health/scientific_committees/consumer_safety/docs/sccs_o_185.pdf,,,,,,,,,,,,,,,,,,,,,,,,,,,,,,,,,,,,,,,,,,,,,,,,,,,,,,,,,,,,,,,,,,,,,,,,,,,,,,,,,,,,,,,,,,,,,,,,,,,,,,,,,,,,,,,,,,,,,,,,,,,,,,,,,,,,,,,,,,,,,,,,,,,,,,,,,,,,,,,,,,,,,,,,,,,,,,,,,,,,,,,,,,,,,,,,,,,,,,,,,,,,,,,,,,,,,,,,,,,,,,,,,,,,,,,,,,,,,,,,,,,,,,,,,,,,,,,,,,,,,,,,,,,,,,,,,,,,,,,,,,,,,,"precipitation was observed at 350 μg/ml and above in experiment 2 with s9-mix. the appropriate levels of toxicity (10-20% relative survival after the highest concentration) were reached in experiment 1 in both cultures with s9-mix only and in experiment 2 in one culture without s9-mix and in both cultures with s9-mix. in both experiments, a biologically relevant increase in the mutant frequencies was not observed, both in the presence and absence of s9-mix. in experiment 2, the induction factor of three times the mutant frequency of the corresponding solvent control was reached in one culture treated with 350 μg/ml with s9- mix. however, this increase was not reproduced in the second culture and was therefore considered as biologically irrelevant. the mean value of both cultures did not reach the threshold of 3 times the value of the concurrent control. ",not mutagenic in this gene mutation assay with mouse lymphoma cells using the hprt locus as reporter gene,,,,,100,,712171,"test substance: 2,5,6-triamino-4-pyrimidinol sulfate (trap)",l5178y mouse lymphoma cells (hprt locus),,,,duplicate cultures in two independent experiments,"experiment 1: 0, 21.9, 43.8, 87.5, 175 and 350 μg/ml without and with s9-mix; experiment 2: 0, 21.9, 43.8, 87.5, 175 and 350 μg/ml without s9-mix and 0, 87.56, 175, 350, 525 and 700 μg/ml with s9-mix",liver s9 fraction from phenobarbital/β-naphthoflavone-induced rats,,,experiment 1: 4 h treatment with and without s9-mix + expression period 72 h + selection period of 10-15 days; experiment 2: 4 h treatment with s9-mix + expression period 72 h + selection period of 10-15 days; 24 h treatment without s9-mix + expression period 72 h + selection period of 10-15 days,deionised water,,2009,yes,1 (submission 3),"test concentrations were based on the results of a pre-test on toxicity measuring suspension grow at the end of the growth period with concentrations up to 1400 μg/ml limited by the solubility of 2,5,6-triamino-4-pyrimidinol (sulfate salt).",negative and positive controls were in accordance with the OECD test guideline.,,toxicity was measured in the main experiments as percentage suspension growth and total growth of the treated cultures relative to the suspension growth and total growth of the solvent control cultures.,,,,,,,,,,,,,,,,,,,,,,,,,,,,,,,,,,,,,,,,,,,,,,,,,,,,,,,,,,,,,,,,,,,,,,,,,,,,,,,,,,,,,,,,,,,,,,,,,,,,
"2,5,6-triamino-4-pyrimidinol sulfate",OECD 474,in vivo,https://ec.europa.eu/health/scientific_committees/consumer_safety/docs/sccs_o_185.pdf,,,,,,,,,,,,,,,,,,,,,,,,,,,,,,,,,,,,,,,,,,,,,,,,,,,,,,,,,,,,,,,,,,,,,,,,,,,,,,,,,,,,,,,,,,,,,,,,,,,,,,,,,,,,,,,,,,,,,,,,,,,,,,"all mice treated with 1250 mg/kg bw showed reduction of spontaneous activity and ruffled fur. moreover, the bedding of the animals showed signs of orange urine, indicating that the test item was bioavailable. at 312.5 and 625 mg/kg bw no toxic reactions were observed but after 24 h the bedding of the animals showed signs of orange urine. the mean number of polychromatic erythrocytes was not decreased after treatment with the test item as compared to the mean value of PCEs of the vehicle control indicating that 2,5,6-triamino-4-pyrimidinol sulfate had no cytotoxic properties in the bone marrow. a biologically relevant increase in the number of cells with micronuclei was not found at any concentrations tested in either males or females at 24 h and 48 h harvest time-points. ",,no (main test),"did not induce micronuclei in the micronucleus test in the bone marrow cells of mice and, consequently, 2,5,6-triamino-4-pyrimidinol sulphate is not clastogenic and/or aneugenic in bone marrow cells of mice",,,,,98.67,,to312151,,"test substance: 2,5,6-triamino-4-pyrimidinol sulphate (trap)",mouse/nmri,,,f & m,,10,"0, 312.5, 625 and 1250 mg/kg bw",,single dose,oral,,,,,,,deionised water,24h and 48h (highest dose only),bone marrow,,stained with may-grünwald/giemsa and examined microscopically for the PCE/TE ratio and micronuclei,,2005,yes,3 (submission 2),"test concentrations were based on a pre-experiment on acute toxicity with 2 mice per sex. the mice were treated orally and examined for acute toxic symptoms at various intervals of 1, 2-4, 6, 24, 30 and 48 h after start of treatment. in the pre-test at 1500 mg/kg bw one female mouse died after 24 hours. moreover there were clear toxic reactions such as reduction of spontaneous activity and ruffled fur, and occasionally also abdominal position, eyelid closure, apathy and tremors. at 1250 mg/kg bw toxic reactions such as reduction of spontaneous activity and ruffled fur were also observed; at 750 mg/kg bw only ruffled fur was observed. based on these findings 1250 mg/kg bw was chosen as the maximum dose",,,,,,,,,,,,,,,,,,,,,,,,,,,,,,,,,,,,,,,,,,,,,,,,,,,,,,,,,,,,,,,,,,,,,,,,,,,,,,,,,,,,,,,,,,,,,,,,,,,,,,,,,,,,,,,,,,,,,,,,,,,,,,,,,,,,,,,,,,,,,,,,,,,,,,,,,,,,,,,,,,,,,,,,,,,,,,,,,,,,,,,,,,,,,,,,,,,,,,,,,,,,,,,,,,,,,,,,,,,,,,,,,,,,,,,,,,,,,,,,,,,,,,,,,,
n-methyl-2-pyrrolidone (NMP),non OECD,in vitro ,https://ec.europa.eu/health/scientific_committees/consumer_safety/docs/sccs_o_050.pdf,,,,,,,,,,,,,,,,,,,,,,,,,,,,,,,,,,,,,,,,,,,,,,,,,,,,,,,,,,,,,,,,,,,,,,,,,,,,,,,,,,,,,,,,,,,,,,,,,,,,,,,,,,,,,,,,,,,,,,,,,,,,,,,,,,,,,,,,,,,,,,,,,,,,,,,,,,,,,,,,,,,,,,,,,,,,,,,,,,,,,,,,,,,,,,,,,,,,,,,,,,,,,,,,,,,,,,,,,,,,,,,,,,,,,,,,,,,,,,,,,,,,,,,,,,,,,,,,,,,,,,,,,,,,,,,,,,,,,,,,,,,,,,,,,,,,,,,,,,,,,,,,,,,,,,,,,,,,,,,,,,,,,,,,,,,,,,,,,,,,,,,,,,,,,,,,,,,,,,,,,,,,,,,,,,,,,,,,,,,,,,,,,,,,,,,,,,,,,,,,,,,,,,,,,,,,,,
