dossier,"Guideline (OECD XXX, non OECD)",PDF link,OECD test nr,observations,critical effect,point of departure (pod),description of pod ,target organ,secondary target organ ,moribound or dead animals prior to study termination,mortality rate,conclusion,homogeneity and stability ,treatment prior to application,pH,"physical form (solid, liquid, aerosol, dust)",concentration (%),composition,purity (%),particle size and procedure,solubility in vehicle,chemical batch nr,additional info,"type of study ( in vivo, in vitro, in silico, in chemico)",species/strain,source,"age at start of experiment( days, weeks, months, years)","age measuring unit (day, week, month, year)","sex (female, male)",feed,weight,"weight measuring unit (gram, kilogram)",n animals / group,dose levels,dose level unity (or extra info),dose volume ml/kg bw,administration scheme,"oral ( gavage, diet, water, intubation)",dermal,"patching technique (open, semi-occluded, occluded)","body surface (cm2, %)",skin condition,area of body,"inhalation ( nose head) - only, whole body)",other,rinsing,vehicle name ,vehicle concentration %,sampling ,observation period day ,exposure period + recovery period days,year,GLP,SCCS comment to test,Ref. in dossier,preliminary test ,control group + satellite group,klimisch score,Study duration,additional information,own comments,"changes in skin, fur, eyes, mucous membranes",secretions and excretions," autonomic activity ( lacrimination, piloerection, pupil size, unusual respiratory pattern)","changes in gait, posture and response to handling;  ; ",clonic or tonic movement;,stereotypies,bizzare behavious;," sensor activity, grip strength; assessment of motor activity",body weight and food/water consumption,satellite group ,haematocrit,haemaglobin concentration,erythrocyte count,total and differential leucocyte count,patelet count,measure of blood clotting time/potential,blood samples,sodium,potassium,glucose,total cholesterol, urea,creatinine,total protein,albumin,alanine aminotransferase,aspartate aminotransferase,alkaline phosphatase,gamma glutamyl transpeptidase,sorbitol dehydrogenase,other enzymes and bile acids,appearance,volume,osmolarity or specific gravity,pH,protein,glucose,blood/blood cells,calcium,phosphate,fasting triglycerides,hormones,methaemoglobine,cholinesterase,other,all gross lesions, brain,spinal cord,stomach,small and large intestines,liver,kidneys, adrenals, spleen,heart,thymus,thyroid,trachea,lungs, gonads,accessory sex organs,urinary bladder,lymph nodes,peripheral nerve,bone marrow,other organs,histopathology,critical effect,point of departure (pod),description of pod ,target organ,moribound or dead animals prior to study termination,mortality rate,conclusion,homogeneity and stability ,treatment prior to application,pH,"physical form (solid, liquid)",achieved concentration (%),composition,purity (%),vehicle,chemical batch nr,additional info,rodent species/strain,source,"age at start of experiment( days, weeks, months, years)","age unit (day, week, month, year)","sex (female, male)",housing and feeding,weight,"weight unit (gram, kilogram)",n animals / group,number of satellite group,actual dose levels,dose level unit,dose volume ml/kg bw,"repeated administration scheme (5days/week, 7days/week)",gavage,diet,drinking water ,"duration of exposure (14 days, 28 days)",recovery period (day),year,GLP,SCCS comment to test,Ref. in dossier,limit test ,control group ,klimisch score,
"1,2,4-trihydroxybenzene ",OECD ,https://ec.europa.eu/health/sites/health/files/scientific_committees/consumer_safety/docs/sccs_o_113.pdf,408,"animals were observed daily for mortality, clinical signs and water consumption. examinations of individual animals for signs of reaction to treatment was carried out daily immediately after dosing, and approximately 1 and 3 hours after dosing during the first 3 weeks of the study. following evaluation of these observations were subsequently performed at approximately 15 minutes and 1 and 2 hours after dosing until the end of the study. once before commencement of treatment and weekly thereafter, each animal was subjected to a detailed clinical examination including an evaluation of neurotoxicity. body weight and food intake was recorded weekly. an ophthalmological investigation was performed before the start of the study and in week 12. the motor activity of the first 5 males and 5 females was measured once during week 12 of treatment. haematology, blood clinical chemistry and urinalysis were performed in week 13 of treatment. at the end of the treatment period, all animals were killed and subjected to macroscopic examination. selected organs were weighed. microscopic examination was performed for specified tissues and organs from all decedent rats, control and high dose rats killed at the end of the study, as well as for gross anomalies and lungs from all animals. piloerection and salivation were observed in animals treated with 100 and 200 mg/kg bw/day. an overall slight reduction in body weight gain was evident in treated males in comparison with controls from approximately one month of treatment. furthermore, a 14% decrease in food consumption was found in week 13 in high dose males (200 mg/kg bw/day). these results were not observed in treated females. a statistically significant increase in mean red blood cell volume, mean corpuscular haemoglobin and platelets and a statistically significant decrease in haematocrit, red blood cell count and haemoglobin were observed in animals treated with 100 and 200 mg/kg bw/day, when compared with controls of the study, although values remained within the normal range for this strain. a statistically significant increase in bilirubin was observed in animals of the high dose group of both sexes. the authors attribute this to the colour of the test compound interfering with the methodology used. in addition, no toxicological significance was given to the statistically significant increase in urea seen in treated females only. statistically significant increases in the absolute weight and/or organ-to-body weight ratio were observed: - in treated males at the following dose levels: spleen – all dose levels; liver and kidney 100 and 200 mg/kg bw/day; testes and heart  200 mg/kg bw/day; - in females for the liver, spleen and kidneys at 200 mg/kg bw/day. ulcerations were observed in the non-glandular gastric region of 1/10 males and 1/11 females of the high dose group and in 1/14 males of the intermediate dose group at termination of the study. the histopathological evaluation of the stomach in the remaining animals of the intermediate dose group did not reveal any further treatment-related gastric lesions. dark brown, microgranular pigmentation was clearly evident in single cells or in the lumen of renal cortical tubes of 10/15 males and 10/15 females of the high dose group and in 2/15 males and 1/15 females of the intermediate dose group. ",,50,loael mg/kg bw/d,,,yes,"twelve unscheduled deaths occurred during the course of the study. these included 1 male in each of the control, low- and intermediate-dose groups and 5 males and 4 females of the high-dose group. microscopic examination indicated that the reason for death in animals of the first three groups was possibly due to mis-dosing. for the high dose animals, the main cause of death was considered to be due to stomach ulcerations.",the investigators deduced a no observed adverse effect level of 50 mg/kg bw/day. ,,,,,,,,,,502124,"test substance: Imexine OAM - 1,2,4-trihydroxybenzene dissolved in water, daily freshly prepared in the dark under nitrogen ",in vivo,rat/han wistar ,,,,f & m,,,,30,"50, 100 and 200",mg/kg bw/day ,,daily,"yes, gavage",,,,,,,,,,,,90 days,,,yes,"sccs concluded that no noael can be derived in this study. the content of the test solution has been analysed thrice for 1,2,4-trihydroxybenzene (day 1, week 4, week 13). however, no data on purity were given in this report or in the analytical file. the analytical file stated ""in accordance with the specification – one main spot” for batch 0502124. the data on toxicokinetics were scheduled for day 1 of treatment and week 13 of treatment using satellite groups of animals. according to the investigators “analyses, carried out by the analytical chemistry department at rtc, gave unreliable or negative results and are not reported”. no further explanations were given. ",6,,four additional satellite groups of 6 males and 6 females were included in the study to obtain blood samples for toxicokinetic analysis on day 1,3,,"submission VI( https://ec.europa.eu/health/sites/health/files/scientific_committees/consumer_safety/docs/sccs_o_222.pdf): a NOAEL of 50 mg/kg bw/day (90-day, oral, rat) was proposed by the applicant. the SCCS disagreed with this since the relative organ weight was increased significantly in the spleen of male rats treated with 50 mg/kg bw/day. this increase continued dose dependently in male rats treated with either 100 or 200 mg/kg bw/day. the absolute organ weight of the spleen also increased in male rats but this increase was not significant at the dose of 50 mg/kg bw/day. therefore, the dose of 50 mg/kg bw/day was considered as Lowest Observed Adverse Effect Level (LOAEL).",,,,,,,,,,,,,,,,,,,,,,,,,,,,,,,,,,,,,,,,,,,,,,,,,,,,,,,,,,,,,,,,,,,,,,,,,,,,,,,,,,,,,,,,,,,,,,,,,,,,,,,,,,,,,,,,
phenoxyethanol,non OECD,https://ec.europa.eu/health/scientific_committees/consumer_safety/docs/sccs_o_195.pdf,,"body weights were recorded on days 1, 5, and 10 of treatment. at necropsy, blood samples for haematological measurements samples for urinalysis and representative sections of organs for histopathological analysis were taken and preserved. signs of toxicity were characterised by anorexia, lethargy and excretion of dark-red urine. on day 5, mean body weights of rabbits dosed with 100, 300, or 600 mg/kg bw/day had decreased approximately 8% from their preexposure weights and 10-14% from that of control animals. on day 10, rabbits in the 100 and 300 mg/kg/day dose groups continued to show similar decreases in body weight. in general, rabbits exposed to 2-phenoxyethanol had decreased rbc count, hgb concentration and pcv, with concurrent increases in nucleated and poly-chromatophilic red blood cells. many animals exhibiting severe depressions in rbc numbers also showed concurrent increases in mch, mchc, platelets and wbc. the values for mch and mchc were considered elevated due to free haemoglobin in plasma. urine samples collected from rabbits in the 1000, 600 and 300 mg/kg/day dose groups exhibited decreased pH in combination with elevated levels of protein, bilirubin, urobilirubin and haemoglobin. decreases in urinary pH and increases in urinary bilirubin and rbc were observed in at least one rabbit in the 100 mg/kg/day dose group. most rabbits administered 1000 or 600 mg/kg bw/day exhibited gross pathological alterations consistent with haemolytic anaemia including enlarged and dark kidneys and spleen, dark urine in the urinary bladder, and dark urine staining the perineal region. conversely, rabbits gavaged with 100 or 300 mg/kg bw did not have treatment-related gross lesions. treatment-related microscopic changes were observed in rabbits from all dose levels. splenic microscopic changes included red pulp congestion and erythro-phagocytosis in most animals of both high dose groups. treatment-related microscopic changes also occurred in the kidneys and stomach of both high-dose groups. the spleen of one rabbit in the 300 mg/kg/day dose group had thrombi in venous sinuses resulting in generalised splenic necrosis. this animal also had thrombi within pulmonary blood vessels. two rabbits given 100 mg/kg/day had splenic extramedullary haematopoiesis. ",,100,loael  mg/kg bw/d ,,haematopoietic system ,yes,"during the 10-day treatment period, deaths occurred in all dose groups above 100 mg/kg bw/day or animals were sacrificed moribund.",,,,,,,,,,,,,in vivo,rabbit/new zealand white ,,,,f,,3 -4.5,kg,3,"100,300,600,1000",mg/kg bw/day ,,single administration ,"yes, gavage",,,,,,,,,,,, <90 days ,10 ,,no,"in conclusion, in this study with rabbits orally exposed by gavage for 10 days, the LOAEL is 100 mg/kg bw day. for the understanding of this opinion, it is important to note that haematotoxicity in rabbits is caused by the parent compound when systemically available but not by the main metabolite 2-phenoxy acetic acid, which may be responsible for toxicity to the kidney",12,,control rabbits (6 females distilled water administered) exhibited a slight gain in mean body weight over the 10-day dosing period.,3,,,,,,,,,,,,,,,,,,,,,,,,,,,,,,,,,,,,,,,,,,,,,,,,,,,,,,,,,,,,,,,,,,,,,,,,,,,,,,,,,,,,,,,,,,,,,,,,,,,,,,,,,,,,,,,,,,
phenoxyethanol,OECD ,https://ec.europa.eu/health/scientific_committees/consumer_safety/docs/sccs_o_195.pdf,412,"on exposure days, the clinical examination was performed before, during and after exposure. body weight and food consumption were determined at the start of the exposure period, on day 7 and on day 13. at study termination, clinical-pathological examinations of the blood, gross necropsy, measurement of organ weights and histopathological examinations of selected organs were conducted (liver, kidneys, adrenals, testes, thymus, spleen, lung).low inhalation toxicity, decreased body weight gain (females only) and food consumption (males and females) were observed in animals exposed to 1000 mg/m³ of 2-phenoxyethanol. there were no treatment-related changes in clinical chemistry or haematology and no treatment related histopathological changes indicative of systemic toxicity. morphological changes such as minimal to slight degeneration/squamous metaplasia, hyperplasia/hypertrophy and minimal to slight inflammatory cell infiltrates were noted, indicating irritation potential in the nasal cavity, larynx and lung in mid- and high-dose animals. lung weights were increased in mid- and high-dose males. ",decreased body weight gain and food consumption,34.4 ,noaec  mg/m3/day,"nasal cavity, larynx and lung ",,no,,the noaec for local effects in upper airways and lung was determined to be 48.2mg/m3/day ,,,,liquid ,,,> 99.9,aerosol,,41183068,,in vivo,rat/wistar,,,,f & m,,,,10,"0,40,200, 1000 ","mg/m3, mean measured concentration 48.2, 246, 1070 mg/m3",,"6h/day,5d/week ",,,,,,,"yes, nose/head only",,,air,,,<90 days  (14d),14 d,2007,yes,no data on lung lavage is available. the noaec derived should be multiplied with a factor of 5/7 in order to take into account the intermittent exposure (5 days a week). an adjusted noaec of 34.4 mg/m3/day may be used.,3,,a concurrent control group was exposed to conditioned air,2,,,,,,,,,,,,,,,,,,,,,,,,,,,,,,,,,,,,,,,,,,,,,,,,,,,,,,,,,,,,,,,,,,,,,,,,,,,,,,,,,,,,,,,,,,,,,,,,,,,,,,,,,,,,,,,,,,
phenoxyethanol,OECD,https://ec.europa.eu/health/scientific_committees/consumer_safety/docs/sccs_o_195.pdf,408,"in-life findings: survival was unaffected by treatment. there was no difference between untreated and treated animals in general behaviour up to and including 10000 ppm in diet. food and water consumption and body weight increase in treated animals were comparable to controls throughout the study. the functional observational battery, locomotor activity and grip strength testing showed no treatment-related effects. therefore, no further neuropathological examinations were performed in animals from the satellite groups. terminal examinations: a statistically significant reduction in the mchc was observed in males at 10,000 ppm and at all doses in females of the main group at week 13. these changes were marginal (<3% decrease relative to controls) and not dose-related. therefore, they were not considered treatment-related. no difference in mchc was observed in animals in the recovery groups. a statistically significant increase in mcv was observed in females at 500 ppm and 10,000 ppm. these changes were also minimal (<4% decrease relative to controls), and there was no evidence of a dose-response. no difference in mcv was observed in recovery group animals. no changes were observed in any of the other red blood cell parameters in either males or females hgb, hct, mch and reticulocytes (retic). leucocyte counts and differential blood count showed no treatment-related changes in main and recovery groups. the statistically significant decreases observed for males in leucocytes and lymphocyte counts at 2,500 ppm and 10,000 ppm can be attributed to relatively high values in the control group and were not considered to be treatment-related. alat was statistically significantly increased in males at 10,000 ppm but not in females. since no histopathological changes in liver or other observations suggesting liver toxicity were observed in high-dose males, and no increase in alat or liver histopathology was observed in females, this observation was considered to be incidental. at the end of the treatment period, plasma triglycerides (at 500 ppm in males) calcium (at 500 ppm in females), and chloride (at 10,000 ppm in females) were statistically significantly increased whereas cholesterol (at 10,000 ppm in females), protein (at 10,000 ppm in females) and albumin (at 10,000 ppm in females) were statistically significantly decreased. these statistically significant differences relative to controls were slight (<10%), showed no clear dose-response relationship, were predominantly in the range of historical values, and were therefore considered not to be treatment-related. t4 was statistically significantly increased in females at 10,000 ppm. after the recovery period, t3 was statistically significantly increased in males and decreased in females at 10,000 ppm. however, all values were in the range of historical control values. in addition, deviations from control values were small and not consistent for both sexes. therefore, they are considered to be of no biological relevance. determination of enzymatic activity in liver tissue samples showed statistically significant increases as well as decreases for n-demethylase at 2500 ppm, o-demethylase at ≥ 500 ppm and cyp at ≥ 2,500 ppm in males at the end of treatment. in females, statistically significant increases were observed at 10,000 ppm for O-demethylase and cyp. no effects on these parameters were seen in recovery group animals. these observations showed no dose-response and were predominantly in the range of historical controls. they can be considered to reflect induction of liver enzymes but they do not reflect liver injury. at the end of the treatment period, some absolute organ weights were increased, but not in the highest dose group. since there were no histopathological findings pointing to any treatment-related effect in these organs, these differences relative to the controls were considered not to be indicative of organ-related toxicity. there was no evidence of treatment-related effects on histopathology in any of the tissues evaluated. there were no treatment-related ophthalmological findings.",,939; 697 ,"noael, mg/kg bw/day, in females; in males",,,no,,"no evidence of tretmeant-related adverse effects was observed, the noael for 2-phenoxyethanol was therefore concluded to be 10,000 ppm in diet",adequate homogenity was verified,,,,,,99.9,,,n0119,analytical data verified that the test material content in diet was within acceptable limits of the target concentrations (97-111%);,in vivo,rat/wistar-hsdcpb:wu,,,,f & m,,,,20,"0, 500, 2500, 10000","ppm, corresponding to 34.0, 169.0, and 697.0 mg/kg bw/day in males and 50.2, 233.8, and 938.8 mg/kg bw/day in females",,single,"yes, diet",,,,,,,,,diet,,,90 days ,90  + 28 ,2002,yes,"the sccs noted that in both the control groups and in all treatment groups, parameters of food intake, water intake and body weight gain declined during the study and persisted during the recovery period. these unusual data are not commented upon and not explained. it is assumed that the animals of this study were ill, potentially due to an infection. the study is considered of limited value and not reliable.",10,,"10 animals/ dose in satellite and satellite recovery group for 4 weeks, control groups of males and females received diet alone. recovery group animals were given diet containing 0 or 10000 ppm 2-phenoxyethanol for 90 days followed by a four- week recovery period.",2,,,,,,,,,,,,,,,,,,,,,,,,,,,,,,,,,,,,,,,,,,,,,,,,,,,,,,,,,,,,,,,,,,,,,,,,,,,,,,,,,,,,,,,,,,,,,,,,,,,,,,,,,,,,,,,,,,
